new_id,ori_id,speaker,utterance,note
n_id.140,o_id.106,수석전문위원 허태수,"부칙에다가 제2조를 신설해 가지고 ""제4조의4의 개정규정은 이 법 시행 후 최초로 신청하는 사업시행인가부터 적용한다"" 이렇게, 부칙 제2조를 신설한다.",
n_id.141,o_id.107,이미경 위원,그전에 했던 데는 또 억울하겠구먼.,
n_id.142,o_id.108,김관영 위원,"8페이지에 나와 있는 겁니까? 어디에 나와 있어요, 그게? 지금 나눠 주는 거예요?",
n_id.143,o_id.109,수석전문위원 허태수,예. ,
n_id.144,o_id.110,김관영 위원,그러면 빨리빨리 나눠 줘야지. 지금 다 통과되기 직전에 이것을 나눠 주면서 하면 어떻게 해.,
n_id.145,o_id.111,이미경 위원,며칠 전에 했던 데는 손해를 본다고 생각하는 형평성 문제도 또 있을 것 같기는 한데.,
n_id.146,o_id.112,소위원장 박기춘,그것은 어떻게 할 거예요? 지금 말씀하신 지적이 맞는데.,
n_id.147,o_id.113,국토교통부제1차관 박기풍,"저희 국토부 입장에서는 사업 단계에 따라서 용적률 완화를 적용하지 않고 지자체가 자율적으로 판단해서 하는 것이, 이노근 의원님 안이 원칙적으로 맞다고 생각합니다. 그것은 이렇게 제한을 두지 말고. ",
n_id.148,o_id.113,국토교통부제1차관 박기풍,그러나 이노근 위원님도 오늘 와서 판단을 하셔 보니까 이미 결정됐으니까 권리관계가......,
n_id.149,o_id.114,이미경 위원,"아니, 이건 둬야 돼. 그러면 복잡해져요.",
n_id.150,o_id.115,국토교통부제1차관 박기풍,권리 관계가 복잡하니까 이렇게 기준을 정하는 것은 저희도 일리 있다고 봅니다.,
n_id.151,o_id.116,소위원장 박기춘,"이노근 위원이 여당의원이라서 맞다고 그러는 것 아니에요, 차관? 그것은 아니지요?",
n_id.152,o_id.117,국토교통부제1차관 박기풍,아니요.,
n_id.153,o_id.118,이노근 위원,아니에요. 지난번에 전문위원이 저한테 그러더라고. 보니까 그게 맞겠더라고. 왜냐하면 시행인가를 일주일 전에 받았단 말이야. 그런데 또 6개월 전에 받았어. 사업 시행되고 있는데 이렇게 하면 대혼란이 와요. 그래서 이것은 불가피한 측면이 있다고 봐요. ,
n_id.154,o_id.119,소위원장 박기춘,그렇게 정리하겠습니다. ,
n_id.155,o_id.119,소위원장 박기춘,다소 만족스럽지 않은 부분도 있고......,
n_id.156,o_id.120,오병윤 위원,주거지역에 제한한다는 것은 받는 겁니까? ,
n_id.157,o_id.121,이노근 위원,"예, 맞아요.  ",
n_id.158,o_id.122,소위원장 박기춘,"예, 지적하실 것 지적하십시오.  ",
n_id.159,o_id.123,오병윤 위원,어쨌든 저는 반대의견 제출합니다. ,
n_id.160,o_id.124,수석전문위원 허태수,소수의견으로 정리하겠습니다. ,
n_id.161,o_id.125,이미경 위원,나도 소수의견에 넣어 주세요.  ,
n_id.162,o_id.126,소위원장 박기춘,"소수의견이 너무 많으면 안 되는데, 전례가 깨지는데.",
n_id.163,o_id.126,소위원장 박기춘,이미경 위원은 기권하시는 것으로 하십시오.,
n_id.164,o_id.127,이미경 위원,예.  ,
n_id.165,o_id.128,소위원장 박기춘,소수의견이 있기는 합니다마는 그래도 더 많은 위원들의 의견이 본회의에 부의하지 않고 지금까지 심사한 결과를 반영해서 하나의 위원회 대안으로 제안을 하는 데 있어서 동의가 된 것 같습니다. 그렇지요? 일부 반대가 있습니다만.,(｢예｣ 하는 위원 있음)
n_id.166,o_id.128,소위원장 박기춘,"이노근 위원님께서는 앞으로는 오늘처럼 이렇게 차분하게 잘 이해, 설득을 시키시고 그렇게 하세요. 막 소리지르고 그렇게 하지 마시고, 전체회의에서도. 예? ",
n_id.167,o_id.128,소위원장 박기춘,  (웃음소리),
n_id.168,o_id.128,소위원장 박기춘,"그렇게 하실 거예요, 안 하실 거예요?",
n_id.169,o_id.129,이노근 위원,알겠습니다. ,
n_id.170,o_id.130,소위원장 박기춘,가결되었음을 선포합니다. ,
n_id.171,o_id.131,소위원장 박기춘,다음은 의사일정 4항입니다.,
n_id.172,o_id.131,소위원장 박기춘,공익사업을 위한 토지 등의 취득 및 보상에 관한 법률 일부개정법률안을 상정합니다. ,
n_id.173,o_id.131,소위원장 박기춘,"수석전문위원, 보고해 주시기 바랍니다.",
n_id.174,o_id.132,이미경 위원,"아니요, 잠깐만. 지금 이노근 의원 것 방망이 쳤습니다. ",
n_id.175,o_id.133,소위원장 박기춘,"예, 그래요. 미안합니다.  ",
n_id.176,o_id.134,이미경 위원,"이미경 의원 것은 그냥 하나 추가된 건데, 받겠습니다.",
n_id.177,o_id.135,소위원장 박기춘,"예, 그러면 이미경 의원안도 수정한 부분은 수정한 대로, 기타 부분은 원안대로 의결하고자 하는데 이의 있으십니까? ",(｢없습니다｣ 하는 위원 있음)
n_id.178,o_id.135,소위원장 박기춘,이의가 없기 때문에 가결되었음을 선포합니다. ,
n_id.179,o_id.135,소위원장 박기춘,다음 김관영 의원안 남은 거지요? 이것도 마찬가지지요?,
n_id.180,o_id.136,이미경 위원,하나 있습니다. ,
n_id.181,o_id.137,소위원장 박기춘,말씀하십시오. ,
n_id.182,o_id.138,이미경 위원,"8쪽 수정의견에 ""효력을 가진다. 다만, 2014년 1월 31일까지 관리처분계획의 인가를 받은 경우는 유효기간 연장대상에서 제외한다."" 이렇게 돼 있거든요. ",
n_id.183,o_id.138,이미경 위원,그런데 관리처분을 받고 있으면서도 지금 아직 이행이 안 되고 왈가왈부하는 데가 많습니다. 왜냐하면 이 조사가 늦게...... 막 시작이 되는데 조사는 또 조사대로 되고 해 가지고는 이런 일이 있기 때문에 그냥 관리처분하는 경우를 넣지 말고 철거가 시작된 이후부터는 안 되는 것으로 하면 좋겠습니다.,
n_id.184,o_id.139,소위원장 박기춘,"정부, 어떻겠습니까? 별 문제 없을 것 같은데?",
n_id.185,o_id.140,국토교통부제1차관 박기풍,저희 입장에서는 일응......,
n_id.186,o_id.141,소위원장 박기춘,그렇게 하시지요. 여당에서도 좀......,
n_id.187,o_id.142,김관영 위원,그런데 이게 철거 시점을 명확하게 할 수는 있어요?,
n_id.188,o_id.143,국토교통부주택정책관 김재정,주택정책관 답변드리겠습니다. ,
n_id.189,o_id.143,국토교통부주택정책관 김재정,건축법에 의해서 철거신고라는 제도가 있습니다. 그래서 그것을 인용을 하면 됩니다.,
n_id.190,o_id.144,김관영 위원,오케이. 그러면 아예 그 문장은 그렇게 해야 되겠네요?,
n_id.191,o_id.145,국토교통부제1차관 박기풍,"예, 건축법 제36조에 의한......",
n_id.192,o_id.146,이미경 위원,철거신고를 하면 그것은 누가 도장을 찍지요?  ,
n_id.193,o_id.147,국토교통부주택정책관 김재정,시장·군수·구청장이 도장을 찍습니다. ,
n_id.194,o_id.148,오병윤 위원,신고하고 시행하고는 어떤 차이가 있나요?,
n_id.195,o_id.149,소위원장 박기춘,"잠깐, 이노근 위원님 말씀하십시오, 김관영 의원안에 대해서.",
n_id.196,o_id.150,이노근 위원,이게 1년 연장하는 거지요?,
n_id.197,o_id.151,김관영 위원,예.  ,
n_id.198,o_id.152,이노근 위원,저는 원칙적으로 반대하는 것은 아닌데 상당히 우려되는 면을 하나 얘기하고 넘어가겠습니다. ,
n_id.199,o_id.152,이노근 위원,"뭐냐 하면, 1년을 연장하면 찬반논쟁 분쟁이 그대로 1년이 같이 연장이 돼요. 그러니까 이게 누구하고 분쟁이 되냐 하면 찬성파하고 비대위가 있잖아요. 그래서 이것에 대해서 예측을 해서 국토부나 자치단체에서는 이것에 대한 심사숙고를 해야 될 거예요, 그 대책을. 상당히 분쟁을 초래할 거거든요, 이제 이게 끝나서 다시 재개를 하려고 그랬는데 이 문제가 나와서 1년 연장하니까. 그래서 그것은 좀 고려를 해야 될 것 같습니다.",
n_id.200,o_id.153,이미경 위원,"그런데 사실 연장하는 것은 정부가 내놔야 되는 안이에요. 현재 보면 야당 의원이 막...... 실제로는 이렇게 문제를 벌여 놓은 것은 다 정부이고 한나라당 정부 때 다 했던 건데 지금 문제가 이렇게 되고 있는 것을 수습해 나가는 설거지 역할을 그냥 주민들 생각해서 하고 있는 건데, 사실 이 정도는 정부가 내놔야 되는 안이라고요. 복잡한 것은 그냥 안 하고 가만히 있어 가지고는 할 수 없이 야당이 내놓게 만들고 그래요? 이런 무책임한 일이 어디 있어요?",
n_id.201,o_id.154,김관영 위원,"맞는 말씀이에요, 진짜.",
n_id.202,o_id.155,소위원장 박기춘,저도 동감입니다.   ,
n_id.203,o_id.156,오병윤 위원,한 가지만......,
n_id.204,o_id.157,소위원장 박기춘,"오병윤 위원, 얘기하세요.  ",
n_id.205,o_id.158,오병윤 위원,신고만 하면 효력이 발휘되는 겁니까?,
n_id.206,o_id.159,국토교통부주택정책관 김재정,"예, 신고하고 수리하면 효력이 발생하게 됩니다. ",
n_id.207,o_id.160,오병윤 위원,신고만 하고 수리 안 하면?  ,
n_id.208,o_id.161,국토교통부주택정책관 김재정,그런데 철거라고 하는 게 수리를 안 할 이유가 없습니다. 당연히 수리하게 됩니다. ,
n_id.209,o_id.162,소위원장 박기춘,그러면 위원님들께서 지적한 사항에 대해서는 정부가 잘 반영을 하시고......,
n_id.210,o_id.163,국토교통부제1차관 박기풍,"예, 1년을 연장하더라도 지자체하고 협의해 가지고 되도록이면 빨리 결정하도록 그렇게 유도해 나가겠습니다. 이노근 위원님 뜻은 법적 안정성 차원에서 '예스'인가 '노'인가를 빨리 해 줘야 될 것 아니냐, 그 뜻인 것으로 저희가 받아들이고요. ",
n_id.211,o_id.164,소위원장 박기춘,"그것도 받고, 이미경 위원님께서 지적한 것들에 대해서도 당신들이 그것은 잘......",
n_id.212,o_id.165,국토교통부제1차관 박기풍,"예, 알겠습니다. ",
n_id.213,o_id.165,국토교통부제1차관 박기풍,그래서 지자체에서 전부 다 1년으로 해 달라고 왔기 때문에 그것은 지자체 의견을 저희들이......,
n_id.214,o_id.166,소위원장 박기춘,"더 이상 야당을 설거지하는 집단으로 보지 말란 말이에요, 다시 말하면. ",
n_id.215,o_id.167,국토교통부제1차관 박기풍,그렇게 본 적이 없습니다. ,
n_id.216,o_id.168,이미경 위원,"아니, 안 하고 있으니까 할 수 없이 하는 거지.  ",
n_id.217,o_id.169,소위원장 박기춘,"행태가 그렇단 말이에요, 행태가. ",
n_id.218,o_id.170,국토교통부제1차관 박기풍,(웃음) 국회의 좋은 기능으로 저희들이 받아들이겠습니다.,
n_id.219,o_id.171,소위원장 박기춘,그러면 김관영 의원안에 대해서도 역시 수정한 부분과 또 기타 부분은 원안대로 의결하도록 하겠습니다. 이의 없으시지요?,
n_id.220,o_id.171,소위원장 박기춘,가결되었음을 선포합니다. ,
n_id.221,o_id.171,소위원장 박기춘,"의사일정 4항, 아까 상정했기 때문에 그냥 토론하도록 하겠습니다.",
n_id.222,o_id.171,소위원장 박기춘,"먼저 수석전문위원, 보고해 주시기 바랍니다.",
n_id.223,o_id.172,수석전문위원 허태수,10쪽입니다.,
n_id.224,o_id.172,수석전문위원 허태수,"변재일 의원안은 산업단지 조성에 관한 사업을 공익사업 변환, 즉 환매권 유보의 대상으로 추가하려는 것입니다.",
n_id.225,o_id.172,수석전문위원 허태수,"기존 공익사업, 예컨대 보금자리주택사업 등에 편입된 토지가 동일한 공익사업인 산업단지에 편입되는 경우 환매권 발생으로 인해 환매 후 재취득에 따른 불필요한 이중절차, 추가비용, 보상 장기화 등으로 사업 지연 가능성이 매우 높아 보입니다.",
n_id.226,o_id.172,수석전문위원 허태수,그래서 사업 성격 등을 감안해서 기존 공익사업이 산단으로 변경되는 경우도 환매권 유보대상에 포함시킬 경우 사업 간 전환이 원활해져 경제여건 변화 등에 탄력적으로 대응하여 공익사업의 안정적 추진을 도모할 수 있으므로 개정안은 바람직해 보입니다.,
n_id.227,o_id.172,수석전문위원 허태수,다만 맨 아래에 보시면 환매권 행사를 제약하는 법 개정은 달성하려는 공익뿐만 아니라 국민의 재산권 제한도 감안하여 필요한 최소한에 그쳐야 한다는 대법원 판례도 있었기 때문에 이러한 환매권 행사 제약이 헌법 등 법원칙에 위반되지는 않는지에 대해서 국토부 의견을 제시할 필요가 있어 보입니다.,
n_id.228,o_id.172,수석전문위원 허태수,이상 보고를 마치겠습니다. ,
n_id.229,o_id.173,소위원장 박기춘,"국토부, 의견 있으면 말씀해 주세요.",
n_id.230,o_id.174,국토교통부제1차관 박기풍,국토부는 전문위원 검토보고에 동의합니다. ,
n_id.231,o_id.174,국토교통부제1차관 박기풍,"왜 그러냐 하면, 기존 보금자리주택사업을 하다가 이게 잘 추진이 안 돼 가지고 산단으로 지정하려는데 환매권이 발생하게 되면 이미 취소를 하고 다시 환매를 다 한 다음에 또 산단을 지정하려면 또 다시 수용을 해 가지고 보상하려면 이게 법적 안정성 문제나 절차가 굉장히 비용이 많이 들어가기 때문에, 바뀌는 것은 그냥 환매권 대상에서 좀 유보를 시켜 주는 것이 훨씬 좋다고 저희도 생각하기 때문에 개정안에 대해서 수용을 합니다. ",
n_id.232,o_id.175,소위원장 박기춘,"그러면 위원님들, 의견 있으십니까? ",
n_id.233,o_id.176,이미경 위원,"""최소한에 그치는 것이 바람직하다는 견해도 있음"", 이것은 뭡니까? 그러면 현재 이게 최소화시킨 법입니까? ",
n_id.234,o_id.177,국토교통부제1차관 박기풍,"예, 지금 주택건설이나 택지조성사업은 그렇게 할 수 있는 유보조항이 있거든요. 거기에다가 산업단지만 하나 더 넣는 겁니다, 산업단지 조항에다가. 그리고 사업주체도 공공기관이 시행하는 것에 한해서 하는 겁니다. 그렇기 때문에 저희는 별 문제가 없다고 생각합니다.",
n_id.235,o_id.178,국토교통부주택토지실장 도태호,산업단지 사업 자체가 주택건설이나 이런 것하고 동일하기 때문에 같은 취지로......,
n_id.236,o_id.179,소위원장 박기춘,다른 의견 없으시지요?,(｢예｣ 하는 위원 있음)
n_id.237,o_id.179,소위원장 박기춘,"따라서 정부 측 의견이 끝났고 위원님들께서도 의견이 없기 때문에 의사일정 4항, 공익사업을 위한 토지 등의 취득 및 보상에 관한 법률 일부개정밥률안은 원안대로 의결하고자 합니다. 이의 없으시지요?",
n_id.238,o_id.179,소위원장 박기춘,가결되었음을 선포합니다. ,
n_id.239,o_id.180,소위원장 박기춘,"다음은 의사일정 제5항과 6항, 개발제한구역의 지정 및 관리에 관한 특별조치법 일부개정법률안을 일괄 상정하겠습니다.",
n_id.240,o_id.180,소위원장 박기춘,"수석전문위원, 보고해 주시기 바랍니다.",
n_id.241,o_id.181,수석전문위원 허태수,14쪽의 1번은 존속 중인 건축물을 기존 부지 내에서 증축하는 경우 개발제한구역관리계획 수립대상에서 제외하는 사항입니다. ,
n_id.242,o_id.181,수석전문위원 허태수,"관리계획 수립 생략은 행정절차 간소화 내지 규제완화 측면에서 바람직하나 계획수립 제외 대상을 ""기존 부지 안에서의 증축인 경우""에서 ""개발제한구역 지정 이전에 조성된 기존 부지 안에서의 증축인 경우""로 수정할 필요가 있어 보입니다.",
n_id.243,o_id.181,수석전문위원 허태수,왜냐하면 구역 지정 이후 건축되었으나 법령의 개정으로 신축이 금지된 건축물은 현행 법령에서 증축 시 대지의 확장이 허용되고 증축규모에도 제한이 없으므로 관리계획을 수립토록 하여 증축의 적정성을 검토함이 바람직해서 그러합니다.,
n_id.244,o_id.181,수석전문위원 허태수,"다음, 17쪽입니다. ",
n_id.245,o_id.181,수석전문위원 허태수,2번은 개발제한구역 지정 당시 지목이 대(대)인 토지가 구역지정 이후에 지적소관청의 직권으로 지목이 변경된 경우에도 개발제한구역 주민의 주거·생활편익을 위한 시설물의 건축 및 이에 따르는 토지형질의 변경을 한시적으로 2015년 12월 31일까지 허용하려는 것입니다. ,
n_id.246,o_id.181,수석전문위원 허태수,"현행 법령에서 개발제한구역 지정 당시부터 지목이 대(대)인 토지에 한하여 일부 건축물의 신·증축 등을 허용하고 있는데, 이는 재산권에 대한 과다한 제약 측면이 있고 직권에 따른 지목 변경은 토지소유자의 신청에 의한 것이 아니므로 개정안은 바람직해 보입니다.",
n_id.247,o_id.181,수석전문위원 허태수,18쪽 3번은 개발제한구역 주민의 생활편익과 복지증진을 위한 지원사업 등의 시행주체에 시·도지사를 포함시키려는 것입니다. ,
n_id.248,o_id.181,수석전문위원 허태수,사업 간 연계가 필요하거나 광역 단위의 추진이 필요한 사업의 경우에는 시·도지사가 직접 시행할 수 있도록 하는 것으로 바람직해 보입니다.,
n_id.249,o_id.181,수석전문위원 허태수,이상 보고를 마치겠습니다.,
n_id.250,o_id.182,소위원장 박기춘,"차관, 정부 측 의견 말씀해 주세요. ",
n_id.251,o_id.183,국토교통부제1차관 박기풍,전문위원님 검토보고서에 전부 동의합니다. ,
n_id.252,o_id.184,소위원장 박기춘,그러면 위원들께서 의견 있으면 말씀해 주십시오. ,
n_id.253,o_id.185,오병윤 위원,동의합니다. ,
n_id.254,o_id.186,소위원장 박기춘,다른 의견 없으십니까? ,(｢없습니다｣ 하는 위원 있음)
n_id.255,o_id.186,소위원장 박기춘,"그러면 의사일정 5항, 6항, 개발제한구역의 지정 및 관리에 관한 특별조치법 일부개정법률안은 각각 본회의에 부의하지 않고 지금까지 심사한 결과를 반영해서 하나의 위원회 대안으로 제안하고자 합니다. ",
n_id.256,o_id.186,소위원장 박기춘,이의 없으십니까? ,(｢없습니다｣ 하는 위원 있음)
n_id.257,o_id.186,소위원장 박기춘,가결되었음을 선포합니다. ,
n_id.258,o_id.187,소위원장 박기춘,"다음은 의사일정 7항과 8항, 공인중개사의 업무 및 부동산 거래신고에 관한 법률 일부개정법률안을 일괄해서 상정합니다. ",
n_id.259,o_id.187,소위원장 박기춘,수석전문위원께서 보고해 주시기 바랍니다.,
n_id.260,o_id.188,수석전문위원 허태수,20쪽 1번은 현행 '공인중개사의 업무 및 부동산거래 신고에 관한 법'을 '공인중개사법'과 '부동산거래 신고에 관한 법'으로 분리하고 이 법의 제명을 '공인중개사법'으로 변경하려는 것입니다. ,
n_id.261,o_id.188,수석전문위원 허태수,"사실 전문자격인으로 공인중개사의 책임성·전문성 강화의 필요성이 있고 변호사법, 공인회계사법, 법무사법 등 다른 자격사 제도의 입법례를 고려할 때 공인중개사법의 분리 제정은 바람직해 보입니다.",
n_id.262,o_id.188,수석전문위원 허태수,"다음, 21쪽 2번은 현행 '중개업자'라는 용어를 '개업공인중개사'로 변경하려는 것입니다. ",
n_id.263,o_id.188,수석전문위원 허태수,종전의 중개인까지 개업공인중개사에 포함하게 되어 일부 혼동 소지가 있겠으나 현재 중개인 숫자가 7.6%에 불과하고 지속적으로 감소 추세에 있습니다. 중개법인을 제외하고는 공인중개사와 중개인의 업무에 실질적인 차이가 없으므로 개정안은 바람직해 보입니다.,
n_id.264,o_id.188,수석전문위원 허태수,"다음, 22쪽 3번은 현행 공인중개사 시험위원회를 공인중개사 정책심의위원회로 변경하여 공인중개사 자격취득에 관한 사항뿐만 아니라 부동산중개업 육성, 중개수수료 체계, 손해배상책임 보장 등 중요한 사항을 심의토록 하려는 것입니다. ",
n_id.265,o_id.188,수석전문위원 허태수,이 개정안의 장점은 전문적이고 신중한 결정을 통해 정책의 신뢰성을 증진시키고 사회적 갈등 조정장치로 활용 가능하다는 것입니다. ,
n_id.266,o_id.188,수석전문위원 허태수,"그러나 단점을 말씀드리면, 위원들 간 중개수수료 등 중요사항에 대한 의견일치가 어려운 경우 공인중개사 및 국민들에게 혼란을 초래할 수 있으며 국토교통부장관과 등록관청, 정책심의위원회 상호 간 책임전가 문제가 발생할 수 있습니다. ",
n_id.267,o_id.188,수석전문위원 허태수,특히 정책심의위원회에서 심의한 사항을 시·도지사가 따르도록 하고 있어 심의기구가 아닌 결정권한을 지닌 행정위원회 성격으로 현행법 제32조제3항에서 중개수수료를 시도의 조례로 정하고 있는 것과 충돌할 소지가 있습니다. 위원님들의 논의가 필요한 사항으로 보입니다.,
n_id.268,o_id.188,수석전문위원 허태수,참고로 말씀드리면 이 내용은 위원장님 안에는 없고 강석호 의원안에만 있는 사항입니다. ,
n_id.269,o_id.188,수석전문위원 허태수,23쪽의 4번은 이 법과 다른 법을 경합하여 위반한 자에 대해 벌금형을 선고하는 경우 이를 분리 선고토록하여 등록의 결격사유를 정한 조항의 실효성을 확보하도록 하려는 것입니다. ,
n_id.270,o_id.188,수석전문위원 허태수,"현행법은 '이 법을 위반하여 300만 원 이상의 벌금을 선고받은 경우'를 중개업 개설등록 취소 등의 대상으로 하고 있으나, 법원에서는 경합범에게 형의 합산·병과를 하고 있어 이 법을 위반한 데 따른 벌금액이 300만 원 이상인지 여부를 알 수 없어 행정제재를 하기 어렵기 때문에 개정안은 필요한 조치로 보입니다. ",
n_id.271,o_id.188,수석전문위원 허태수,24쪽의 5번은 부동산 거래신고에 관한 법률을 별도 분리 제정하기 위해 부동산거래 신고와 관련된 내용을 삭제하려는 것으로 바람직해 보입니다. ,
n_id.272,o_id.188,수석전문위원 허태수,그다음 6번은 기존의 '중개수수료'라는 용어를 '중개보수'로 변경하고 그 지급시기를 대통령령으로 정하도록 하려는 것입니다. ,
n_id.273,o_id.188,수석전문위원 허태수,'중개수수료'보다는 책임에 따른 대가라는 의미를 가진 '중개보수'라는 용어가 올바른 표현으로 보이고 보수의 지급시기를 통일되게 규정하려는 것은 법률행위에 대한 국민의 예측가능성을 높일 수 있어 바람직해 보입니다. ,
n_id.274,o_id.188,수석전문위원 허태수,그다음 7번은 중개사무소의 개설등록을 신청하려는 자가 의무적으로 받도록 되어 있는 실무교육에 실무수습을 포함하려는 것입니다. ,
n_id.275,o_id.188,수석전문위원 허태수,"개정안은 공인중개사의 전문성을 제고하고 소비자의 만족도를 제고시키는 효과가 있을 것이므로 필요하다고 보입니다. 다만 실무수습기관 선정, 실무수습 내용 연구, 교육생 관리 방안 마련 등을 위해 부칙에서 시행일을 공포 후 2년 후로 수정할 필요가 있어 수정의견으로 정리해 두었습니다.",
n_id.276,o_id.188,수석전문위원 허태수,그다음 28쪽의 8번은 국토교통부장관으로 하여금 개업공인중개사 등의 부동산거래사고 예방 등을 위한 교육비용을 지원할 수 있도록 하고 필요한 경우 직접 교육을 실시할 수 있도록 하는 근거를 마련하려는 것입니다. ,
n_id.277,o_id.188,수석전문위원 허태수,공인중개사에 대한 교육을 강화하여 부동산거래사고를 방지하고 소비자들의 권리를 보호하려는 개정안은 바람직해 보입니다. ,
n_id.278,o_id.188,수석전문위원 허태수,그다음 30쪽의 9번은 개업공인중개사가 의무를 위반하여 성실·정확하게 중개대상물의 확인·설명을 하지 아니하거나 설명의 근거자료를 제시하지 아니한 경우 현행 3개월 내 업무정지에서 500만 원 이하의 과태료 부과 대상으로 처벌을 완화하려는 것입니다. ,
