new_id,ori_id,speaker,utterance,note
n_id.269,o_id.119,소위원장 박주선,"그런데 그 미국이 우리하고 동맹 관계에 있지 않은 나라라고 한다면 별, 우리가 주의 깊게 듣지 않아도 되는데 우리하고 동맹 관계에 있거든요. 그렇다고 동맹 관계에 있다 할지라도 우리 외교 주권이 있고 또 대한민국 국민으로서의 자존심도 있고 하는 건데 미국이 이야기한다고 그래서, 애당초 GSOMIA 종료 결정 이후에 사정 변경이 전혀 없는데 이걸 또다시 GSOMIA를 연장한다 결정하기도 어려운 지금 진퇴양난의 형국에 빠져 있지 않느냐 이렇게 생각이 드는 거예요. ",
n_id.270,o_id.119,소위원장 박주선,"그런데 나는 그 당시에 GSOMIA의 파기와 일본의 무역규제 조치하고는 차원이 다른 문제고 다른 시각과 관점에서 검토를 해야 한다고 보는 겁니다. 이것은 실질적인 안보와 관련된 문제인데다가 미국 동맹국과의 관계가 있는 문제고, 그래서 오히려 일본이 이렇게 부당한 무역규제 조치를 한다면 '우리 GSOMIA를 다시 한번 재검토할 수가 있다' 하고 이것을 지렛대로 활용해 가지고 일본의 무역규제 조치를 철회를 시키거나 또는 어떤 사정 변경 조치를 강구하도록 하는 것이 전략상으로도 맞지 않았나 이런 생각이 좀 들어요. 그런데 성급하니 결정을 해 가지고 잘못된 외교 전략이 아니었나 이런 생각이 듭니다. ",
n_id.271,o_id.119,소위원장 박주선,"들고, 지금이라도 계속해서 미국에는, GSOMIA 아직 종료 선언을 우리가 안 했다고 한다면 그러면 '우리 종료하겠다. 일본을 설득해서 우리가 종료 안 하도록 해 달라' 하게 되면 상황은 좀 반전이나 또는 급전이 될 수 있었다고 나는 생각을 합니다. 그런데 지금은 좀 어렵게 되어 있어요. ",
n_id.272,o_id.119,소위원장 박주선,"그래서 GSOMIA를 우리 정부 기존 방침대로 계속 유지한다면 동맹국인 미국이 계속 GSOMIA 연장을 요청하는데 그로 인한 의견이 합치가 안 됐을 때 한미 동맹국 간에 일어날 수 있는 우려 이런 것은 없습니까? 심지어 GSOMIA 종료 결정을 하니까 미국에서는 우려, 실망을 표현하고 그랬는데 그렇게 군 관계자들이 한국에 대거 와 가지고 GSOMIA 결정 다시 번복하라는데 그것을 안 들어 줬을 때 어떤 영향이 있을 수 있는지, 외교부 차원에서는 검토를 한 바가 있을 것 아니에요? ",
n_id.273,o_id.119,소위원장 박주선,"그냥 형식적인 이야기이기 때문에 우리가 수용을 안 하더라도 한미 동맹 관계에 이상은 별로 없을 거다 이렇게 판단하는 것인지, 아니면 방위비 분담 협상을 비롯해 가지고 주한미군 감축 문제라든지 한미 연합군 훈련 문제라든지 등등 이런 여러 가지 문제에 있어서 영향이 없을 것인지, 참 극히 우려스럽습니다. ",
n_id.274,o_id.120,외교부제1차관 조세영,"저희들이 여러 가지 각계에서 또 제기해 주시는 의견, 우려 다 엄중하게 받아들이고 실제 고민도 많이 하고 있습니다. 최종적으로 11월 22일까지 지금 위원장님이 말씀하신 대로 한미 동맹에도 부정적인 영향이 없는 형태로 어떻게든 이것이 좋은 접점을 찾을 수 있도록 그렇게 최선을 다하겠다는 말씀을 올리고요. 저희들이 그래서 미국에 대해서도 그러한 우리들의 입장 또 일본이 풀어야만 할 부분 이런 것들을 끊임없이 강조하고 있습니다. ",
n_id.275,o_id.121,소위원장 박주선,"자, 이석현 위원님 더 질의할 사항 없습니까? ",
n_id.276,o_id.122,이석현 위원,없습니다. ,
n_id.277,o_id.123,소위원장 박주선,그러면 여러 위원님들 수고하셨습니다. ,
n_id.278,o_id.123,소위원장 박주선,이것으로 위원님들의 질의가 모두 끝난 것 같습니다. ,
n_id.279,o_id.123,소위원장 박주선,더 이상 질의하실 위원님들이 계시지 않기 때문에 현안보고에 대한 질의 답변을 종결하도록 하겠습니다. ,
n_id.280,o_id.123,소위원장 박주선,오늘 위원님들로부터 외교 현안에 대한 고견과 정부의 외교정책 수립에 도움이 될 수 있는 좋은 의견들이 많이 제시되었다고 생각이 됩니다. 외교부에서는 이러한 내용들을 적극 수용해서 가능한 부분들은 조속히 정부정책에 반영해 주시고 기관 간 협의가 필요하거나 국가 간 협조가 요구되는 부분은 향후 외교 중점 사업으로 추진해 주실 것을 부탁을 드립니다. ,
n_id.281,o_id.123,소위원장 박주선,또한 법률이나 예산상의 조치가 필요한 경우 우리 소위원님들께 추후 상세하게 설명하고 협조를 구해 주시기 바랍니다. ,
n_id.282,o_id.123,소위원장 박주선,"위원님 여러분 수고하셨고, 조세영 차관을 비롯한 외교부 관계관 여러분도 수고를 많이 하셨습니다. ",
n_id.283,o_id.123,소위원장 박주선,우리 소위원회의 다음 일정은 위원님들과 협의를 해서 알려 드리기로 하고 오늘회의는 이것으로 마치겠습니다. ,
n_id.284,o_id.123,소위원장 박주선,산회를 선포합니다. ,
