new_id,ori_id,speaker,utterance
n_id.263,o_id.197,소위원장 권성동,"그다음에 지금 실태조사를 하고 있으니까 보증금 올리는 부분은 9월 달에 실태조사 끝나면 그때 가서 법무부에서 결정하겠다, 지금 시행령에 위임돼 있거든요, 3억이라는 액수가?"
n_id.264,o_id.198,법무부장관 국민수,"예, 그렇습니다. "
n_id.265,o_id.199,전해철 위원,"그런데 그렇게 하려고 하니까 그때 전문위원인가 어디 보고서 보니까 법의 체계나 이런 것이 굉장히 웃긴다, 그리고 상가 임대차보호법의 다른 규정들도 적용이 안 됐을 때, 하나는 모르겠지만 굉장히 분쟁의 여지가 많다 이렇게 보고서를 쓰지 않았어요? 어때요?"
n_id.266,o_id.200,전문위원 문광섭,"예, 제가 반드시 부정적인 거는 아니고 그런 측면을 고려하셔야 된다는 취지인데요. 그러니까 왜 유독 계약갱신청구권만 그렇게 특별히 원칙적으로 적용되지 않는 거에 대해서......"
n_id.267,o_id.201,소위원장 권성동,법체계상 좀 이상하기는 이상해.
n_id.268,o_id.202,이춘석 위원,우리 문광섭 전문위원이 판사 출신이라 그래.
n_id.269,o_id.203,전해철 위원,그 안하고 현재 3억 돼 있는 것을 5억으로 늘려 가지고 전체 하는 거하고 같이 고민을 해 봐야 되는 거 아니에요?
n_id.270,o_id.204,소위원장 권성동,그래서 그 부분은 실태조사가 9월 달에 끝나면 하겠다는 거예요. 
n_id.271,o_id.205,법무부차관 국민수,"지금 3억 부분은 영에 위임되어 있기 때문에요. 계속 올려왔습니다. 2억, 2억 4000, 3억 이렇게 올려 왔기 때문에......"
n_id.272,o_id.206,소위원장 권성동,나도 제일 좋은 거는 저거를 올리는 게 제일 좋아요. 그런데 지금 당장 급하다고 하니까 연장을......
n_id.273,o_id.207,이춘석 위원,"그거는 검토해 보고요. 저는 계약갱신요구권의 연장이 필요하다고 보는 거는 뭐냐 하면 지금 상가 사람들을 만나면 가장 많이 어려움을 겪고 있는 부분이, 실질적으로 보호를 못 받는 게 5억에서 7억 대가 가장 많대요, 현실에 있어서."
n_id.274,o_id.208,소위원장 권성동,"서울 시내는 그래요, 특히 강남은 그렇습니다. "
n_id.275,o_id.209,이춘석 위원,"그래서 그 사람들이 주장하는 마지막 선이 적어도 7억은 해 줘야 실지로 효과가 있는 것이지 예를 들어서 3억에서 5억으로 늘렸다고 해서, 물론 좀 보호를 받겠지만 실제 현실에서 보호받기가 어렵다 그렇게 얘기하거든요."
n_id.276,o_id.209,이춘석 위원,"그래서 저는 이 액수를 늘리는 것은 저쪽에서 한다고 그러니까 계약갱신요구권 자체라도, 그래도 나아가는 거니까 이렇게 했으면 좋겠어요."
n_id.277,o_id.210,김회선 위원,내가 한번 물어봅시다.
n_id.278,o_id.210,김회선 위원,계약갱신청구권을 행사했는데 차임에 관해서 합의가 안 되는 경우는 어떻게 되는 거예요?
n_id.279,o_id.211,소위원장 권성동,법원으로 가는 거지.
n_id.280,o_id.212,법무부차관 국민수,"거기에 대해서 조문을 만들어 가지고 자율 경쟁에 맡기고, 그래서 보시면 저희가 조문을 하나 만들어 놓았습니다. 그리고 합의하되, 합의가 안 되면 결국 분쟁을 법원 가서 해결해야지요."
n_id.281,o_id.213,김회선 위원,법원에서 결정을 해요? 그것도 좀 이상하잖아? 법원에서......
n_id.282,o_id.214,법무부차관 국민수,"그거는 분쟁이니까 분쟁 해결은 법으로 가능하니까, 결국. 다만 그런 분쟁이 많아질 거 같아 가지고 그게 문제라는 게......"
n_id.283,o_id.215,김회선 위원,법원 의견 한번 들어 보지. 그런 경우도 있나?
n_id.284,o_id.216,소위원장 권성동,"김회선 위원님, 이거를 한번 읽어 보십시오."
n_id.285,o_id.217,전해철 위원,"그게 몇 페이지, 10조의2 말하는 거 아닌가?"
n_id.286,o_id.218,법무부차관 국민수,"예, 3페이지 10조의2(계약갱신의 특례)입니다. "
n_id.287,o_id.219,김회선 위원,"이 비슷한 제도가 있나요, 법원에? 예를 들어 어떤 게 있나요?"
n_id.288,o_id.220,법원행정처차장 권순일,"민법 628조인가 거기에 보면 경제 사정의 변동으로 차임이 부적정할 경우에는 상당한 금액을 정해 줄 것을, 증감을 청구할 수 있도록 법원에, 그거는 일종의 소송이 아니라 비송으로 법원이 정하게 돼 있습니다. "
n_id.289,o_id.220,법원행정처차장 권순일,위원장님께서 기회를 주시면 행정처 의견을 말씀드리겠습니다. 
n_id.290,o_id.221,소위원장 권성동,예.  
n_id.291,o_id.222,법원행정처차장 권순일,그러나 제10조의2에 따라서 분쟁이 증가될 경우에는 그 사건이 전부 법원에 오지 않도록 뭐 임대차분쟁조정위원회를 설치해서 처리하거나 아니면 법원에 분쟁사건이 많이 올 경우에는 그로 인한 사건의 적정하고 신속한 처리를 위해서 위원님들께서 특단의 지원을 해 주실 것을 간곡히 요청드립니다. 사건 느는 거 별로 안 좋아해요.
n_id.292,o_id.223,전해철 위원,"잠깐만, 4페이지의 검토 필요 사항 2항에 나와 있는데 그러면 갱신청구권을 인정하고 대항력이나 우선변제를 인정을 안 해 버리면 사실상 임차인 보호가 안 되는 거 아닌가? 그러니까 계약기간도 중요하지만 대항력이 없어버리면 뭔 의미가 있어?"
n_id.293,o_id.224,전문위원 문광섭,"그러니까 원론적인 말씀인데요, 임대차 보호에는 크게 임대차 기간 중 주인이 바뀌었다고 해서 바뀐 주인이 와서 나가라고 그랬을 때 쫓겨나지 않을 권리 그것이 대항력입니다. "
n_id.294,o_id.224,전문위원 문광섭,그다음에 혹시 경매에 들어가게 됐을 때 자기 보증금을 경매에서 배당받아 나갈 수 있는 권리 그것이 우선변제권입니다. 
n_id.295,o_id.224,전문위원 문광섭,"그다음에 셋째가 계약기간이 끝났지만 하고 싶으면 조금 더 연장할 수 있는, 갱신을 할 수 있는 권리 그것이 바로 갱신청구권, 기타 여러 가지 또 있습니다마는 그것이 큰 세 가지가 있는 겁니다. "
n_id.296,o_id.224,전문위원 문광섭,"그중에서 A, B는 빼고 C는 지금 절박하기 때문에 인정을 특별히 해 주겠다 하는 것이 이 제도입니다."
n_id.297,o_id.225,이춘석 위원,"전해철 위원님, 이것을 완벽하게 다 하려고 하면 불가능합니다. 그래서 계약갱신권만 인정하는 것도 진일보한 거거든요. 그다음에 문제가 발생되는 거는 또 법을 고치면 되는 거니까 거기까지만 갑시다. 이 정도에서 합의......"
n_id.298,o_id.226,전해철 위원,"아니, 다른 거는 몰라도 대항력이 없는 게, 상가 임대차에서 그거 큰 거 아닌가?"
n_id.299,o_id.227,법무부법무심의관 장영섭,법무심의관입니다. 
n_id.300,o_id.227,법무부법무심의관 장영섭,대항력 문제는 기본적으로 상인 간의 거래에서 필요하면 전세권 설정을 하든가 임대차 등기를 하든가 해서 원칙적인 공시 방법을 통해서 해야지 현행 상가 임대차보호법의 공시 방법은 확정 일자 플러스 사업자 등록이기 때문에 그거를 가지고 만약에 제3자한테 대항할 수 있도록 하는 거는 문제가 있어서 상인들 간의 그런 문제는 기본적으로 전세권이든 임차권 등기를 하든지 그런 방식으로 해야 됩니다. 
n_id.301,o_id.227,법무부법무심의관 장영섭,"  (권성동 소위원장, 이춘석 위원과 사회교대)"
n_id.302,o_id.228,전해철 위원,그렇게 따지면 상가 임대차보호법이 뭐가 필요해요?
n_id.303,o_id.229,법무부차관 국민수,그러니까 소액만 보호하고 보호 안 하는 거지요.
n_id.304,o_id.230,소위원장대리 이춘석,이만큼 나간 것도 많이 나간 거예요. 마음 변하기 전에 빨리 갑시다.
n_id.305,o_id.231,김회선 위원,"그러니까, 나도 슬슬 마음이 변하려고 그래, 지금. 자꾸 우리 전 위원이 더 나아가려고 해서."
n_id.306,o_id.232,소위원장대리 이춘석,이렇게 고쳐서 다른 문제가 생기면 다음번에 또 법안 제출해서 그때 하면 돼요. 어떻게 다 한꺼번에 해결하려고 해요? 한 술에 배부를 수 없으니까요. 그리고 우리 법원행정처 차장님도 마음이 급해요. 빨리빨리......
n_id.307,o_id.233,김회선 위원,"그래, 점진적으로 하자고요."
n_id.308,o_id.234,전해철 위원,"아니, 행정처 차장님하고 전문위원님 봐 보세요. 사실은 복잡하기는 복잡하겠다, 그러니까 3억 이상 되는 사람들은 이거를 연장했을 때 우선적으로 그 담보의 범위가 뭐냐부터 해 가지고 굉장히 갑갑하기는 갑갑하겠네."
n_id.309,o_id.235,법원행정처차장 권순일,지금 전문위원님께서 말씀하신 것처럼 세 가지 권리 중에서 갱신청구권을 주는 것이 실질적으로는 굉장히 의미가 있다고 생각이 됩니다. 왜냐하면 대항력이나 우선변제권의 문제는 그야말로 소송이 발생해 가지고......
n_id.310,o_id.236,전해철 위원,최악의 경우니까......
n_id.311,o_id.237,법원행정처차장 권순일,"예, 그거고요. 대개는 거의 모든 경우에는 계약이 갱신되느냐 안 되느냐 그게 실제 거래에서는 중요하거든요."
n_id.312,o_id.238,소위원장대리 이춘석,굉장히 의미가 있어요.
n_id.313,o_id.239,전해철 위원,좋아요.
n_id.314,o_id.240,김회선 위원,"그래요, 그럽시다. 오케이"
n_id.315,o_id.241,소위원장대리 이춘석,"그러면 이 부분 의결은 나중에 하는 거로, 이 정도 결론 내리는 거로 하고 다음 안건으로 넘어가겠습니다."
n_id.316,o_id.242,서기호 위원,"한 가지 부대의견으로, 적용범위 확대에 대해서 이렇게 하더라도 시행령으로 3억 부분을 좀 더 전향적으로 상승시키는 부분에 있어서 부대의견을 달아서......"
n_id.317,o_id.243,소위원장대리 이춘석,그거는 아까 말씀했잖아요?
n_id.318,o_id.244,전해철 위원,차관님이 정확하게 회의록에 남길 수 있게 이야기를 해 보라고.
n_id.319,o_id.245,소위원장대리 이춘석,언제까지 할 수 있겠어요?
n_id.320,o_id.246,법무부차관 국민수,"지금 중소기업청에서 실시하고 있는 전국상가임대차 실태조사 결과가 9월에 나오기 때문에 저희가 그 결과가 나오면 그거를 토대로 해서 대통령령, 시행령 고치는 여부를 결정하도록 하겠습니다. "
n_id.321,o_id.247,소위원장대리 이춘석,그래서 언제까지? 12월까지......
n_id.322,o_id.248,법무부차관 국민수,그거는 못 박기는 저희가......
n_id.323,o_id.249,소위원장대리 이춘석,"올해 12월까지, 9월 달에 나오니까 12월까지."
n_id.324,o_id.250,전해철 위원,12월까지 하고. 차관님 혹시 보직 이동되더라도 꼭 지키라고요.
n_id.325,o_id.251,김회선 위원,보직 이동 안 돼.
n_id.326,o_id.252,소위원장대리 이춘석,12월까지 합시다. 9월 달에 나오니까 제가 보기에 여유 기간이 있으니까 12월까지 하면 될 거 같아요.
n_id.327,o_id.253,법무부차관 국민수,저희가 하여튼 최대한으로 하는데 기간을 못 박으면......
n_id.328,o_id.254,전해철 위원,올해 안에 이렇게 하세요.
n_id.329,o_id.255,법무부차관 국민수,그런데 그거를 제가 임의로 할 수 있는 게 아니고 하여튼 가능한 빨리 할 수 있도록 최대한 노력하겠습니다. 
n_id.330,o_id.256,소위원장대리 이춘석,"빠른 시간 안에, 하여튼 최선을 다한다......"
n_id.331,o_id.257,전해철 위원,정치하는 사람처럼 대답하려 하지 말고......
n_id.332,o_id.258,김회선 위원,"정무직이야, 차관은."
n_id.333,o_id.259,소위원장대리 이춘석,여기까지 하고 의결은 정족수를 채워서 하고요.
n_id.334,o_id.260,소위원장대리 이춘석,21항 법원조직법 일부개정법률안을 상정하겠습니다. 
n_id.335,o_id.260,소위원장대리 이춘석,"  (이춘석 위원, 권성동 소위원장과 사회교대)"
n_id.336,o_id.261,소위원장 권성동,"전문위원, 법원조직법 개정안과 관련해 가지고 다른 부처 의견 조회했어요, 특히 예산당국에? 기재부에서 의견 나온 거 있어요?"
n_id.337,o_id.262,전문위원 정재룡,"예, 그 부분도 우회적인 정원 증원 우려 이런 부분이......"
n_id.338,o_id.263,소위원장 권성동,"당연히 기구 만들면 정원이 증원되지, 왜 안 돼요."
n_id.339,o_id.264,전문위원 정재룡,그래서 법원에서 전향적으로 그 부분도 수용해서 판사 정원 내로 운영하겠다 그래서 안을 준비했습니다.
n_id.340,o_id.265,소위원장 권성동,그래요?
n_id.341,o_id.266,전문위원 정재룡,예.
n_id.342,o_id.267,소위원장 권성동,그리고 이게 또 사후의 통제방안도 원안에는 부족하고......
n_id.343,o_id.268,전문위원 정재룡,그래서 그 부분도 보고서를 연구계획과 추진실적을......
n_id.344,o_id.269,소위원장 권성동,그래서 그 부분을 내가 구두로 사후에 지적을 했는데 그런 부분 포함해 가지고......
n_id.345,o_id.270,전문위원 정재룡,"보고를 드리시지요, 안을."
n_id.346,o_id.271,전해철 위원,이거 제가 문제 제기 했었잖아요? 수정의견 중심으로 이야기를 해 주시지요.
n_id.347,o_id.272,전문위원 정재룡,보고를 해 주시지요.
n_id.348,o_id.273,법원행정처차장 권순일,기조실장께서......
n_id.349,o_id.274,법원행정처기획조정실장 임종헌,"예, 제가 보고를 드리겠습니다."
n_id.350,o_id.274,법원행정처기획조정실장 임종헌,전문위원의 지적과 관련 부처의 의견을 반영해서 수정안을 만들었습니다. 
n_id.351,o_id.274,법원행정처기획조정실장 임종헌,첫째로 연구원장과 수석연구위원의 임명절차에 관한 것을 명시해야 된다는 전문위원의 지적을 반영해서 제76조의3제1항을 수정했습니다.
n_id.352,o_id.274,법원행정처기획조정실장 임종헌,그리고 우회적인 판사 정원 증원이라는 이런 지적이 기재부로부터 있었기 때문에 사법정책연구원에 근무하는 판사는 법관 정원 내의 통제를 받도록 하기 위해서 개정안 제76조의3제3항을 삭제하는 것으로 했습니다. 
n_id.353,o_id.274,법원행정처기획조정실장 임종헌,그리고 전문위원의 초빙연구위원의 대상에서 판사는 제외해야 된다는 적절한 지적에 따라서 개정안 제76조의5에서 판사는 제외하는 것으로 수정을 했습니다. 
n_id.354,o_id.274,법원행정처기획조정실장 임종헌,그리고 연구의 객관성과 정치적인 중립성을 외부위원이 과반수가 점하는 운영위원회에 의해서 사전적으로 통제를 함으로써 사법정책연구원의 독립성과 투명성을 제고하기 위해서 제76조의6에 운영위원회를 설치하는 것으로 규정을 했습니다. 
n_id.355,o_id.274,법원행정처기획조정실장 임종헌,그리고 사법정책연구원이 방만하게 사법부 내의 연구기관을 넘어서...... 객관적인 운영이 되도록 하기 위해서 매년 연구실적과 그 다음해의 추진계획 그리고 연간보고서를 발간해서 매년 국회에 보고하도록 함으로써 국회에 의한 사후적 통제장치를 마련하는 것을 제76조의7로 수정안에 신설을 했습니다. 
n_id.356,o_id.274,법원행정처기획조정실장 임종헌,"그리고 전문위원이 시행일이 불투명하다, 그 준비기간을 반영해서 적절하게 명시를 해야 된다라고 해서 내년 3월 1일 시행되는 것으로 시행일을 명문화했습니다. "
n_id.357,o_id.274,법원행정처기획조정실장 임종헌,이상 보고 마치겠습니다. 
n_id.358,o_id.275,소위원장 권성동,기왕에 만드는 거 3월 1일부터 시행하기에는 그렇지 않아요?
n_id.359,o_id.276,법원행정처기획조정실장 임종헌,"그동안에 사전, 외부 연구인력을 공고를 해서 우수인력을 모집하려면 준비기간이 필요하기 때문에 그 정도의 사전적인...... "
n_id.360,o_id.277,소위원장 권성동,그런데 어느 정도는 몇 명은 정원 외로......
n_id.361,o_id.278,법원행정처차장 권순일,"1월 1일부터 해야 되는 것 아니에요, 3월 1일이 아니라? "
n_id.362,o_id.279,법원행정처기획조정실장 임종헌,"예, 1월 1일......"
n_id.363,o_id.280,법원행정처차장 권순일,내년 1·2월에 빨리 하는 게...... 3월 1일이 아니라 1월 1일부터......
n_id.364,o_id.281,소위원장 권성동,그리고 연구원에 전임으로 근무하면 정원 외로 해야지 지금도 판사가 부족한데 그것도 정원 내로 한단 말이에요? 
n_id.365,o_id.282,법원행정처기획조정실장 임종헌,그런데 기재부에서는 이것이 우회적인 판사 증원이고 이렇게 되면 별도의 인건비가 순증되는 면이 있어서 정원 내로 했으면 좋겠다라는 의견을 제시해서 그 의견을 수용했습니다. 
n_id.366,o_id.283,소위원장 권성동,"수용이 잘못된 것 같은데. 아니, 몇 명이라도 따져 가지고 정원 외로 해야지 법원 인력이 되고 그리고 기구가 생기는데 당연히 우회적인 게 아니고...... 이게 어떻게 우회적인 정원 증원이에요? 기구가 생기면 당연히 우회적인 게 아니고 직접적인 정원 증원이지. 그거 당연히 따르는 거 아니에요? 그러면 뭐 하러 기구를 만들어요, 만들 이유가 없는 거지요."
n_id.367,o_id.284,법원행정처기획조정실장 임종헌,정해 주시는 대로 따르겠습니다. 
n_id.368,o_id.285,박범계 위원,기재부하고 사정이 있으니까 이거는 이분들의 판단이...... 
n_id.369,o_id.286,김회선 위원,"사법연수원이 줄어든데요, 숫자가."
n_id.370,o_id.287,소위원장 권성동,연수원은 줄어드는데......
n_id.371,o_id.288,이춘석 위원,그거를 활용하겠지.
n_id.372,o_id.289,법원행정처기획조정실장 임종헌,기재부 입장을 조금 반영을 했습니다.
n_id.373,o_id.290,김회선 위원,그렇게 합시다.
n_id.374,o_id.291,소위원장 권성동,너무 후퇴를 하는 것 같아요.
n_id.375,o_id.292,전해철 위원,"제가 이야기드리면요, 제가 의견을 제시했었고 그 사이에 기구 자체의 어떤 문제점들은 현재 기재부하고 협의를 해서 많이 보완이 됐다고 생각합니다. 그런데 애초에 대법원 내에 이런 연구원이 있는 부분이 맞냐는 근원적인 것은 사실상...... 우려가 있는 것은 해소됐다고 하기는 어려울 것 같아요, 검토보고서에."
n_id.376,o_id.292,전해철 위원,"그런데 아무튼 그 두 가지, 하나는 이 기구와 아까 말했던 대로 중복과 낭비의 부분 또 다른 부처의 협의 이런 부분은 상당 부분 해소가 됐다는 거는 좋다고 생각하는데 근원적인 문제는 남아 있다고 생각합니다. 제가 더 이상 반대는 하지 않지만 취지가 있다는 생각은 해서...... 제가 질문도 드렸지만 1항에 나왔던 객관성과 공정성, 중립성이라는 것이 항상 우려가 있다, 대법원에서 하면 늘 그런 부분이 담보되어 있다고 생각하는 것은 굉장히 오산일 수 있다라는 부분을 잘 생각해서 앞으로 운영을 했으면 좋겠습니다. "
n_id.377,o_id.293,법원행정처차장 권순일,위원님의 아주 적절한 지적과 충고를 겸허히 받아들이겠습니다. 
n_id.378,o_id.294,전해철 위원,반대 해소된 거로 해서...... 
n_id.379,o_id.295,소위원장 권성동,반대 철회하셨지요? 
n_id.380,o_id.296,전해철 위원,수정이 됐습니다. 
n_id.381,o_id.297,소위원장 권성동,그러면 아까 의결정족수가 부족해서 의결하지 못한 사항부터 먼저 의결하도록 하겠습니다.
n_id.382,o_id.297,소위원장 권성동,의사일정 제13항에서부터 제20항 상가건물 임대차보호법 일부개정법률안을 위원회안으로 제시해서 의결하고자 합니다. 
n_id.383,o_id.297,소위원장 권성동,"그런데 의결하기 전에 좀 더 분명히 해야 될 문제가 있습니다. 부칙인데요, 시행일입니다. 앞에서 우리가 합의했던 부분 중에 1번 법 적용범위 확대, 그다음에 3번, 4번, 그다음에 7번 소액임차인의 최우선변제권 상한 조정까지는 공포일로부터 3개월 후에 실시하는 것으로 하고...... "
n_id.384,o_id.298,이춘석 위원,그거는 공포일로부터 바로 해도 되는 것 아니에요?  
n_id.385,o_id.299,전문위원 문광섭,그 문제는 가급적 빨리하시는 게 좋지요.
n_id.386,o_id.300,이춘석 위원,빨리 공포해서 바로 하고 이 부분만......
n_id.387,o_id.301,전문위원 문광섭,공포일이 바로 며칠 뒤가 될 수도 있는데 한번......  
n_id.388,o_id.302,소위원장 권성동,"공포일로부터 바로 시행할 수 있나요? 어떤가요, 어디 갔나, 법무심의관."
n_id.389,o_id.302,소위원장 권성동,그러면 하여튼 가급적...... 정확하게 해 놓고 통과를 시켜야지.
n_id.390,o_id.303,이춘석 위원,법무심의관 갔어요? 
n_id.391,o_id.304,법무부차관 국민수,"아니요, 오고 있습니다. "
n_id.392,o_id.305,전해철 위원,"이거예요, 지금 문제가 돼요? 시행일이 바뀌면 안 돼요?"
n_id.393,o_id.306,서기호 위원,3개월 이야기가 어디서 나오는 거예요? 
n_id.394,o_id.307,소위원장 권성동,"가급적 빨리 시행하는 게 좋은데 시행하는 데 문제가 있는지, 없는지 확인하고 해야지. 준비도 안 했는데...... "
n_id.395,o_id.308,이춘석 위원,"3개월 후에 시행한다고 했는데 저는 바로 했으면 좋겠다, 공포 후. 준비가 필요한 부분은 시간을 주고, 다 넣어서. "
n_id.396,o_id.309,소위원장 권성동,임대차보호법도 마찬가지인데 공포 후 시행......
n_id.397,o_id.310,전문위원 문광섭,마찬가지입니다.
n_id.398,o_id.311,서기호 위원,"그런데 부칙에서 시행일에 대해서 특별한 것이 없으면 공포 후 즉시 이렇게 되는 거 아닌가요, 어떻습니까?"
n_id.399,o_id.312,소위원장 권성동,"정해 줘야지요, 어떻게 하는......"
n_id.400,o_id.313,이춘석 위원,"나눌 필요가 있는 것이 있거든요, 준비기간이 필요한 거. 아까 월차임 전환시키는 거 이런 것들 보면......"
n_id.401,o_id.314,서기호 위원,준비기간이 필요한 경우는 별도로 의결을 해야 되는데 예를 들어서 아까 주택임대차보호법에서도 따로 의결했습니까?
n_id.402,o_id.315,소위원장 권성동,그러면 일단은 올 때까지 바꿔서 의사일정 제21항 법원조직법 일부개정법률안을 회의에서 논의해서 수정한 대로 의결하고자 하는데 이의 있으십니까? 
n_id.403,o_id.315,소위원장 권성동,가결되었음을 선포합니다. 
n_id.404,o_id.316,소위원장 권성동,법무심의관!
n_id.405,o_id.317,법무부법무심의관 장영섭,예.
n_id.406,o_id.318,소위원장 권성동,"주택임대차보호법도 그렇고 상가 임대차보호법도 그렇고 시행일을 언제부터...... 공포일이 아니라 가만히 놔두면 어떻게 되는 것인가요, 그냥 통과되면......"
n_id.407,o_id.319,법무부법무심의관 장영섭,대통령령에 일부 위임되는 내용도 있고 그래서 그거는......
n_id.408,o_id.320,소위원장 권성동,그거는 6개월로 하고. 
n_id.409,o_id.321,이춘석 위원,그거는 시간을 줄 테니까 나머지......
n_id.410,o_id.322,서기호 위원,그 부분 없습니다. 대통령령에 위임...... 
n_id.411,o_id.323,소위원장 권성동,"아니, 있어요. "
n_id.412,o_id.324,법무부법무심의관 장영섭,있습니다. 
n_id.413,o_id.325,소위원장 권성동,보증금 월차임 전환 제한 있어요.
n_id.414,o_id.326,이춘석 위원,"전환 제한 정하는 거 있어요, 월차임 전환."
n_id.415,o_id.327,서기호 위원,이거요? 이거는 없습니다.
n_id.416,o_id.328,법무부법무심의관 장영섭,"그다음에 확정일자 하는 게 있습니다. 그래서 다만 이 법 시행 이후에 체결된 계약, 현재...... "
n_id.417,o_id.329,소위원장 권성동,그러니까 소급효는 인정 안 하고...... 
n_id.418,o_id.330,법무부법무심의관 장영섭,"예, 그렇습니다. "
n_id.419,o_id.331,소위원장 권성동,그러니까 언제부터 하는 게 좋을 것 같아요?
n_id.420,o_id.332,이춘석 위원,"그래서 당겨 주려고 그러는 거예요, 소급효 인정 안 해 주니까."
n_id.421,o_id.333,법무부법무심의관 장영섭,"이 법 시행일이...... 예, 그렇습니다. "
n_id.422,o_id.334,이춘석 위원,"바로 하자고, 그 부분은. "
n_id.423,o_id.335,법무부법무심의관 장영섭,그 부분은 위원님들이 상의를...... 
