new_id,ori_id,speaker,utterance,note
n_id.1,o_id.1,소위원장 박기춘,성원이 되었습니다.,
n_id.2,o_id.1,소위원장 박기춘,제321회 국회(임시회) 국토교통위원회 제1차 국토법안심사소위원회 개의를 선포합니다.,
n_id.3,o_id.1,소위원장 박기춘,시나리오에 나와 있는 인사말씀은 내용이 긴 것 같아서 이하 생략하겠습니다.,
n_id.4,o_id.1,소위원장 박기춘,감사합니다.,
n_id.5,o_id.1,소위원장 박기춘,"아무튼 쟁점이 적은 것으로 해서 국토 분야 10건 법률안을 심사하도록 하겠는데, 말씀드린 바와 같이 10시에 전체회의가 있기 때문에 그전까지만 오늘 회의를 하고 마치도록 하겠습니다.",
n_id.6,o_id.1,소위원장 박기춘,"지난번과 같이 먼저 수석전문위원의 제·개정 이유, 대체토론 요지, 그다음에 수정의견을 청취한 후에 여기에 대해서 정부 측의 의견을 듣고, 위원님들의 질의와 토론을 거쳐서 의결하는 방식으로, 똑같은 방법으로 진행하도록 하겠습니다.",
n_id.7,o_id.2,소위원장 박기춘,본격적으로 의사일정에 들어갑니다.,
n_id.8,o_id.2,소위원장 박기춘,의사일정 제1항부터 3항까지 이상 3건입니다.,
n_id.9,o_id.2,소위원장 박기춘,도시 및 주거환경정비법 일부개정법률안을 일괄해서 상정합니다.,
n_id.10,o_id.2,소위원장 박기춘,허태수 수석전문위원께서 보고해 주시기 바랍니다.,
n_id.11,o_id.3,수석전문위원 허태수,심사자료 2쪽입니다.,
n_id.12,o_id.3,수석전문위원 허태수,이노근 의원님 안은 지자체가 정비계획 수립 시 국토계획법에 따른 법적 상한까지 용적률을 허용할 수 있는 근거를 마련하는 것입니다.,
n_id.13,o_id.3,수석전문위원 허태수,"지자체가 필요한 경우 법적 상한까지 용적률을 확대할 수 있게 함으로써 사업성 개선으로 정비사업 활성화를 도모하고 주거환경을 개선하려는 것으로, 바람직해 보입니다.",
n_id.14,o_id.3,수석전문위원 허태수,다만 개정안은 국토의 계획 및 이용에 관한 법률 제78조에 대한 예외규정이라는 점에서 주거지역에 한정하여 용적률을 완화할 수 있도록 수정할 필요가 있어 수정의견으로 정리해 두었습니다.,
n_id.15,o_id.3,수석전문위원 허태수,"그리고 이미 사업 시행 인가를 얻어 사업이 추진되는 경우에는 용적률 확대 적용에 따른 사업 추진 지연, 주민 혼란 가중 등이 우려되므로 이 법 시행 이전에 사업 시행 인가를 받은 사업은 적용 대상에서 제외하는 문제에 대해서 논의가 필요해 보입니다.",
n_id.16,o_id.3,수석전문위원 허태수,다음 4쪽입니다.,
n_id.17,o_id.3,수석전문위원 허태수,"이미경 의원님 안은, 시공사 등이 조특법에 따라 추진위 또는 조합에 대한 채권을 손금으로 인정받으려는 경우 채권확인서를 시장·군수에게 제출토록 하려는 것입니다.",
n_id.18,o_id.3,수석전문위원 허태수,"매몰비용과 관련하여 시공사 등 채권자가 추진위 또는 조합에 대한 채권을 포기할 경우 이를 손금으로 인정할 수 있도록 조세특례제한법 일부개정법률안이 지금 기획재정위원회 조세소위에서 논의 중입니다. 개정안은 이에 맞추어 매몰비용을 손금 처리하고자 할 경우 시공사, 추진위·조합이 합의하여 채권확인서를 시장·군수에게 제출하게 함으로써 추가 분쟁을 방지하고, 손금 처리 관련 행정절차를 용이하게 하려는 것으로, 필요한 조치로 보입니다.",
n_id.19,o_id.3,수석전문위원 허태수,다만 현행 규정상 추진위는 매몰비용을 지자체로부터 보조받을 수 있어 손금 처리까지 인정할 경우 이중 혜택이 될 수 있으므로 매몰비용을 보조받은 추진위는 손금 처리 대상에서 제외할 필요가 있어 수정의견으로 정리해 두었습니다.,
n_id.20,o_id.3,수석전문위원 허태수,"그리고 부칙의 적용례는 이 법 시행 당시 제16조의2에 따라 추진위 승인 또는 조합 설립 인가가 취소되었거나 해산을 신청한 경우도 손금으로 인정받을 수 있도록 하려는 것인데, 일부 자구 수정이 필요한 부분이 있어 수정의견으로 정리해 두었습니다.",
n_id.21,o_id.3,수석전문위원 허태수,다음 7쪽입니다.,
n_id.22,o_id.3,수석전문위원 허태수,"김관영 의원안은 토지 등 소유자의 동의로 추진위 승인 또는 조합 설립 인가를 취소하는 근거조항의 유효기간은 1년(15년 1월 31일까지) 연장하고, 추진위 해산 시 지자체의 매몰비용 보조 유효기간은 1년 6개월(2016년 2월 1일까지) 연장하려는 것입니다.",
n_id.23,o_id.3,수석전문위원 허태수,"지자체는 내년 1월 말까지 실태조사를 통해 주민이 추진위·조합 해산 여부를 결정하도록 할 계획이므로 실태조사 요청 주민에게 관련 정보를 제공하여 사업 추진 여부를 결정할 수 있도록 추진위·조합 해산 신청 유효기간은 1년 더 연장하고, 매몰비용 지원 조항의 유효기간도 1년 6개월 연장하려는 것으로, 필요해 보입니다.",
n_id.24,o_id.3,수석전문위원 허태수,다만 정비사업의 조속한 안정을 위하여 연장기간은 추진위·조합 해산 신청 및 매몰비용 지원 조항 모두 다 1년으로 통일할 필요가 있어 수정의견으로 정리해 두었습니다.,
n_id.25,o_id.3,수석전문위원 허태수,또한 관리처분계획의 인가를 받은 경우는 법적 안정성 저해 등을 고려해서 유효기간 연장 대상에서 제외할 필요가 있어 또한 수정의견으로 정리해 두었습니다.,
n_id.26,o_id.3,수석전문위원 허태수,이상 보고를 마치겠습니다.,
n_id.27,o_id.4,소위원장 박기춘,"박기풍 차관, 정부 측 의견 있으면 말씀해 주시기 바랍니다.",
n_id.28,o_id.5,국토교통부제1차관 박기풍,전문위원 검토의견하고 수정의견에 대해서 동의합니다.,
n_id.29,o_id.6,소위원장 박기춘,그럼 다음은 위원님들께서 의견 있으면 말씀해 주시기 바랍니다.,
n_id.30,o_id.6,소위원장 박기춘,의견 없습니까?,
n_id.31,o_id.7,이미경 위원,아니요.,
n_id.32,o_id.7,이미경 위원,"이노근 의원님이 내신 용적률 상한에 대해서, 우선은 지자체의 의결에도 불구하고 그것을 무시하고 그냥 법으로 정해 나가자 이런 조항이지 않습니까? 그래서 이제 이렇게 할 경우에, 사실은 공공임대주택을 좀 더 지으면 용적률을 높인다든지 이런 조항이 있어서 용적률을 높일 수 있도록 되어 있는데, 그러면 이제 공공주택을 확보하는 것에 대해서 별로 확보 안 하려고 하지 않겠느냐 하는 점이 걸리는 부분이 될 수가 있을 것 같습니다.",
n_id.33,o_id.7,이미경 위원,"그리고 실질적으로 지금 현재도 용적률이 꽤 높게 상한선이 되어 있는데 또 여기에서 조금 더 높이는 것은, 결국은 아까 말했던 공공임대주택의 인센티브를 거기 붙여서 시행하는 것인데 그것이 갖는 문제점 이런 것들이 있고 그렇습니다.",
n_id.34,o_id.8,소위원장 박기춘,말씀하세요.,
n_id.35,o_id.9,이노근 위원,"이게 이미경 위원이 좀 잘못 알고 있는 게 있어요. 뭐냐 하면, 원래 상한선이 주거지역에 하는 것으로 1종, 2종, 3종이 있는데, 상한선이 300%, 250%, 200%예요. 그런데 일괄적으로 수도권, 특히 서울시 같은 경우에는 50%로 그냥 획일적으로 다 내려놨어. 그래 놓고 또 내려놓은 것을, 그러니까 예를 들어 3종인 경우에 300%까지 가능한 것을 250%로 내려놓고, 그다음에 또 행정 내규, 지침 이것으로 해서 220%, 230% 또 내려놨어. 그러니까 인센티브를 준다는 것은 결국 220%로 되어 있으면 여기서 5%, 10%, 15% 이렇게 올려 주는 거야. 250%를 초과해서 올려 주는 경우는 다른 이유, 특별한 경우 외에는 없어요. 그래서 그거 하나 있고.",
n_id.36,o_id.9,이노근 위원,"그다음에 공공임대주택 비율 있잖아요? 이것은 17%로 지금 적용하고 있어요, 서울시 같은 경우. 그런데 그것도 다 못 찾아 먹어. 왜냐하면 17%로 하면 이게 임대지역이 안 나가. 그래서 나는 내가 구청장 할 때도 '이거 20%로 올려라', 그런데 안 나갑니다. 15%로 해도 충분하고 12%로 해도 충분하고, 이렇게 하거든. 그래서 그것은......",
n_id.37,o_id.10,이미경 위원,안 나간다는 건 뭐지요? 임대주택에 들어가려는 사람은 많잖아요.,
n_id.38,o_id.11,이노근 위원,그렇지요.,
n_id.39,o_id.12,이미경 위원,그러니까 좀 더 지을 수도 있는 거지요.,
n_id.40,o_id.13,이노근 위원,그렇지. 그것은 이제 서울시 방침이나 수도권 자치단체 방침으로 얼마든지 늘릴 수 있어요. 그것은......,
n_id.41,o_id.14,이미경 위원,"아니, 그래도 조합은 가능한 한 임대주택을 안 늘리려고 하지요.",
n_id.42,o_id.15,이노근 위원,"그런데 이것이 강제 조항이 아니거든. 말 그대로 현재 조례가 이렇게 묶여 있기 때문에 이것을 조례를, 뭐라 그럴까? 초과해서 해 줄 수 있다는 것을 여기다 넣은 거야, 도시계획위원회 이런 데서 검토해서. 그러니까 그것은 큰 관계는 없어요.",
n_id.43,o_id.15,이노근 위원,"다만 이것이 다른 데가 아니고 재정비 촉진 지역, 다시 말해서 뉴타운 같은 데, 재개발 같은 데 있잖아요? 그런 데 적용되는 거예요, 일반지역에 적용되는 게 아니고.",
n_id.44,o_id.16,이미경 위원,그렇지요.,
n_id.45,o_id.17,이노근 위원,그러니까 대부분 가난한 지역이거든. 그러니까 그것은......,
n_id.46,o_id.18,소위원장 박기춘,강제 사항은 아니다 이거지?,
n_id.47,o_id.19,이노근 위원,"예, 강제 사항은 아니야. '할 수 있다' 이렇게 되어 있어.",
n_id.48,o_id.20,오병윤 위원,"제 의견을 말씀드리면, 그래도 어쨌든 조례로, 그러니까 변경을 하더라도 조례로 변경할 수 있도록 해 줘야지, 조례를 무시하고 그냥 법으로 정해서 정해 버리면 저는 안 된다...... 그러니까 어쨌든 일반 민주주의 원칙에도 시도 조례가 할 수 있게 되어 있잖아요. 그러니까 지금 현재로는 법에만 정해 놓고 있고 나머지에 대해서는 시도가 결정을 할 수 있게 되어 있는 건데 이렇게 되면 시도 조례가 다 무시되고 그냥 법에만 규정되는 문제는 맞지 않다 이런 생각이 우선 하나 들고요. ",
n_id.49,o_id.20,오병윤 위원,"그런 점에서 조례에 맡겨야 된다, 그래서 시가 서울이면 서울 조건에 맞게 각 지역의 특성에 맞게 각 시도가 자체 판단할 수 있도록 하는 것을 허용해 줘야 된다는 점에서 일방적으로 법으로 하는 것은 좀 안 맞지 않느냐 이런 생각이 들고, 현재 대통령령 시행령도 죽 나와 있잖아요. 그런데 전부 시행령이고 뭐고 관계없이 그냥 할 수 있도록 지자체에 다 허용을 해 주는 것은 좀 안 맞는 것 같은데. ",
n_id.50,o_id.21,이노근 위원,시행령에는 그렇게 나와 있는데 조례에서 또 그것을 제한하고 또 각 자치단체별로 행정내규로 또 제한을 했어. 그러니까 이게 뭐냐 하면...... ,
n_id.51,o_id.22,오병윤 위원,그게 필요하다는 것이지요. 왜냐하면 시가 판단을 해야 되니까.,
n_id.52,o_id.23,이노근 위원,"필요한데 구청에서 적용할 때는 강제조항이 아니고 예를 들어서 자치단체장이 이렇게 개발해야 되겠는데 도저히 사업장에는, 조금 올려 주겠다 할 때는 예를 들어서 현재 기준으로 하면 한 230%까지 해 줄 수 있는데 한 250%, 260% 해 줄 수 있다, 그 얘기예요. ",
n_id.53,o_id.23,이노근 위원,이것을 강제적으로 신청자가 내가 300% 신청했다 그래서 해 주는 게 아니라니까. 여기 임의조항으로 되어 있어. 그러니까 그것은 큰 저기가 없어요. ,
n_id.54,o_id.24,국토교통부제1차관 박기풍,제가 보충설명을 올리도록 하겠습니다.,
n_id.55,o_id.25,이노근 위원,그리고 입법례가 이런 경우가 수두룩해.,
n_id.56,o_id.26,국토교통부제1차관 박기풍,"도시 및 주거환경정비법에 12년도에도 이미 재건축 지역이 워낙 활성화가 안 되니까 용적률 상한을 아까 이노근 위원처럼 조례로 해 놓은 것을 법적 상한 여기까지 올리도록 그렇게 12년도에 이미 개정이 된 바가 있어서 이번에는 뉴타운지역에서, 그것도 일반적인 상한을 무시하는 게 아니라 주거지역의 뉴타운사업에 한해서 올리는 것이기 때문에 이것은 저희들 타당하다고 봅니다. 그 입법례도 다 있으니까요. ",
n_id.57,o_id.27,소위원장 박기춘,"나도 그렇게 생각이 듭니다, 개인적으로는.",
n_id.58,o_id.28,김태원 위원,강제조항이 아니기 때문에.,
n_id.59,o_id.29,소위원장 박기춘,그게 일반 지역은 아니잖아요.,
n_id.60,o_id.30,국토교통부제1차관 박기풍,그렇습니다. ,
n_id.61,o_id.31,이노근 위원,은평 같은 데도 이거 많아요. 구청장의 권한이 너무 제한되어 있어.,
n_id.62,o_id.32,소위원장 박기춘,그렇다고 해서 꼭 반드시 그렇게 하라는 것은 아니잖아요. 강제하는 것은 아니잖아요..,
n_id.63,o_id.33,국토교통부제1차관 박기풍,그렇습니다. ,
n_id.64,o_id.34,국토교통부주택토지실장 도태호,강제조항은 아닙니다. 할 수 있다는 것이지요.,
n_id.65,o_id.35,이노근 위원,염려하시는 것은 좋은데......,
n_id.66,o_id.36,이미경 위원,"아니, 그런데 구청장이 마음대로 할 수 있나? 서울시장이 하는 게 아니고?",
n_id.67,o_id.37,국토교통부제1차관 박기풍,서울시장이 하는 겁니다. ,
n_id.68,o_id.38,이노근 위원,구청장은 하고 싶은데 서울시에다 의뢰하면 '조례가 이렇게 되어 있습니다' 그리고 '내규로 이렇게 되어 있습니다' 하니까 구청장이 힘을 못 쓰는 거예요. ,
n_id.69,o_id.38,이노근 위원,"그런데 실질적으로 가장 잘 아는 사람은 구청장 아니야, 현업에 있는데. 그러면 서울시장이 해 주고 싶어도 그렇게 되어 있으니까 이 재량권이 완전히 박탈되어 있는 거야, 처음부터. ",
n_id.70,o_id.38,이노근 위원,"그러니까 원래 이게 400%예요, 주거지역이. 법상에는 400%지요?",
n_id.71,o_id.39,국토교통부제1차관 박기풍,예.,
n_id.72,o_id.40,국토교통부주택토지실장 도태호,300%. ,
n_id.73,o_id.41,이노근 위원,이것을 시행령에서 300%로 내려놓고 또 조례에서 250%로 내려놓고 또 내부에서......,
n_id.74,o_id.42,이미경 위원,"알겠는데요. 그런데 국토부 찬성이라고 얘기하셨는데 지금 국토부가 전체적으로 지금 뉴타운에 대한 법적인 미비라든지 여러 가지로 정부가 잘못한 측면도 많아요. 국회도 잘못했고, 법적으로 미비한 측면들이 많아 가지고는 거의 끝판에 가서 2011년도인가 법을 바꾸고 매몰비용 연장까지 주고 이랬는데, 그리고 지금 뉴타운이 안 되어 가지고는 막 낑낑대고 있는 것 아니에요. 그래서 매몰비용 연장까지 지금 하자라고 하고 있는데 이 얘기를 하면 또 하라고 얘기하는구나 이렇게 혹시나 될까 봐 그것도 걱정이에요. ",
n_id.75,o_id.43,국토교통부제1차관 박기풍,"제 판단에는 하려고 하는 데는 도와주고, 출구 할 데는 또 출구대로 해 주고 이렇게 양쪽으로 해 줘야, 저는 이것을 이렇게 해결해야 된다고 봅니다. ",
n_id.76,o_id.44,김태원 위원,"그렇지, 도와줘야지. 그것을 막으면 안 되지. 그것은 해 줘야지. 매몰비용 정부에서 지원해 주는데 그것을 추진할 수 있으면 추진하는 게 낫지요.",
n_id.77,o_id.45,오병윤 위원,지금 어쨌든 출구전략을 쓰고 있는 데들이 용적률 높여 준다 하더라 하니까 또 해 보자라고 하는 논란이 생길 우려가 있다는 얘기를 하시는 것 저도 그것은 동의하고요. ,
n_id.78,o_id.45,오병윤 위원,두 번째로 어쨌든간에 각 구의 요구는 알겠지만 서울시가 조례로 일반 민주주의 원칙에 의해서 지자체가 조례로 해서 각 구가 요구하면 시가 판단해서 시 차원에서 그러면 그것은 허용해도 좋겠다 이 판단을 맡겨야지 법으로 일괄 허용해 줘 버리면......,
n_id.79,o_id.46,이노근 위원,아니야. ,
n_id.80,o_id.47,오병윤 위원,잠깐만요. 구라고 하는 게 구청장이 자기 정치적 이해에 따라서 허용하고 안 하고 할 수 있는 자의적 판단이 생길 수 있는 문제인데 그것을 허용해 주면 되느냐라고 하는 문제가 발생을 하는 것이지요. ,
n_id.81,o_id.48,국토교통부제1차관 박기풍,"이것은 서울시가 하는 겁니다, 서울시가.",
n_id.82,o_id.49,오병윤 위원,우리 지금 정치 현실에서 구청장이 솔직히 얘기해서 얼마나 정치적 이해를 가지고 움직입니까? 그런 게 현실이지 않습니까? 구청장이나 지자체장이 자기 정치적 이해를 가지고 움직이는 경우도......,
n_id.83,o_id.50,국토교통부제1차관 박기풍,이것은 조금 다른 경우라고...... ,
n_id.84,o_id.51,이미경 위원,법적으로 조례에도 불구하고 한다는 조항들이 꽤 많이 있다는 거예요? ,
n_id.85,o_id.52,국토교통부제1차관 박기풍,할 수 있는 게 다 있습니다. 같은 법에도 있습니다. 지금 도정법에도 있습니다. 재건축에 다 이미 되어 있습니다. ,
n_id.86,o_id.53,이미경 위원,조례에도 불구하고?,
n_id.87,o_id.54,오병윤 위원,"이미 통과된 게 몇 가지가 있어서 사실은 문제가 있는 것인데, 계속 지금 용적률 높여 주자는 안들만 계속 올라오고 있는데 근본적으로......",
n_id.88,o_id.55,이노근 위원,"용적률을 높여 주는 게 아니에요, 이게. 법에 400%까지 보장되어 있는 것을 시행령에......",
n_id.89,o_id.56,수석전문위원 허태수,300%. ,
n_id.90,o_id.57,이노근 위원,"300%, 300% 되어 있는 것을 그것을 일방적으로 조례에서 250% 해 놨고 또 그것을 시행자가 또 230%, 250%로 해 놓고 그래서 시민의 재산권이 박탈되는 이런 상황인데......",
n_id.91,o_id.58,오병윤 위원,그것을 조례로 정한 것은 지자체 의회가 판단하는 것 아닙니까? 그러면 지자체 의회가 판단할 수 있는 권한을 주자는 것이지요. ,
n_id.92,o_id.59,김태원 위원,재량권을 제한하는 것은 아니잖아요. ,
n_id.93,o_id.60,이노근 위원,"뭐냐 하면 재량권을 주자는 얘기예요, 자치단체장한테.",
n_id.94,o_id.61,오병윤 위원,저는 재량권을 주면 안 된다는 거예요. 조례로 규정을 해야지. 재량권을 주면 지자체장들이 정치적 이해를 가지고 움직인다니까요.,
n_id.95,o_id.62,이노근 위원,"아니, 그러면 지금 이거 예를 들어서 출구전략도 똑같아요, 그런 식으로 하면.",
n_id.96,o_id.63,국토교통부제1차관 박기풍,그런데 이번 도정법에는 그런 논의가 있을 수 있는데 다른 상황이 또 있습니다. ,
n_id.97,o_id.64,소위원장 박기춘,"한 분씩 얘기하세요, 한 분씩.",
n_id.98,o_id.65,오병윤 위원,"저는 지자체장에게 무한 권한을 주는 것을 반대하는 입장이에요, 그것은 안 된다.",
n_id.99,o_id.66,이노근 위원,"아니, 그게 무한한 권한이 아니라니까.",
n_id.100,o_id.67,국토교통부주택토지실장 도태호,"위원님, 제가 보충설명 드리겠습니다. ",
n_id.101,o_id.67,국토교통부주택토지실장 도태호,"지금 지자체 조례로 정하는 것은 모든 주거지역을 얘기합니다. 모든 주거지역의 용적률을 조례로 300%까지 되는 게 250%로 예를 들면 정하고 또 정비계획에서 또 정하고 하는데, 저희들이 완화하려는 것은 모든 주거지역을 일반적으로 올리는 게 아니고 재개발·재건축지역 활성화를 위해서 꼭 필요한 지역만 할 수 있는 근거를 두고, 그것도 임의조항으로 두는 것이거든요. 그러니까 이게 일반 주거지역의 틀을 깨는 것은 아닙니다. ",
n_id.102,o_id.68,오병윤 위원,"아니, 검토보고에 수정 의견......",
n_id.103,o_id.69,국토교통부주택토지실장 도태호,서울시 조례는 모든 주거지역의 용적률을 국토계획법상은 300%지만 250%로 낮춘 겁니다.,
n_id.104,o_id.70,김관영 위원,"그러면 조례에도 불구하고, 그러니까 제가 여쭤 보는 것은 서울시 조례로 서울시에 있는 모든 재건축에 관한 것은 용적률이 딱 정해져 있다는 것 아니에요, 조례에 의해서 상한이?",
n_id.105,o_id.71,국토교통부주택토지실장 도태호,"예, 조례는 모든 주거지역으로 되어 있습니다. ",
n_id.106,o_id.72,김관영 위원,서울시에 있는 모든 구에 다 일률적으로 적용되는 얘기입니까? ,
n_id.107,o_id.73,국토교통부제1차관 박기풍,"예, 그렇습니다. ",
n_id.108,o_id.74,김관영 위원,그럼에도 불구하고 어떤 지역에 따라서......  ,
n_id.109,o_id.75,국토교통부제1차관 박기풍,그 특정 지역에 따라서 올릴 수 있도록. ,
n_id.110,o_id.76,김관영 위원,그러면 서울시장이 그런 권한을 갖는 거예요?,
n_id.111,o_id.77,국토교통부제1차관 박기풍,권한이 있는 것이지요. ,
n_id.112,o_id.78,김관영 위원,여기는 좀 특수성이 있으니까 좀더 올려 주자?,
n_id.113,o_id.79,이노근 위원,그거예요.,
n_id.114,o_id.80,김관영 위원,그런데 조례에도 불구하고 더 할 수 있는 것은 서울시장한테 권한을 준다?,
n_id.115,o_id.81,국토교통부제1차관 박기풍,그렇습니다. ,
n_id.116,o_id.82,이노근 위원,그렇지요. 그러니까 이거예요. 주거지역 면적이......,
n_id.117,o_id.83,김관영 위원,"그런데 이게 만약에, 이 위원님 이런 우려는 없어요? 어느 한 지역에 만약에 그런 식으로 우리 지역은 특수성이 있어서 용적률을 높여 주시오라고 서울시장한테 건의를 했는데 이게 그렇게 하다 보면 막 여기저기서 다 신청하고 다른 데하고 형평성 문제가 생기고 이러지 않을까요?",
n_id.118,o_id.84,국토교통부제1차관 박기풍,지금 재건축도 그렇게 하고 있습니다. ,
n_id.119,o_id.85,이노근 위원,재건축 그렇게 하고 있어요.,
n_id.120,o_id.86,국토교통부제1차관 박기풍,"하고 있어요, 도정법에서.",
n_id.121,o_id.87,김관영 위원,도정법상?,
n_id.122,o_id.88,이노근 위원,도정법에서 하고 있어요.,
n_id.123,o_id.89,국토교통부제1차관 박기풍,그렇게 하고 있습니다.,
n_id.124,o_id.90,오병윤 위원,그래서 의견을 저는 드리면 그 결정을 조례를 바꿔서 시에서 하면 되는 것이다......,
n_id.125,o_id.91,이미경 위원,"우리 시간 없으니까, 그 다음 법도 해야 되니까 빨리......",
n_id.126,o_id.92,오병윤 위원,그 말씀은 드리렵니다. ,
n_id.127,o_id.93,소위원장 박기춘,한 말씀 하세요.,
n_id.128,o_id.94,오병윤 위원,조례를 바꾸면 될 것 아닙니까? ,
n_id.129,o_id.95,국토교통부제1차관 박기풍,"조례라는 것은 일률적인 조항입니다, 전체. 시행령도 일률적인......",
n_id.130,o_id.96,오병윤 위원,일률적인데 그 일률적인 것을 높일 수도 있는 것이지요. ,
n_id.131,o_id.97,소위원장 박기춘,"차관님, 다른 법에는 그렇게 되어 있단 말이지요? ",
n_id.132,o_id.98,국토교통부제1차관 박기풍,"이 법에도 그렇게 되어 있습니다, 이 법에도. 도정법 이것 자체에도.",
n_id.133,o_id.99,소위원장 박기춘,반대 의견은 있을 수 있는 것이기 때문에 그것은 소수의 반대 의견으로 받고......,
n_id.134,o_id.100,김관영 위원,2페이지 하단에 있는 것은 논의할 필요는 없는 거예요? 거기 수석전문위원이 얘기한 것 있잖아요.,
n_id.135,o_id.101,오병윤 위원,수석전문위원이 제기한 수정 의견은 어떻습니까? ,
n_id.136,o_id.102,김관영 위원,이 법 시행 이전에 사업시행인가를 받은 사업은 적용 대상에서 제외하는 문제에 대해서 논의가 필요하다고 검토 의견 냈는데 이것은...... ,
n_id.137,o_id.103,이노근 위원,왜냐하면 기존에 가던 질서를 깨뜨리기 때문에 맞다고 봐요.,
n_id.138,o_id.104,소위원장 박기춘,이것을 그냥 또 넘어가면 언제 할지 몰라요.,
n_id.139,o_id.105,김관영 위원,"그러면 금방 수석전문위원이 얘기한 대로 이것을 제외하는 문제를 관철시키려면, 이대로 하려면 조항에다 뭘 넣어야 하는 거예요?",
