new_id,ori_id,speaker,utterance,note
n_id.297,o_id.185,기획재정부국고국장 위성백,"함안의 함안파출소는 협소율이 66%이고, 그다음에 의령 유곡파출소는 협소율이 78%로 기준에서 많이 멀어서 반영하지 못하였습니다. ",
n_id.298,o_id.186,정병국 위원,"노후한 시설이, 이것은 몇 년 됐는데요?",
n_id.299,o_id.187,기획재정부국고국장 위성백,기준은 31년인데요. 협소율이 원래는 45%에서......,
n_id.300,o_id.188,정병국 위원,협소율만 가지고 하는 것은 아니잖아요?,
n_id.301,o_id.189,기획재정부국고국장 위성백,협소율과 노후도를 동시에 고려합니다. ,
n_id.302,o_id.190,정병국 위원,그러니까 이게 지금 노후시설인데 30년이 안 됐다는 거예요?,
n_id.303,o_id.191,기획재정부국고국장 위성백,"31년 됐는데, 35년을 저희들이 기준으로 삼았었거든요. 그리고 협소율이 낮으면 35년이 안 되더라도 반영을 하였는데 이게 또 협소율 기준에서도 안 맞아 가지고 반영하지 못했습니다. ",
n_id.304,o_id.191,기획재정부국고국장 위성백,"그다음에 강경지구대, 반영하였습니다. ",
n_id.305,o_id.191,기획재정부국고국장 위성백,"김포 김포1동파출소, 반영하였습니다. ",
n_id.306,o_id.191,기획재정부국고국장 위성백,"김포 고촌파출소, 반영하였습니다. ",
n_id.307,o_id.191,기획재정부국고국장 위성백,"부산 명지지구대, 반영하였습니다. ",
n_id.308,o_id.191,기획재정부국고국장 위성백,"이천 설성파출소는 반영하지 못하였습니다. 여기는 노후도 32년, 협소율 54%로 기준에 들어오지 못해서 반영하지 못하였습니다.",
n_id.309,o_id.191,기획재정부국고국장 위성백,"안동 옥동지구대, 반영하였습니다. ",
n_id.310,o_id.191,기획재정부국고국장 위성백,"양평 용문파출소, 반영하였습니다. ",
n_id.311,o_id.191,기획재정부국고국장 위성백,"군포 부곡파출소, 반영하였습니다. ",
n_id.312,o_id.191,기획재정부국고국장 위성백,"김포 마산파출소, 반영하였습니다. ",
n_id.313,o_id.191,기획재정부국고국장 위성백,김포 운양파출소는 반영하지 못하였습니다. 경찰청 심사에서 통과하지 못했습니다. ,
n_id.314,o_id.192,박명재 위원,자체 통과를 못 했다?,
n_id.315,o_id.193,기획재정부국고국장 위성백,"예, 경찰청에서 통과하지 못했습니다. ",
n_id.316,o_id.193,기획재정부국고국장 위성백,"여수 여문파출소, 반영하였습니다. ",
n_id.317,o_id.194,박명재 위원,15페이지 아산은요? ,
n_id.318,o_id.195,기획재정부국고국장 위성백,여수 여문은 별지로 들어가 있는 겁니다. ,
n_id.319,o_id.195,기획재정부국고국장 위성백,"아산세무서, 반영하였습니다. ",
n_id.320,o_id.196,박명재 위원,그게 여수 뭐였지요?,
n_id.321,o_id.197,기획재정부국고국장 위성백,여문......,
n_id.322,o_id.197,기획재정부국고국장 위성백,뒤에 별지로 있습니다. 모아서 저희가 검토를 하다 보니까......,
n_id.323,o_id.198,소위원장 박준영,아산 어떻게 됐다고요?,
n_id.324,o_id.199,기획재정부국고국장 위성백,"아산세무서, 반영하였습니다.",
n_id.325,o_id.199,기획재정부국고국장 위성백,북항 지방합동청사는 반영하지 못하였습니다. ,
n_id.326,o_id.199,기획재정부국고국장 위성백,"부산 합동청사는 KDI에서 규모를 제시하고, 그 규모 이상으로 하면 너무 효율적이지 못하다라고 제시를 했는데, 이게 연약 지반이라서 만약에 규모를 늘리면 사업비 단가가 너무 많이 늘어납니다. 그래서 효율적이지 못하기 때문에 그 규모 내에서 사업을 추진하도록 그렇게 제시를 하였습니다. ",
n_id.327,o_id.199,기획재정부국고국장 위성백,천안통합청사는 반영하지 못하였습니다. ,
n_id.328,o_id.199,기획재정부국고국장 위성백,천안통합청사의 경우에 입주하려고 하는 기관들이 지은 지 얼마 안 된 그런 기관들이기 때문에 반영을 하지 못하였습니다. ,
n_id.329,o_id.200,김종민 위원,여기는 지금 설계비 7억이지요?,
n_id.330,o_id.201,기획재정부국고국장 위성백,설계비입니다. ,
n_id.331,o_id.202,김종민 위원,그런데 여기가 지금 공동화가 크기 때문에 일단 세워 가지고 사업을 진행해야 될 텐데......,
n_id.332,o_id.203,기획재정부국고국장 위성백,"그런데 거기에다가 기관들을 입주를 시켜야 되는데 입주할 만한 그런 기관들이 현재 자기 건물을 가지고 있는데, 예를 들어서 8년 됐다거나 10년 됐다거나 이런 기관들이라서 그것들을 모아서 지금 청사를 짓기가 조금 시기가 이릅니다. ",
n_id.333,o_id.204,김종민 위원,그러면 언제쯤 하려고 그래요? ,
n_id.334,o_id.205,기획재정부국고국장 위성백,그래서 저희들이 기관들을 조사해 가지고 기관들이 어느 정도 차면 추진을 하려고요.  ,
n_id.335,o_id.206,정병국 위원,"얼마 안 된 그런 청사들은 다 매각해 가지고 그 돈 가지고 지으면 되잖아. 그것 뭐 할 거야, 실제 통합청사라며? ",
n_id.336,o_id.207,기획재정부국고국장 위성백,통합청사인데 현재는 따로따로 있습니다. ,
n_id.337,o_id.208,정병국 위원,그걸 매각을 하면 될 것 아니야? 그 돈 갖다 지으면 되지. ,
n_id.338,o_id.209,기획재정부국고국장 위성백,그러니까 예를 들어서 10년 이내에 있는 청사들을 다 매각하고 여기에 지어야 되느냐 이런 부분에 대해서는 시급성이 약간 떨어지거든요. ,
n_id.339,o_id.210,김종민 위원,일단 예산 편성 필요가 있다는 의견을 기록만 해 주세요. ,
n_id.340,o_id.211,기획재정부국고국장 위성백,"예, 알겠습니다. ",
n_id.341,o_id.211,기획재정부국고국장 위성백,"경기북부구치소, 반영하였습니다.  ",
n_id.342,o_id.211,기획재정부국고국장 위성백,농림축산검역본부 어린이집은 반영하지 못하였습니다. ,
n_id.343,o_id.212,박명재 위원,이것 왜 못 했지요? ,
n_id.344,o_id.213,기획재정부국고국장 위성백,"저희들 기금에서는 현재 경찰청 사업이나 세무서 같은 쪽에만 집중을 하고 있는데, 어린이집은 지금 저희들이 지원할 여력이 없어서 어린이집은 현재 2017년 예산에서는 전혀 반영하지 않고 있습니다. ",
n_id.345,o_id.214,박명재 위원,해당이 안 된다 이 말입니까?  ,
n_id.346,o_id.215,기획재정부국고국장 위성백,예. ,
n_id.347,o_id.216,소위원장 박준영,그러면 어린이집은 어디서 지어요? ,
n_id.348,o_id.217,정병국 위원,"어린이집이 기관에 의무적으로 있어야 되는 것 아니에요, 어느 인원이 넘으면? ",
n_id.349,o_id.218,기획재정부국고국장 위성백,필요한데 저희들이 기금에서는 현재 지원을 하지 않고 있습니다. 필요하면 일반회계나 이런 데서 해야 되고요. ,
n_id.350,o_id.219,박명재 위원,일반회계로 해야 된다 이거지? 기금사업이 아니다 이거지요? ,
n_id.351,o_id.220,기획재정부국고국장 위성백,"예, 청사에 하다 보면 모든 건물들이 다 들어오거든요. 그래서 수용 능력 때문에 그렇습니다. ",
n_id.352,o_id.221,소위원장 박준영,그다음에. ,
n_id.353,o_id.222,기획재정부국고국장 위성백,"수원팔달경찰서, 반영하였습니다.  ",
n_id.354,o_id.222,기획재정부국고국장 위성백,"충남지방합동청사, 반영하였습니다.  ",
n_id.355,o_id.222,기획재정부국고국장 위성백,통계청 동부권 전자조사센터는 반영하지 못하였습니다. ,
n_id.356,o_id.222,기획재정부국고국장 위성백,이 부분은 현재 사업계획 자체가 약간 불확실한 겁니다. 아직 확정되지 않은 사업입니다. ,
n_id.357,o_id.222,기획재정부국고국장 위성백,"경찰청 지구대 중에서 충남 아산 역전파출소, 반영하였습니다. ",
n_id.358,o_id.222,기획재정부국고국장 위성백,"성남 창곡파출소, 반영하였습니다. ",
n_id.359,o_id.222,기획재정부국고국장 위성백,"순천 신대파출소, 반영하였습니다.",
n_id.360,o_id.222,기획재정부국고국장 위성백,"서울 혜화경찰서, 반영하였습니다. ",
n_id.361,o_id.222,기획재정부국고국장 위성백,"서울 중부경찰서, 반영하지 못하였습니다. ",
n_id.362,o_id.223,박명재 위원,뒤로 넘어갑니까? 밑에 보면 법무부...... ,
n_id.363,o_id.224,수석전문위원 김광묵,"별지가 있는데, 여수 여문파출소 해서 한 장 들어온 게 있는데, 그것은 반영이 되었습니다.",
n_id.364,o_id.225,기획재정부국고국장 위성백,"그 뒤에는 기재위가 아니고 법사위, 안행위, 이런 데서 들어온 건데 다......",
n_id.365,o_id.226,박명재 위원,여수 어디지요? ,
n_id.366,o_id.227,기획재정부국고국장 위성백,여수 여문파출소입니다.  ,
n_id.367,o_id.228,수석전문위원 김광묵,이게 갑자기 들어와서 별지가 하나 있습니다. ,
n_id.368,o_id.228,수석전문위원 김광묵,"그리고 16페이지 밑의 하단하고 17페이지는 다른 위원회에서 의견으로 들어온 건데, 종합적으로 말씀드리면...... ",
n_id.369,o_id.229,소위원장 박준영,"그런데 보고를 할 때 이 순서로 나누어 줬으면 이 순서대로 쭉 해야지 거기서는 왔다 갔다 하려고 하고, 위원들은 어디서 찾아보라는 얘기예요? ",
n_id.370,o_id.230,기획재정부국고국장 위성백,저희가 순서대로 정리를 했는데 나중에 하나씩 끼어 들어온 게 있어서 가지고 한계가 있었습니다. ,
n_id.371,o_id.231,소위원장 박준영,"그래도 이걸 나중에 체크를 하고, 보고는 그렇게 해야 맞는 것 아니에요, 기본이?  ",
n_id.372,o_id.232,기획재정부국고국장 위성백,"예, 그렇게 하겠습니다. ",
n_id.373,o_id.233,박명재 위원,안산시 선부3파출소는 어떻게 됐지요? 반영됐습니까? ,
n_id.374,o_id.234,기획재정부국고국장 위성백,"예, 반영됐습니다. ",
n_id.375,o_id.235,박명재 위원,"그다음에 김포에 신도시, 안 됐지요? 운양동인가 그것 안 되어 있지요? ",
n_id.376,o_id.236,기획재정부국고국장 위성백,"마산동은 됐고요, 운양동은 경찰청 심사에서 통과하지 못했습니다. 둘 중에 하나가 됐습니다. ",
n_id.377,o_id.237,박명재 위원,마산동은 됐는데 운양동은 안 됐다 이거지요? ,
n_id.378,o_id.237,박명재 위원,그런데 지금 운양동이...... ,
n_id.379,o_id.238,소위원장 박준영,"가만있어 봐. 박 위원님, 죄송한데 이 내용을 갖고 빨리 보고를 다 끝내고 나중에 의문이 있는 것들은 질문을 하도록 합시다.",
n_id.380,o_id.239,박명재 위원,다 끝난 것 아닌가요? ,
n_id.381,o_id.240,기획재정부국고국장 위성백,다 끝났습니다.  ,
n_id.382,o_id.241,소위원장 박준영,안행위에서 추가 의견제시한 게 있고 그런데...... ,
n_id.383,o_id.242,기획재정부국고국장 위성백,안행위에서 추가한 사업들은 기준에 맞는 것이 없어서 반영하지 못했습니다. ,
n_id.384,o_id.243,소위원장 박준영,반영 안 했다고? ,
n_id.385,o_id.244,기획재정부국고국장 위성백,예. ,
n_id.386,o_id.245,소위원장 박준영,오케이. ,
n_id.387,o_id.245,소위원장 박준영,"자, 그러면 질문하세요. ",
n_id.388,o_id.246,박명재 위원,"운양동 신도시 인구가 지금 15만인데 곧 20만이 된다고 그래요. 운양동이 인구가 굉장히 많이 늘어나고 있어서 이것은 치안수요가...... 파출소가 하나밖에 없대요. 꼭 필요하다는데, 인구가 20만 되면 파출소가 하나 필요하지 않아요? 한번 검토해 봐 주세요. ",
n_id.389,o_id.247,기획재정부국고국장 위성백,그런데 운양동은 저희들이 반영하지 못했는데......,
n_id.390,o_id.248,박명재 위원,인구가 그렇게 많이 늘어나고 있대요. ,
n_id.391,o_id.249,기획재정부국고국장 위성백,"그런데 경찰청에서 이번에 심사를 해 가지고, 14개가 필요하다고 경찰청에서 심사를 했었거든요. 14개 중에서 저희들이 골라 가지고 반영을 한 겁니다. ",
n_id.392,o_id.250,박명재 위원,"인구가 늘어서 필요하다니까 검토해 봐 주십시오, 운양동.  ",
n_id.393,o_id.251,엄용수 위원,"14페이지의 경남 함안·의령 파출소 3억 정도씩 있는데, 실제 이것들이......",
n_id.394,o_id.251,엄용수 위원,"함안에 어제 지진도 났어요, 강하지는 않은데. 시골에는 원래 사람이 많이 없기 때문에 협소율을 가지고 따지면 굉장히 갑갑하고, 오히려 도심지역에 신축 청사 지으려면 돈이 많이 들지만 지방에는 그렇게 돈이 많이 드는 게 아니거든요. 그래서 함안하고 의령 부분, 지금 31년 됐고 안전도도 D등급 나온다는데 이런 데는 배려를 좀 해 주시면 좋겠는데요. 돈도 얼마 아닌데 검토해 봐 줬으면 좋겠습니다. ",
n_id.395,o_id.252,기획재정부국고국장 위성백,별도로 논의를 하겠습니다. ,
n_id.396,o_id.253,박명재 위원,그것하고 운양동하고 좀......,
n_id.397,o_id.254,김종민 위원,"17페이지에 경찰청 전·의경 숙영시설, 독도경비대 있잖아요. 이게 지금 요건이 안 돼요? 이것 안행위에서 올라온 건데 요건이 안 돼서 다...... ",
n_id.398,o_id.255,기획재정부국고국장 위성백,"예, 저희들이 완화한 기준에도 들어오지 못해 가지고 반영을 하지 못했습니다. ",
n_id.399,o_id.256,김종민 위원,"그런데 이것은 요건의 문제가 아니고, 박명재 위원님 모시고 갔다 왔는데 거기는 상황이 상당히 심각해요.  ",
n_id.400,o_id.257,박명재 위원,"아니, 이것은 나경원 의원이 해 가지고 우리가 약속하고 온 것 아니에요? 그렇지요? ",
n_id.401,o_id.258,김종민 위원,"그러니까요. 국회의원 10명이 가 가지고 이것은 꼭 반영하겠다고 약속하고 온 건데, 실제로 현장에 가 보면 이렇게 서류상 기준으로 얘기할 수 있는 상황이 거의 아니에요. ",
n_id.402,o_id.259,박명재 위원,이건 독도에 대한 국민들의 수호 의지를 고려해 가지고 해 주세요.  ,
n_id.403,o_id.260,김종민 위원,독도 지역구이신 박명재 위원님이 잘 아시지. ,
n_id.404,o_id.261,박명재 위원,이것은 상징적 의미도 있으니까. ,
n_id.405,o_id.262,기획재정부제1차관 최상목,지금 4건에 대해서 말씀하신 것을 충분히 반영해서 저희가 빨리 검토를 해서 보고를 드리겠습니다. ,
n_id.406,o_id.263,박명재 위원,"예, 이것은 그렇게 좀 해 주세요. ",
n_id.407,o_id.264,기획재정부국고국장 위성백,지금 독도경비대 생활실 말씀하시는 거지요? ,
n_id.408,o_id.265,박명재 위원,그렇지. ,
n_id.409,o_id.266,기획재정부국고국장 위성백,"독도경비대 생활실 같은 경우에는 독도라서 사실 문화재심의위원회를 거쳐야 되는데, 그걸 거치지 못해 가지고......",
n_id.410,o_id.267,박명재 위원,"형상변경까지는 안 되고, 내부 시설이 너무 열악하더라고. 침실인가 뭔가 그런 것 좀 해 주라는 거지. ",
n_id.411,o_id.268,기획재정부제1차관 최상목,하여튼 그것하고 아까 엄 위원님이 말씀하신 것은 별도로 검토를 하고 보고를 드리겠습니다. ,
n_id.412,o_id.269,박명재 위원,그것하고 운양파출소 하나하고. ,
n_id.413,o_id.270,수석전문위원 김광묵,다음으로 진도 넘어가겠습니다. ,
n_id.414,o_id.271,박명재 위원,"존경하는 위원님들, 독도경비대 문제에 대해서는 다 동의하시지요? ",
n_id.415,o_id.272,정병국 위원,"아, 그럼요. 독도는 뭐든지 다 드리지. ",
n_id.416,o_id.273,소위원장 박준영,너무 많이 하면 훼손한다고 누가 또 그러더라고. ,
n_id.417,o_id.274,박명재 위원,"아니, 그 안에 이미 있는 시설을 하는 거예요. 다른 데 무슨 형상을 변경하는 게 아니고, 이미 있는 시설이야.",
n_id.418,o_id.275,정병국 위원,"낙후되어 있기 때문에 거기는 잘 해 줘야지. 시설이 여기 육지보다 더 나쁘면 안 돼, 더 좋아야지. ",
n_id.419,o_id.276,박명재 위원,아시겠지요? 절대 형질변경과 관계없어요. ,
n_id.420,o_id.277,김종민 위원,제가 전체적인 것에 대해서 한 말씀 드리고 넘어갔으면 좋겠는데요. ,
n_id.421,o_id.277,김종민 위원,"제가 지금 통계는 안 내 봤는데 그냥 일별해도 대한민국을 서부, 동부로 나눠 보면 거의 동부예요, 국유재산관리기금 관련 사업 내역이. 제가 대충 얼핏 보니까 칠팔십% 정도가 동부 쪽입니다. 대부분이 경북, 경남. 강원도도 좀 있고, 서부가 거의 없어요. 이게 대한민국 동부 쪽 파출소하고 경찰서만 이렇게 문제가 되는 건지 아니면 그쪽 의원님들이 워낙 부지런해서 일찍일찍 이렇게 예산 투입을 하는 건지 아니면 뭔가 거르는 과정에서 중간에 필터링이 잘못된 건지......",
n_id.422,o_id.277,김종민 위원,"이것 통계 한번 잡아보세요, 동부하고 서부하고. 영남하고 호남·충청, 수도권까지 다 합해도 이게 지금 한 2배 차이가 나요.",
n_id.423,o_id.277,김종민 위원,"예를 들면 지금 여기는 안 들어가 있는데 송영길 위원이 제기했던 인천합동청사, 그다음에 아까 얘기했던 천안합동청사, 이런 것은 요건 어쩌고 얘기는 하지만 하여간 지금 다 빠져 있어요. 나는 이해가 안 가. ",
n_id.424,o_id.278,소위원장 박준영,이게 증액한 것만 나온 것 아니에요? 증액한 것하고 합치면 전체적으로 어때요? ,
n_id.425,o_id.279,정병국 위원,안 올라와서 그런 것 아니에요?  ,
n_id.426,o_id.280,김종민 위원,"아니, 그러니까요. 원인을 모르겠어. 위원님들이 안 올려서 그런 것인지......   ",
n_id.427,o_id.281,정병국 위원,안 올라와서 그렇겠지. ,
n_id.428,o_id.282,김종민 위원,"아니면 필터링하는 과정에서 이렇게 정리가 된 것인지는 모르겠지만, 안 올렸다면 이런 통계를 가지고 한번 정리를 할 필요가 있어요. 실제로 이런 증액만 놓고, 만약에 국유재산관리기금 사용 포션으로 최종적으로 이 통계가 맞다면 이것은 문제 있는 것 아니에요? ",
n_id.429,o_id.283,기획재정부국고국장 위성백,정부안에서는 골고루 들어갔고요. 국회에서는 의원님들께서 제기하신 사항만 가지고 검토를 하다 보니까 약간 차이는 있을 수 있는데 최대한 반영을 했습니다.  ,
n_id.430,o_id.284,소위원장 박준영,그런데 전체적인 리스트를 보면 그렇지 않다 이거지요? ,
n_id.431,o_id.285,기획재정부국고국장 위성백,원안까지 합치면 골고루 되어 있습니다. ,
n_id.432,o_id.286,김종민 위원,그것 한번 챙겨 봐 주시고요.,
n_id.433,o_id.287,기획재정부국고국장 위성백,"예, 알겠습니다.",
n_id.434,o_id.288,김종민 위원,"그다음에 아까 제가 얘기한 2개, 서부 쪽의 천안하고 인천합동청사 문제 있잖아요? 그것도 해석을 다시 한번 해 보세요. 여기는 올라가 있는데 왜 이런 것은 빠지냐고?  ",
n_id.435,o_id.289,수석전문위원 김광묵,"그러니까 전체적으로 보면 균형이 맞고, 위원님들께서 고려해 주실 게 예년에 비해서 지금 증액을 엄청 한 거거든요. ",
n_id.436,o_id.290,소위원장 박준영,"김종민 위원 의견에 따라서 장소하고 리스트하고 액수하고 쭉 해서 하나 드리세요, 같이 공유를 하도록.  ",
n_id.437,o_id.291,기획재정부국고국장 위성백,"예, 알겠습니다. ",
n_id.438,o_id.292,김종민 위원,천안하고 인천도 한번 봐 주세요. ,
n_id.439,o_id.293,수석전문위원 김광묵,28페이지입니다. ,
n_id.440,o_id.293,수석전문위원 김광묵,국가보증동의안 2건이 있는데요. ,
n_id.441,o_id.293,수석전문위원 김광묵,3조 9000억 원의 예보채상환기금채권 발행에 대해서 국회에 동의를 요청하는 것입니다. 이미 정무위원회에서 그 금액은 확정됐으니까 우리가 의결하면 되겠고요. ,
n_id.442,o_id.293,수석전문위원 김광묵,혹시 부대의견을 채택하시게 되면 고려해 주실 것이 지금 경영상황이 좋아지고 있기 때문에 우리은행 발행 주식 가격이 더 높은 가격으로 매각될 경우에는 채권 발행 규모를 조절해야 되지 않느냐라는 지적이 있고요. 우리은행 주식에 대한 회계자문료가 과도한 것이 아니냐라는 지적도 있었습니다. ,
n_id.443,o_id.293,수석전문위원 김광묵,"한국장학재단채권 보증 규모가 2조 2000억 원인데 여러 위원님들께서 학자금 대출금이 제대로 회수되지 못하기 때문에 향후 발행 규모가 증가할 우려가 있다는 것하고, 무엇보다도 학자금 대출금리가 지나치게 높아서 상환부담이 크다, 그래서 부대의견(안)으로 '장학재단의 학자금 대출금리를 인하하기 위해서 적극 노력할 것' 이런 부대의견을 저희가 직접 붙였습니다. ",
n_id.444,o_id.293,수석전문위원 김광묵,이상입니다. ,
n_id.445,o_id.294,박명재 위원,좋습니다. ,
n_id.446,o_id.295,소위원장 박준영,좀 내리도록 해야 되겠더라고요. 취업도 못 한 사람이 많은데 전부 그거 되잖아요.  ,
n_id.447,o_id.296,정병국 위원,"아니, 대출금리를 내리려면 어떻게 해야 돼요? 법을 개정해야 되는 거예요?",
n_id.448,o_id.296,정병국 위원,이것은 제가 보니까 다른 나라는 0%더라고. 그렇게 하는 나라가 많아요.  ,
n_id.449,o_id.297,기획재정부사회예산심의관 안일환,"위원님, 조금만 말씀드리겠습니다.",
n_id.450,o_id.297,기획재정부사회예산심의관 안일환,이게 2009년에 5.8%이던 금리를 최근에 2.5%까지 낮추고 금년에도 0.2%p를 낮췄습니다. 그리고 이게 조달금리와 대출금리 이런 것을 하면 지금 현재로서는 2.5% 정도가 장학재단 입장에서는 적절한 금리로 예상이 됩니다. 그런데 향후 미국의 금리가 어찌 되느냐에 따라서 그렇고요. ,
n_id.451,o_id.297,기획재정부사회예산심의관 안일환,"그다음에 다른 나라는 0%는 아닙니다. 16년 기준으로 영국이 4.6%, 미국이 3.76% 이렇습니다.  ",
n_id.452,o_id.298,정병국 위원,"아니, 0% 하는 데를 내가 어디서 봤어. 기억을 못 하는데요. 이자가 없는 나라가 있더라고.  ",
n_id.453,o_id.299,기획재정부사회예산심의관 안일환,장학재단 대출하고 우리 장학금하고를 같이 보셔야 됩니다. 그래서 현재 정부에서 4조 정도의 장학금을 대 가지고 저소득층의 경우에는 3분위 이하는 거의 장학금으로 다 커버되게 되어 있고요.  ,
n_id.454,o_id.300,박명재 위원,"이게 지난번에도 문제가 돼 가지고, 우리가 결정한 게 아니고 교문위 결정사항이에요. 맞지요? ",
n_id.455,o_id.301,기획재정부사회예산심의관 안일환,"예, 장학재단하고 저희들이 협의를 한...... ",
n_id.456,o_id.302,박명재 위원,"비율 결정은 교문위인가 거기 결정사항이더라고. 그래서 우리가 그때 교문위에 그걸 받아와라, 안 된다 해 가지고 어쨌든 양쪽이 조정해 가지고 작년에 낮춘 거지요? ",
n_id.457,o_id.303,기획재정부사회예산심의관 안일환,"0.2% 낮췄습니다, 금년에도. ",
n_id.458,o_id.304,박명재 위원,앞으로 더 낮추도록 노력 계속하세요.  ,
n_id.459,o_id.304,박명재 위원,다음으로 넘어갑시다. ,
n_id.460,o_id.305,소위원장 박준영,위원님들 생각에 몇 % 정도 하면 좋겠다 이런 의견 없으세요? 우리 기준금리가 지금 1.25잖아요?  ,
n_id.461,o_id.306,기획재정부사회예산심의관 안일환,예. ,
n_id.462,o_id.307,김종민 위원,채권 발행 보증동의안은 기재위에 사전 보고를 하기로 했는데 사전 보고가 제대로...... ,
n_id.463,o_id.308,기획재정부사회예산심의관 안일환,정부의 채권 조달금리만 해도 1.98%이기 때문에 그렇게 변동사항까지 합하면 2.5% 정도 됩니다. 기준금리로 대출을 해 줄 수는 없습니다. ,
n_id.464,o_id.309,김종민 위원,"아니, 그런데 이것 사전 설명을 왜 안 했어요? 기재위에 사전 설명을 왜 안 했느냐고요?  ",
n_id.465,o_id.310,기획재정부사회예산심의관 안일환,예? ,
n_id.466,o_id.311,박명재 위원,그건 그쪽 얘기가 아니고 차관이 얘기해 보세요. ,
n_id.467,o_id.312,기획재정부제1차관 최상목,저도 좀...... ,
