new_id,ori_id,speaker,utterance,note
n_id.454,o_id.347,국토교통부제1차관 박기풍,분법은 같이 가야지요. 왜 그러냐면 법이 하나가 안 되면 이게 분법하는 의미가 없습니다.,
n_id.455,o_id.348,소위원장 박기춘,"그러니까 주승용 의원안에다가 보완을 하자니까, 근본적인 거를 갖다가 빼자는 게 아니고.",
n_id.456,o_id.349,함진규 위원,"그리고 이거 지금 뺄 수 없어요, 망치 두드려서 안 되는 거야?",
n_id.457,o_id.350,오병윤 위원,하나씩하나씩 다룹시다. 먼저 논의하고 있는 거 처리하고......,
n_id.458,o_id.351,국토교통부제1차관 박기풍,"그러니까 RTMS 조항만 일단 빼고 그냥 통과시키자, 나머지 조항으로 가고 통과시키자는 거 아닙니까?",
n_id.459,o_id.352,소위원장 박기춘,그렇게 하면 동의하겠습니다.,
n_id.460,o_id.353,오병윤 위원,예.,
n_id.461,o_id.354,국토교통부제1차관 박기풍,저희는 좋습니다. ,
n_id.462,o_id.355,소위원장 박기춘,그렇게 합시다. ,
n_id.463,o_id.356,국토교통부주택토지실장 도태호,강석호 의원안 중에 RTMS 조항만 빼고......,
n_id.464,o_id.357,국토교통부제1차관 박기풍,RTMS 조항만 빼고......,
n_id.465,o_id.358,소위원장 박기춘,"전문기관 이거 자꾸 대통령령으로 한다는 거를 자기들이 마음대로 하기 때문에 그렇다는 말이에요, 내가.",
n_id.466,o_id.359,국토교통부제1차관 박기풍,지금은 고시로 더 마음대로 하고 있지 않습니까? 지금은 더 마음대로 하고 있는데요.,
n_id.467,o_id.360,이노근 위원,"위원장님, 그거를 받아야 돼. 한국감정원에서 감정업무는 떼고......",
n_id.468,o_id.361,국토교통부제1차관 박기풍,감독기관으로 가야 됩니다. ,
n_id.469,o_id.362,이노근 위원,평가법인이나 평가사한테 넘기고 여기는......,
n_id.470,o_id.363,소위원장 박기춘,"그렇지, 그게 맞는 거지.",
n_id.471,o_id.364,국토교통부제1차관 박기풍,"예, 저희도 그렇게 하고 있습니다.",
n_id.472,o_id.365,소위원장 박기춘,그렇게 하는 거를 원칙으로 하자 이 말이에요.,
n_id.473,o_id.366,이미경 위원,그러니까 지금 33쪽 그 조항은 뺀다는 겁니까?,
n_id.474,o_id.367,국토교통부제1차관 박기풍,저희는 일부러 이렇게 해서 기속을 받고 싶어 했는데 빼라고 그러면 저희들은 오케이입니다. ,
n_id.475,o_id.368,소위원장 박기춘,이거만 빼고 그렇게 하는 거로.,
n_id.476,o_id.369,함진규 위원,저기 지금......,
n_id.477,o_id.370,소위원장 박기춘,마지막으로 얘기 한 말씀 하시고......,
n_id.478,o_id.371,함진규 위원,늦게 왔으니까 좀 봐 줘요. ,
n_id.479,o_id.371,함진규 위원,"신장용 의원이 한 거, 지금 나한테 문자가 굉장히 많이 오는데 '지적소관청의 직권으로' 하는데 '지적소관청 직권'을 빼 달라고 그러거든. 이게 피해가 많은가 봐.",
n_id.480,o_id.372,소위원장 박기춘,빼 줘.,
n_id.481,o_id.373,함진규 위원,"망치 두드렸다는데, 빼라고. ",
n_id.482,o_id.374,소위원장 박기춘,그거 빼는 거로 하세요. ,
n_id.483,o_id.375,함진규 위원,이거는 야당이고 여당이고 관계없이......,
n_id.484,o_id.376,소위원장 박기춘,자구수정 위임을 내가 받잖아.,
n_id.485,o_id.377,함진규 위원,'지적소관청의 직권으로' 할 때 이거 너무 정부가 강제적으로 하는 거 같아서......,
n_id.486,o_id.378,국토교통부제1차관 박기풍,그러면 옛날에 지목이 대(대)인 토지는 자동으로 넘어갈 수 있다......,
n_id.487,o_id.379,함진규 위원,"그렇지, 그렇게 얘기해 줘야지 이게...... 나한테 지금 문자가 많이 와. 그래서 나는 이거 여야 관계없이......  ",
n_id.488,o_id.380,국토교통부제1차관 박기풍,한시적으로 허용하는 것이기 때문에 받겠습니다. ,
n_id.489,o_id.381,함진규 위원,그렇게 좀 해 줘요. 빼 줘요. ,
n_id.490,o_id.382,국토교통부제1차관 박기풍,"예, 받겠습니다.",
n_id.491,o_id.383,소위원장 박기춘,그렇게 합시다. ,
n_id.492,o_id.384,국토교통부제1차관 박기풍,"예, 그렇게 하겠습니다.",
n_id.493,o_id.385,소위원장 박기춘,그러면 함진규 위원 의견이 받아들여진 거로 하고 그다음에 9항·10항은 오늘 여러분들께서 심사한 것을 반영해서 하나의 위원회 대안으로 제안하고자 합니다. 이의 없으십니까? ,(｢예｣ 하는 위원 있음)
n_id.494,o_id.385,소위원장 박기춘,"수정한 부분은 수정한 대로, 기타 부분은 원안대로 가결되었음을 선포합니다. ",
n_id.495,o_id.385,소위원장 박기춘,오늘 의사일정을 모두 마쳤습니다. ,
n_id.496,o_id.385,소위원장 박기춘,의사일정에 협조해 주셔서 감사하고 이노근 위원께서 특별한 약속을 해 주셔서 더욱 감사드립니다. ,
n_id.497,o_id.385,소위원장 박기춘,산회를 선포합니다. ,
