new_id,ori_id,speaker,utterance,note
n_id.113,o_id.27,유기준 위원,"홍보에는 공을 들였지만 이런 정교한 현지 진출 전략을 통해서 우리나라 새로운 수출시장 또는 종전의 수출 거기에 대한 대체시장으로 자리매김을 해야 이게 성과가 맞는 것인데 어떻게 보면 하이 보이스, 로우 퍼포먼스 이렇게 지금 나와 있는데 이에 대해서 외교부가 대책을 세우고 적극적으로 의견을 내야 되는 것 아닙니까? ",
n_id.114,o_id.27,유기준 위원,"신남방 소위 첫째 날 이렇게 쓴소리를 해서 좀 그렇습니다만 실제 진행이 됐다면 벌써 2년 정도 되어야 되는 것이고, 그것에 대한 성과가 나타나야 되는데 지금 그렇지 않잖아요. 그리고 인선도 아까 말씀드린 대로 이렇게 코드 인사, 외교 문외한 인사 이렇게 해서 되겠습니까? 왜 외교부가 목소리를 안 냅니까? ",
n_id.115,o_id.27,유기준 위원,차관 답변하세요.,
n_id.116,o_id.28,외교부제1차관 조세영,먼저 신남방 정책의 중요한 의미 또 우리 경제의 활로를 모색하는 데 중요한 위치를 차지하고 있다 하는 말씀으로 또 이해를 하고 저희도 계속 노력을 하겠습니다. ,
n_id.117,o_id.28,외교부제1차관 조세영,특임대사 문제와 관련해서는 외교부가 중심이 되어서 합니다만 또 외교부의 직업 외교관만으로는 달성하기 어려운 그런 분야가 있어서 현대 외교에서는 외교부의 직업 외교관 이외에도 다양한 역량과 경험 또 시각을 함께 협업 차원에서 직업 외교관과 함께 하는 그런 추세가 현대 외교라고 이해를 하고 있습니다. ,
n_id.118,o_id.28,외교부제1차관 조세영,"그래서 그러한 다양한 역량과 경험, 이런 부분을 고려해서 직업 외교관 이외의 특임공관장이 임명되고 있습니다. 말레이시아 같은 케이스에 조금 불행한 그런 결말이 됐습니다만 저희들도 그렇게 임명되신 특임대사들께서 충분히 그런 역량을 발휘하실 수 있도록 외교부 차원에서도 여러 가지 제도를 보완하면서 잘 지원하고 보좌하려는 노력을 하고 있습니다. ",
n_id.119,o_id.28,외교부제1차관 조세영,물론 지적하신 대로 외교부로서 신남방 정책 또는 그런 공관장 인사 문제에 대해서도 외교부 나름의 의견과 또 그런 시각 같은 것은 충분히 개진하고 협조해 나가도록 그렇게 하겠다는 말씀을 올리겠습니다. ,
n_id.120,o_id.28,외교부제1차관 조세영,"신남방 정책의 성과에 관해서는 아직은 좀 미흡한 면이 없지 않아 있겠습니다만 그동안에 특별위원회를 또 설치했고, 저희들이 아세안 대표부도 새로 그렇게 해서 차관을 지낸 공관장을 임명했습니다. 그리고 금년에 특별정상회의도 곧 개최될 예정이고요. 이러한 노력을 통해서 아마도 내년도가 되면 금년보다도 조금 더 가시적인 성과를 추가적으로 체감할 수 있지 않을까 그렇게 기대를 해 봅니다. ",
n_id.121,o_id.28,외교부제1차관 조세영,"보고에도 말씀 올렸습니다만 인적 교류라든지 교역액의 규모는 수치로 보더라도 아세안 지역과 조금씩조금씩 올라가고 있는 그런 추세를 확인하고 있습니다. 아직은 만족스러운 수준이 되지 못하겠습니다만 우리가 늦게나마 이렇게 아세안 지역에 대해서 관심을 가지고 역량을 집중한다는 것은 꼭 필요한 일이라고 생각이 되고, 금년도 특별정상회의를 계기로 해서 내년에 좀 더 구체적인, 최대한 국민들께서 체감하실 수 있는 성과가 나오도록 저희 외교부가 좀 더 분발하도록 그렇게 노력하겠습니다. ",
n_id.122,o_id.29,유기준 위원,"아까 말레이시아 전임 도경환 대사는 그래도 산업부 출신으로서 그에 대해서 경험도 있고 또 지금 신남방 정책 추진에 부합하는 그런 커리어를 가진 인물인데, 원래 대사를 임명하기 전에 예를 들어 그 당에서 국제 위원회에서 일을 했다든지 아니면 상무 감각을 가지고 기업 활동을 했다든지 아니면 그 해당국에 오래 있으면서 교민들과 접촉했다, 이런 배경이 있어야 임명이 되는 것인데 어떻게 이렇게 논공행상에 의한 낙하산 인사를 하면서 버젓이 그게 특임대사로 부임해서 잘 할 수 있다고 생각하는지...... 이것 잘못된 거니까 지금이라도 이런 특임대사를 임명하는 것에 대해서 외교부가 목소리를 내세요. ",
n_id.123,o_id.29,유기준 위원,"민간 분야에, 전에 외교 분야에 안 계시고 민간 분야에 계신 분 중에서도 탁월한 외교역량을 가지고 해당 국가에 밀접한 그런 관계를 가지면서 충분히 역량을 발휘할 수 있는 사람이 있습니다. 그런데 지금 여기는 전혀 그렇지 않은데 왜 이에 대해서 외교부장관이 한마디 말도 안 하고 있는 것인지, 그러니까 외교부장관 패싱이고 제가 지난번에 '외교부장관, 꿔다 놓은 보릿자루다' 그런 얘기 했는데 지금 틀린 말이 아니에요. ",
n_id.124,o_id.29,유기준 위원,"그다음에 말씀하신 것 중에 미흡한 성과를 신남방 정책이라고 이야기했는데 미흡한 성과가 아니라 아예 지금 성과가 없다고 보여집니다. 지금 대통령이 2년 전에 필리핀 순방 계기로 신남방 정책을 발표하고 그 이후에 추진을 했습니다마는 여러 나라들 보면 성과가 나온 게 거의 없어서, 미흡하다기보다 성과가 없다고 보여지고, 다만 베트남의 경우에는 중국과의 여러 가지 관계 때문에 대체시장으로 각광을 받으면서 지금 우리나라의 아마 첫 번째, 두 번째 그런 무역시장이 되고 있을 겁니다. 그래서 그런 점들은 다른 이유에 의해서 그게 그렇게 된 거지 이 신남방 정책의 결과로 볼 수 없는 거거든요. ",
n_id.125,o_id.29,유기준 위원,그래서 이것을 이왕 시작했고 또 대통령 임기가 이제 반을 지나서 앞으로 이런 것들이 탄력을 받으면서 추진할 수 있을지 모르겠습니다마는 노력을 해서 성과를 내도록 그렇게 해 주기 바랍니다. ,
n_id.126,o_id.30,외교부제1차관 조세영,"예, 구체적인 성과가 꼭 나올 수 있도록 분발하겠습니다. ",
n_id.127,o_id.31,소위원장 박주선,다음에 이석현 위원님. ,
n_id.128,o_id.32,원혜영 위원,아직 준비가 덜 됐어요.,
n_id.129,o_id.33,소위원장 박주선,그러면 원혜영 위원님.,
n_id.130,o_id.34,원혜영 위원,"저는 소위원회라서 이렇게 자연스럽게, 정식 질의보다도 간담하는 것으로 생각을 했는데 그러면 한두 가지 더 의견도 구하고 제 의견도 말씀드리겠습니다. ",
n_id.131,o_id.34,원혜영 위원,우선 아까 보고해 주신 대로 한·아세안 특별정상회의나 한·메콩 정상회의가 11월에 집중적으로 개최되는데 여기에서 북핵 문제 관련해서 특별한 메시지나 합의 또 그것을 표현하는 공동성명 이런 게 추진되고 있는지요? ,
n_id.132,o_id.35,외교부제1차관 조세영,"아까 말씀 올렸습니다마는 오찬을 겸한 세션에 한반도 문제를 다루는 그런 기회를 마련했고요. 또 공동 발표하는 문서들에도 당연히 한반도 관련 사항들은 들어갑니다. 현재로서는 특별하게 새로운 합의가 돼서 그것을 발표하고 하는 그런 구체적인 것이 아직 있는 단계는 아닙니다만 또 언론에도 많이 관심을 가졌던 김정은 위원장이 참석을 하느냐, 이런 식의 아주 구체적인 데 대해서는 아직은 특별히 합의에 이르거나 발표가 계획된 부분은 없다, 이런 말씀을 올리겠습니다. ",
n_id.133,o_id.35,외교부제1차관 조세영,현재로서는 일반적으로 한반도의 그런 긴장 완화와 비핵화 그리고 평화 구축을 위해서 허심탄회하게 의견을 교환하고 또 아세안 국가들이 전체적으로 그러한 우리의 정책 방향성을 지지하는 그런 것을 확인하는 것을 목표로 삼고 있습니다. ,
n_id.134,o_id.36,원혜영 위원,그리고 우리가 신남방 정책을 적극적으로 추진하는 것과 관련해서 미국에서는 또 우리 한국 쪽에서도 그렇고 미국의 인도·태평양 정책과 우리의 신남방 정책을 연계시키는 그러한 모습들이 보입니다. 그래서 이런 것이 연계됐을 때의 고려해야 할 사항과 우려되는 점을 몇 가지 좀 같이 얘기하고 싶은데요. ,
n_id.135,o_id.36,원혜영 위원,스틸웰 동아태 차관보가 '미국의 인도·태평양 전략과 한국의 신남방 정책 사이에는 접점이 있다고 생각한다. 한미가 협력을 잘 해 나가면 더 효과를 누릴 수 있을 것이다' 이렇게 얘기한 바도 있고요. ,
n_id.136,o_id.36,원혜영 위원,"또 미 국무부가 발표한 인도·태평양 관련 보고서, 보고서 제목이 '자유롭고 개방된 인도·태평양'에 보면 우리의 신남방 정책과 일본·호주·인도의 외교 정책들이 미 국무부의 인도·태평양 전략과 얼라이언스 위드(alliance with), 보조를 같이한다, 맞닿아 있다라고 얘기하고 있습니다. 미 국무부 경제차관 키이스 크라크는 '한국의 신남방 정책과 미국의 인도·태평양 전략은 주요 부분에서 이해관계가 100% 맞아떨어진다' 이런 단언도 하고 있거든요.",
n_id.137,o_id.36,원혜영 위원,"어쨌든 미국의 인도·태평양 정책의 중요한 포인트는 중국 견제라는 점이지요. 그런 점에서 이렇게 신남방 정책과 미국의 인도·태평양 정책이 궤를 같이한다는 것에 대해서 미국 쪽의 그런 희망과 또 그렇게 얘기할 수 있는 충분한 소지들이 있는 건데, 그런 게 결합돼 있을 텐데 거기에 대한 우리 정부가 어떻게 입장이 정리됐는지 그리고 우리의 신남방 정책에 대해서 지금 앞의 말씀들은 미국의 인도·태평양 정책과 연계시키는 것을 고려한 관점에 초점을 두고 제가 말씀드리고 있는데 중국에서 이에 대한 어떤 분석이나 평가 또 견해들이 어떻게 지금 형성돼 가는지 좀 말씀해 주시지요.",
n_id.138,o_id.37,외교부제1차관 조세영,"우선 미국의 인·태 전략 그리고 우리의 신남방 정책은 기본원칙, 예를 들면 개방성, 포용성, 투명성, 국제규범에 대한 존중 이러한 역내 협력에 관한 기본원칙에 일치하는 부분에 있어서는 접점이 있다 이렇게 생각하고 적극 협력한다는 입장을 가지고 있습니다. 특히 최근에 미국의 경제차관이 방문을 해서 한미 고위급 경제대화가 있었습니다. 그리고 그에 앞서서 차관보급에서도 양국 간에 문서를 정리해서 팩트 시트(fact sheet)라는 형태로 발표를 했습니다. 그 발표된 문건을 보시면 다양한 분야, 사업들이 열거돼 있습니다. 그런데 그런 사업들이 대개는 보면 비군사 영역입니다. 그래서 그 팩트 시트에는 민감한 군사적인 영역, 안보적인 영역이 들어 있는 것은 없습니다.",
n_id.139,o_id.37,외교부제1차관 조세영,따라서 지금 지적하신 대로 혹시 있을지 모르는 중국의 의구심 이런 부분에 대해서는 현재까지는 미국의 인·태 전략과 우리의 신남방 정책의 접점을 모색하면서 공통 분야를 협력하고 발전시켜 나간다는 것에 대해서는 비군사적인 부분을 중심으로 하기 때문에 그에 대해서는 중국으로부터도 공식적이고 표면적으로 그에 대한 반대랄지 이런 것은 나오지 않고 있는 상태입니다. 또 우리 내부적으로도 미국의 인·태 전략이 갖는 다양한 측면의 의미를 저희들도 잘 이해를 하고 있습니다. 따라서 말씀 올린 대로 그러한 지역 협력의 기본원칙에 공통되는 분야에 한해서 우선 접점을 모색하고 공동으로 협력한다 그런 입장이라고 말씀을 올리겠습니다.,
n_id.140,o_id.37,외교부제1차관 조세영,"따라서 동시에 우리는 주요 국가들이 갖고 있는 역내 구상 중에서 말씀드린 개방성, 포용성, 투명성, 국제규범에 합치되는 것이 있다면 어떤 나라가 추진하는 지역 협력 전략에도 우리는 같이할 수 있다는 입장입니다. 따라서 중국이 심혈을 기울이고 있는 일대일로에 대해서도 동일한 원칙에 부합하는 부분에 있어서는 저희들이 함께 협력하고 추진한다는 그런 입장을 갖고 있습니다.",
n_id.141,o_id.38,원혜영 위원,"하여튼 양국이 이 문제에 대해서 이렇게 양국 간의 어떤 세력의 문제로 보면 우리 신남방 정책의 자주성이나 또 원래 취지, 순수성이 약화되고 미중 갈등과 관련돼서 자꾸 보여지고 해석되고 또 그게 촉진되는 것은 좀 우리가 경계를 해야 될 것 같아요. 기본적으로 우리가 이런 신남방 정책 등을 추진하는 게 전통적인 미·일·중·러 중심의 외교에 갇혀 있는 것을 우리가 탈피해서 정말 세계의 여러 가지 측면에서 중요한 위치와 역량을 갖고 있는 중요한 국가로서 외교의 다변화를 좀 본격적으로, 체계적으로 시도하자, 이러한 과정을 통해서 우리의 외교 지평을 넓히자 이런 게 취지가 아니겠습니까?",
n_id.142,o_id.38,원혜영 위원,"그래서 우리도 신남방 정책을 추진함에 있어서 미국의 대중국 견제의 일환으로 우리의 신남방 정책이 이렇게 보여지거나 그렇게 규정당하는 것을 부단하게 견제하고 훨씬 더 우리가 개방, 아까 얘기한 것처럼 일대일로에 대해서도 우리의 국익, 경제적 이익과 관련해서 개방적으로 다루고 미국의 인도·태평양 정책도 그렇고 그런 자세를 좀 분명히 하고 그것을 또 대외적으로도 잘 확인시켜 줄 필요가 있지 않나 그런 생각이 듭니다.",
n_id.143,o_id.38,원혜영 위원,하여튼 미국의 대중국 견제의 일환으로 이렇게 규정되고 또 색깔이 입혀지면서 우리 신남방 정책이 하고자 하는 본래의 취지가 변질되는 것으로 보여지고 또 따라서 우리가 하고자 하는 일들이 어려움에 부딪히지 않도록 특별하게 좀 신경을 쓰고 그것을 외화시킬 필요가 있겠다는 말씀을 드립니다.,
n_id.144,o_id.39,외교부제1차관 조세영,"예, 그 말씀 명심해서 저희들이 정책에 반영을 하도록 하겠습니다.",
n_id.145,o_id.39,외교부제1차관 조세영,지금 지적해 주신 그러한 유의해야 될 점이 있기 때문에 보고드린 대로 저희도 그런 원칙이라는 것을 먼저 기준으로 삼고 있습니다. 그리고 그러한 원칙을 먼저 내세움을 통해서 미중 구도 속에서 어느 양자를 택일해야 한다는 프레임에 빠지지 않도록 주의해 나가고자 합니다.,
n_id.146,o_id.39,외교부제1차관 조세영,"그리고 미·일·중·러라는 틀에 갇혀 있는 것을 넘어서 우리 외교의 지평을 넓히는 것이 중요하다는 말씀 해 주셨고 저희 외교부로서도 굉장히 거기에 중점을 두고 있습니다. 그래서 외교부가 지금 외교 다변화라는 모토 아래 여러 가지 정책도 추진하고 있습니다. 특히 지금 신남방 국가들을 대상으로 해서 요즘 많이 유행되고 있는 소다자그룹이라든지 또는 유사 입장국 또는 유사 상황에 처한 국가, 이런 다양한 개념을 머릿속에 넣고 우리가 신남방의 다양한 국가들과 어떻게 복합적으로 협력할 수 있을지 계속 고민해 나가도록 하겠습니다.",
n_id.147,o_id.40,소위원장 박주선,이석현 위원님 준비 덜 됐습니까?,
n_id.148,o_id.41,이석현 위원,"아니요, 평소에 준비가 다 돼 가지고 있습니다.",
n_id.149,o_id.41,이석현 위원,수고 많습니다.,
n_id.150,o_id.41,이석현 위원,"부산 11월 26일이지요? 한·아세안 특별정상회의, 거기는 각국의 정상들이 10개국이지요? 아세안 다 오기로 돼 있나요?",
n_id.151,o_id.42,외교부제1차관 조세영,"예, 그렇습니다.",
n_id.152,o_id.43,이석현 위원,"제가 지난번에 싱가포르 갔을 적에 거기에 선임 국무장관이라는 제도가 있더라고, 시니어 미니스터(senior minister)가 있더라고. 그래 가지고 그 양반이 그런 것을 다 하길래 그 얘기를 특별히 했어요. 싱가포르는 사실은 대통령은 실권이 없지 않습니까? 총리가 다 실권자 아니겠습니까? 지금 리센룽 총리던가요, 거기가?",
n_id.153,o_id.44,외교부제1차관 조세영,예.,
n_id.154,o_id.45,이석현 위원,"그런데 이게 '정상'이라고 돼 있어 가지고 그러면 대통령이잖아요? 그래서 총리께서 오시면 좋겠다고, 리센룽 총리가 오시도록 좀 도와 달라고 그랬더니 '그렇게 추진하겠습니다' 그러대요. 그 부분은 리센룽 총리가 오기로 정부에서도 잘돼 가고 있나요?",
n_id.155,o_id.46,외교부제1차관 조세영,"예, 그렇게 돼 있습니다.",
n_id.156,o_id.47,이석현 위원,그렇군요.,
n_id.157,o_id.47,이석현 위원,그리고 아세안 사무국이 아시다시피 자카르타에 있지 않습니까?,
n_id.158,o_id.48,외교부제1차관 조세영,예.,
n_id.159,o_id.49,이석현 위원,"거기에 제가 국회 여야 의원님들 몇 분 모시고 방문을 했어요, 몇 달 전에. 왜냐하면 지금 국회에 뭐가 있느냐 하면, 그게 매우 길어요, 영어로 하면. 그냥 의회외교포럼이라는 게 있어요, 아세안 의회외교포럼. 거기 제가 회장을 맡아 가지고 있어 가지고 거기 여야 의원님 몇 분 모시고 자카르타를 방문해서, 그날이 마침 임성남 전 차관이 아세안대사로 부임하던 날, 자카르타에는 인도네시아대사가 본래 있고 아세안 전체 본부 뷰어로(bureau)가 거기 있으니까 거기도 있고. 그래서 브루나이에서 나와 있는 아세안 사무국장도 만나고 다 만나서 여러 가지 협력관계가 매끄럽게 잘되고 있구나 하는 것을 우리가 느꼈습니다.",
n_id.160,o_id.49,이석현 위원,"다만 지난번에 방콕에서 아세안 의회총회가 열렸었잖아요. 우리 대통령께서 메콩 3개국, 방콕하고 태국하고 라오스, 미얀마 가신 때가 6월 며칠이었습니까? 6월이 아니라 9월 초였지요? 8월 말 3일 동안 열렸거든요, 방콕에서 아세안 의회총회. 거기를 갔을 때 우리가 아세안 특별정상회의도 앞두고 있고 그래서 특별히 제가 의원들한테 의견들을 많이 물어봤어요. 거기 나와 있는 외교관들, 10개국에서 한 300명이 나왔더라고요. 다 많이 물어봤고 또 아까 얘기한 태국·라오스·미얀마, 3개국에 대해서는 대통령의 방문이 바로 이틀 뒤인가, 9월 초로 돼 있었기 때문에 더 자세히 물어봤어야 했는데 이런 얘기들을 거의 다 해요, '첨단산업 쪽에 우리나라의 단지도 대줄 테니 한국이 들어와라'. 또 공해산업이 아닌 정보산업 같은 그런 것......",
n_id.161,o_id.49,이석현 위원,"어떤 데는 아주 삼성을 딱 찍어요. 그러면서 뭔 얘기를 하느냐 하면 메콩 국가들은 '특별히 왜 베트남에만 한국이 들어가느냐', 라오스도 그런 얘기 하더라고요. '우리나라에 들어오면 산업단지 내주려고 다 준비돼 있고 여러 면에서, 인건비가 싸고 다 협력이 되는데 왜 베트남하고만 가깝게 지내느냐' 이런 얘기들을 라오스도 했고 다른 나라도 비슷한 얘기를 많이 했어요. 그런 부분에 대해서 우리 정부에서는 어떤 입장을 가지고 있어요?",
n_id.162,o_id.49,이석현 위원,"그리고 하나 더 보태면 요새 관광을 많이 하는 시대가 되니까 우리 한국 국적기 증편, '국적기들 자주 좀 해 달라' 그런 얘기들을 많이 해요. 만일에 이번 정상회담에도 실무선에서 그런 얘기들을 많이 할 텐데 그런 데 대해서는 어떻게 준비하고 계십니까?",
n_id.163,o_id.50,외교부제1차관 조세영,우선 신남방 지역에서 베트남이 아주 돌출돼 있는 것은 사실입니다. 사실이고 지금 무역 규모가 한국하고의 사이에서 아마 일본을 곧 추월한다는 예측도 있고요. 그럴 정도인데 그러면 우선 베트남하고 잘되는 것은 환영할 일입니다만 너무 또 집중돼 있을 때 주변 국가들과의 관계도 신경을 써야 된다는 말씀에 저희들이 십분 공감을 하고 노력하도록 하겠습니다.,
n_id.164,o_id.50,외교부제1차관 조세영,말씀하신 중에 혹시 참고가 되실 사항으로서는 지금 미얀마에 한국형 산업단지를 건설하고 있는 프로젝트도 있고요. 그래서 저희들이 재정이 허락하는 범위 내에서는 가급적이면 베트남 이외의 여타 국가들에 대해서 그 나라의 수준과 희망에 맞는 맞춤형으로 그런 사업들을 발굴하려는 노력을 계속 하고 있습니다. 그렇지만 또 그런 지적을 해 주셨기 때문에 저희들이 베트남 이외의 국가들이 어떤 것을 원하고 또 협력을 더 강화할 여지가 있는지 저희들이 조금 더 적극적으로 한번 발굴을 하고 노력을 해 보도록 하겠습니다.,
n_id.165,o_id.51,이석현 위원,"그리고 우리 K-pop이 동남아에 대단히 인기가 있어 가지고 아주 효과가 정말 좋습니다. 그래서 한 단적인 예를 얘기하면 싱가포르 의원친선협회장을 맡고 있어 가지고 자주 가는데 2년 전에 갔을 때 거기 국회부의장이, 연세 있는 분이지요, 국회부의장이니까. '송송 커플 결혼한다더라' 하면서 나한테 묻더라고. 그래서 젊은 사람도 아니고 연세 있는 분이 '송송 커플이 결혼한다면서요?' 해서 깜짝 놀라 가지고 나는 속으로는 그런 말을 들어 본 것도 같고 안 들어 본 것도 같고 그래서 무조건 그냥 '예, 곧 결혼한답디다' 이래 버렸던 기억이 있거든.",
n_id.166,o_id.51,이석현 위원,"그런데 이번에 갔더니, 2년 됐는데 이번에 말리키 선임 국무장관한테 내가 그 얘기를 했어요. '싱가포르가 우리 K-pop이 대단합디다. 2년 전에 왔을 적에 국회부의장이 송송 커플 결혼하는 것을 다 압디다' 했더니 '저는 이번에 이혼한 것도 압니다' 이러더라고. 그래서 정치인들이, 일반인들만 그런 게 아니라 그렇게 유명해요. 한 3년 됐나, 베트남 호치민 쪽에 갔을 때도 CJ가 거기 들어와 있더라고. 본사처럼 큰 빌딩을 거기에 가지고 있어요, 샀는지 빌렸는지 모르겠는데. 그래 가지고 사업 분야를 하는데 특히 E&M 분야하고 엔터테인먼트 분야가 베트남 전체 점유율의...... 상영관이 필요할 것 아닙니까, 영화를 하려면?",
n_id.167,o_id.52,외교부제1차관 조세영,"예, 극장.",
n_id.168,o_id.53,이석현 위원,"상영관을 많이 확보해서, 우리나라도 상영관을 확보하고 있는 3대 회사인가 다 그냥 쥐고 있더구먼. 상영관 점유율이 35%나 되더라니까.",
n_id.169,o_id.53,이석현 위원,"그래 갖고 내가 '글쎄, 왜 이렇게 우리나라가 여기 외국에 와서 이런 게 잘되느냐?' 했더니 'K-pop이 대단합니다', 그래서 K-pop을 떠나서 신남방정책을 생각할 수 없겠다 하는 생각이 들더라고. 그쪽을 공략하는 데는 그게 대단히 중요해요.",
n_id.170,o_id.53,이석현 위원,"심지어 잠깐 우스갯소리 같기도 하지만 어떤 외교관은 그런 얘기 해요. '뭘 좀 그 나라에 부탁할 일이 있었는데, 잘 안 되던데 딸이 원한다고 해서 K-pop 누구 사인 받아다 줬더니 잘됐습니다' 이런 사람도 있어요. 그래서 내가 부산에 왔을 때도 뭔가 K-pop을 좀 들먹이고 활용할 방법이 없는가......",
n_id.171,o_id.53,이석현 위원,혹시 그때 공연도 좀 합니까?,
n_id.172,o_id.54,외교부제1차관 조세영,"예, 합니다. 저희들이......",
n_id.173,o_id.55,이석현 위원,누가?,
n_id.174,o_id.56,외교부제1차관 조세영,"싸이, 보아는 나오는 것 같고요. 사실은 BTS 좀 해 보려고 했는데 BTS는 안 된 것 같습니다. 안 됐고......",
n_id.175,o_id.57,이석현 위원,거기는 안 된다고......,
n_id.176,o_id.58,외교부제1차관 조세영,"예, 그래서 지금 위원님 지적하신 대로 저희가 그런 아이디어를 갖고 K-pop 같은 부대 행사가 있습니다.",
n_id.177,o_id.59,이석현 위원,그것을 해야 되겠다 하는...... 그 덕을......,
n_id.178,o_id.60,외교부제1차관 조세영,"창원에서 별도로 또 행사를 하고요, 문화행사를 합니다.",
n_id.179,o_id.61,이석현 위원,창원?,
n_id.180,o_id.62,외교부제1차관 조세영,예.,
n_id.181,o_id.63,이석현 위원,그렇습니까?,
