new_id,ori_id,speaker,utterance,note
n_id.321,o_id.138,전문위원 배용근,자문위원이 어떤 정치적 활동을 했을 때에 운영위원회에서 의결이 있을 때까지 기다릴 때까지는 시간이 좀 있습니다. 그래서 아예 이런 사유가 나타났을 때를 인지한 때부터 바로 직무를 정지시키게끔 하려는 취지라고 보입니다. ,
n_id.322,o_id.139,김세연 위원,다른 법에는 이런 유사조항들이 있습니까? ,
n_id.323,o_id.140,전문위원 배용근,이런 사례는 거의 없습니다. ,
n_id.324,o_id.141,소위원장 심윤조,위촉을 해제하는 경우가 명문화되어 있습니까? ,
n_id.325,o_id.142,민주평화통일자문회의사무처장 박찬봉,"예, 있습니다. ",
n_id.326,o_id.143,소위원장 심윤조,어디에 되어 있습니까? ,
n_id.327,o_id.144,민주평화통일자문회의사무처장 박찬봉,운영위원회의 의결을 통해서 할 수 있도록 되어 있습니다. ,
n_id.328,o_id.145,소위원장 심윤조,"아니, 그러니까 위촉을 해제하는 경우 그 사유, 사유에 대한 명문화된 규정이 있느냐 하는 겁니다. ",
n_id.329,o_id.146,민주평화통일자문회의사무처장 박찬봉,"예, 몇 가지 해당 사항이 있습니다. ",
n_id.330,o_id.147,소위원장 심윤조,"그런데 그 전에, 사유는 나중에 보여 주시고 지금 처장님 답변에 의하면 운영위원회 의결이 있으면 위촉을 해제한다고 말씀하셨잖아요? ",
n_id.331,o_id.148,민주평화통일자문회의사무처장 박찬봉,예. ,
n_id.332,o_id.149,소위원장 심윤조,그런데 이 법은 '위촉을 해제하는 경우 그 사유가 인지한 날부터 운영위원회의 의결이 있을 때까지' 그러니까 '그 사유가 인지한 날'을 누가 규정합니까? ,
n_id.333,o_id.150,민주평화통일자문회의사무처장 박찬봉,그런 것들이 명확하지 않은 거지요. ,
n_id.334,o_id.151,소위원장 심윤조,직무 정지를 누가 시킵니까? 직무 정지의 주체가 누굽니까? ,
n_id.335,o_id.152,민주평화통일자문회의사무처장 박찬봉,그런 것들도 사실은 불명확합니다. ,
n_id.336,o_id.153,소위원장 심윤조,"그러니까 사유는 나중에 말씀하고, 이 법만 봐도 이게 실제 집행이 불가능한 규정이 아닌가 저는 이런 생각이 들어요. ",
n_id.337,o_id.153,소위원장 심윤조,"그건 그렇고 사유, 어디에 규정되어 있는 겁니까, 사유가? ",
n_id.338,o_id.154,민주평화통일자문회의사무처장 박찬봉,법 제16조에 되어 있습니다. ,
n_id.339,o_id.155,소위원장 심윤조,쭉 불러보시지요. ,
n_id.340,o_id.156,민주평화통일자문회의사무처장 박찬봉,"""1. 위원이 직무수행에 불성실하다고 인정된 때"", ""2. 위원이 법령을 위반하거나 위원으로서의 품위를 현저히 손상하는 행위를 한 때"", ""3. 그 밖에 통일자문회의의 목적을 달성하기 위하여 위원을 교체할 필요가 있다고 인정하는 때"" 이렇습니다. ",
n_id.341,o_id.157,소위원장 심윤조,전문위원이 얘기한 정치활동은 안 들어가 있네? ,
n_id.342,o_id.158,전문위원 배용근,"그것은 포괄적으로 ""2. 위원이 법령을 위반하거나""...... ",
n_id.343,o_id.159,소위원장 심윤조,"그러니까 이게 굉장히 자의적이라는 말이에요. 그러니까 이 자의적인 것을 어떻게, 사유를 누가 인지하고 누가 그걸 결정하느냐인데 저는 법 자체가 지금 성립하지 못하는 내용을 써놨다는 생각이 들어요. 모든 게 다 운영위원회 의결이 있어야 결정되는 것 아닙니까? ",
n_id.344,o_id.160,민주평화통일자문회의사무처장 박찬봉,그렇습니다. ,
n_id.345,o_id.161,소위원장 심윤조,그러니까 이것은 운영위원회 의결이 있어야만 해제되는 건데...... ,
n_id.346,o_id.162,민주평화통일자문회의사무처장 박찬봉,"예, 그 이전에 정지를 한다는...... ",
n_id.347,o_id.163,소위원장 심윤조,"그 이전에 정지를, 어떻게 그 사유를 인지하고 그 판단을 누가 하며 누가 결정을 하느냐. 결국 운영위원회가 결정을 한다 그러면 다 똑같아지는 내용이 되는 것 같습니다. ",
n_id.348,o_id.163,소위원장 심윤조,"심 위원님, 어떻게 하실지...... ",
n_id.349,o_id.164,심재권 위원,"저는 처장님 말씀에, 어떻든 자의적으로 행해질 수 있다라는 부분에 동의를 하고 이 부분은 문제를 갖고 있다고 생각합니다. ",
n_id.350,o_id.165,소위원장 심윤조,김태호 위원님...... ,
n_id.351,o_id.165,소위원장 심윤조,알겠습니다. ,
n_id.352,o_id.165,소위원장 심윤조,"그러면 의사일정 제5항 김성곤 의원이 대표발의한 민주평화통일자문회의법 일부개정법률안, 그리고 의사일정 제6항 박민수 의원이 대표발의한 민주평화통일자문회의법 일부개정법률안은 각각 본회의에 부의하지 아니하고 소위에서 논의한 대로 동 안건들을 통합 조정한 대안을 우리 위원회 안으로 제안하고자 하는데 이의 없으십니까? ",(｢없습니다｣ 하는 위원 있음)
n_id.353,o_id.165,소위원장 심윤조,가결되었음을 선포합니다. ,
n_id.354,o_id.165,소위원장 심윤조,회의시간이 많이 경과되었습니다. ,
n_id.355,o_id.165,소위원장 심윤조,오늘 회의는 이것으로 마치겠습니다. ,
n_id.356,o_id.165,소위원장 심윤조,"다음 회의는 내일, 4월 29일 오후 2시에 회의를 열어서 외교부 소관 안건에 대해 심사하도록 하겠습니다. ",
n_id.357,o_id.165,소위원장 심윤조,내일 소위에서는 국제빈곤퇴치기금법안에 대한 공청회가 2시부터 시작되어 진술인들의 의견을 청취할 예정인 관계로 시간을 엄수하셔서 참석해 주시기 바랍니다. ,
n_id.358,o_id.165,소위원장 심윤조,위원님들 장시간 안건 심사를 하시느라 수고 많으셨습니다. ,
n_id.359,o_id.165,소위원장 심윤조,정부와 전문위원 그리고 관계 직원 여러분들도 수고 많으셨습니다. ,
n_id.360,o_id.165,소위원장 심윤조,산회를 선포합니다. ,
