new_id,ori_id,speaker,utterance
n_id.424,o_id.336,이춘석 위원,준비기간이 필요한 것은 시간을 주고 준비기간이 필요 없는 것은 바로 하자고요.
n_id.425,o_id.337,법무부법무심의관 장영섭,위임 안 되는 거는 즉시 하는데 소급효는 의제가 안 되는 거로...... 시행령에 위임된 거는 6개월로 하고...... 
n_id.426,o_id.338,이춘석 위원,시간을 주고 나머지는 즉시......
n_id.427,o_id.339,법무부법무심의관 장영섭,어쨌든 위임 안 된 것은 즉시 하되 소급효는 안 되게 이 법 시행 이후에 체결된 계약부터......
n_id.428,o_id.340,소위원장 권성동,그래서 다시 한번 의결하겠습니다.
n_id.429,o_id.340,소위원장 권성동,"'주택임대차보호법 법무부 종합의견' 이 문건 중에서 1항, 2항, 3항, 6항에 대해서 합의를 봐서 위원회안으로 이렇게 제시를 했는데요, 그중에 3항 확정일자 부여기관의 차임 등에 대한 정보제공 그리고 6항 보증금의 월차임 전환율 상한제는 대통령령에 위임을 하였기 때문에 시행일을 대통령령을 준비하는 시간 등을 고려해서 2014년 1월 1일부터 시행...... "
n_id.430,o_id.341,법무부법무심의관 장영섭,1번도 중소기업 직원용도 확정일자와 관련되어 있기 때문에 1번도 6개월.......
n_id.431,o_id.342,소위원장 권성동,그러면 다시 하겠습니다.
n_id.432,o_id.342,소위원장 권성동,"'주택임대차보호법 법무부 종합의견' 문건 중에서 1항, 2항, 3항, 6항에 관해서 소위에서 논의한 안건을 위원회안으로 제시해서 가결되었습니다. "
n_id.433,o_id.342,소위원장 권성동,"그런데 그중에 시행일과 관련해서 1항 중소기업 법인의 직원용 주택 임차 시 대항력 인정 부분 그리고 3항 확정일자 부여기관의 차임 등에 대한 정보제공, 6항 보증금 월차임 전환율 상한제, 이 3개의 항에 대해서는 대통령령을 정비할 시간이 필요하므로 2014년 1월 1일부터 시행하기로 하고 나머지 부분에 대해서는 공포일로부터 시행하기로 수정 의결하고자 하는데 이의 있으십니까? "
n_id.434,o_id.343,서기호 위원,"잠깐만요, 1항에서 왜 이 부분도 포함되지요? 아까 확정일자 어떤 거를 말씀하시는지...... "
n_id.435,o_id.344,법무부법무심의관 장영섭,중소기업도 확정일자 부여절차가 있는데 지금 확정일자 부여와 관련된 정비가 필요하기 때문에...... 
n_id.436,o_id.345,서기호 위원,어떤 거를 말씀하시는지...... 이거요?
n_id.437,o_id.346,법무부법무심의관 장영섭,"아닙니다. 그거는 상가고, 주택임대차......"
n_id.438,o_id.347,서기호 위원,"아, 주택임대차보호법. "
n_id.439,o_id.348,법무부법무심의관 장영섭,예.
n_id.440,o_id.349,소위원장 권성동,다 양해가 되셨지요? 
n_id.441,o_id.350,서기호 위원,"예, 됐습니다."
n_id.442,o_id.351,소위원장 권성동,그래서 가결하고자 하는데 이의 있으십니까? 
n_id.443,o_id.351,소위원장 권성동,가결되었음을 선포합니다. 
n_id.444,o_id.352,소위원장 권성동,"그리고 상가건물 임대차보호법에 관해서는 '법무부 종합의견' 문건 1항, 3항, 4항, 6항, 7항을 위원회안으로 제시해서 가결하고자 합니다. "
n_id.445,o_id.352,소위원장 권성동,"다만 시행일 중에 대통령령으로 정하여야 될 부분이 6항 차임 등 증액상한과 보증금 차임 전환비율 법정화인데 이 부분에 대해서는 2014년 1월 1일부터 시행하는 것으로 하고 나머지 부분에 대해서는 공포일로부터 시행하는 것으로 정리하였습니다. 그리고 적용례는 시행 후 새로 발생하는 사유에 대해서만 신법을 적용하는 것으로, 상가건물 임대차보호법을 적용하는 것으로 정리하고자 합니다. "
n_id.446,o_id.352,소위원장 권성동,이러한 내용에 대해서 의결하고자 하는데 이의 있으십니까? 
n_id.447,o_id.353,전해철 위원,"여전히 그러면 이것도 계속 심의...... 남겨 놓는 거로 하고, 상가도."
n_id.448,o_id.354,소위원장 권성동,나머지 부분에 대해서는 어떻게......
n_id.449,o_id.355,전해철 위원,남겨 둬도 되는 거 아니에요?
n_id.450,o_id.356,소위원장 권성동,그렇지요. 
n_id.451,o_id.357,전문위원 문광섭,소위에 계류 중입니다.
n_id.452,o_id.358,소위원장 권성동,나머지 채택 안 된 부분에 대해서는 계속 심사하는 것으로 하겠습니다.
n_id.453,o_id.358,소위원장 권성동,이의 없으시지요? 
n_id.454,o_id.358,소위원장 권성동,가결되었음을 선포합니다. 
n_id.455,o_id.358,소위원장 권성동,그리고 주택임대차보호법도 역시 법 시행 후 새로 발생한 사유에 대해서만 신법 적용하는 것으로 정리를 하겠습니다.
n_id.456,o_id.358,소위원장 권성동,이의 없으시지요? 
n_id.457,o_id.359,소위원장 권성동,의사일정 제22항에서부터 제28항까지 채권의 공정한 추심에 관한 법률 일부개정법률안 7건을 일괄하여 상정합니다. 
n_id.458,o_id.359,소위원장 권성동,이것까지만 하고......
n_id.459,o_id.360,전해철 위원,"잠깐만요, 그러면 제 이야기 들어 보세요. "
n_id.460,o_id.360,전해철 위원,제가 다툼이 없이 할 테니까 이거 하기 전에 상설특검에 대해서 논의 방안 이야기를 한번 합시다. 내가 오늘은 결론은 안 낼 게요.
n_id.461,o_id.361,박범계 위원,지금 안 돼요.
n_id.462,o_id.362,소위원장 권성동,그러면 이거는 나중에 하고?
n_id.463,o_id.363,전해철 위원,이거는 나중에 하고......
n_id.464,o_id.364,소위원장 권성동,그래요. 그러면...... 
n_id.465,o_id.365,전해철 위원,어차피 의견을 내가 듣고...... 
n_id.466,o_id.366,소위원장 권성동,그러면 이거 논의하기 전에 의사일정 제50항에서 제52항까지 상설특별검사의 임명 등에 관한 법률안 등 3건에 관해서 먼저 대강의 논의 방향을 정하기 위해서 논의를 한 후에 앞으로 돌아가는 방향으로 그렇게 하겠습니다.
n_id.467,o_id.366,소위원장 권성동,그러면 먼저 전해철 위원님 의견 얘기해 주십시오. 
n_id.468,o_id.367,전해철 위원,전문위원의 검토의견 같은 거 필요 없어요?
n_id.469,o_id.367,전해철 위원,지금 제50항부터 제52항까지 했지요? 제50항부터 제52항 상정한 거지요? 
n_id.470,o_id.367,전해철 위원,"이미 제가 몇 차례 말씀드렸으니까 다시 한번 강조드리면 이 법안은 우리가 6월 말, 7월 2일 임시국회까지 끝내야 된다 이렇게 합의했던 것으로 안다는 거고요. "
n_id.471,o_id.367,전해철 위원,"그다음에 두 번째는 제가 논의를 해야 된다고 이야기를 한 게 지금 정부도 그렇고 새누리당도...... 소위원님들한테 말하는 게 아니라 안을 내야 논의가 된다고 생각합니다. 그러니까 이미 여야 합의하고 수차례 대통령님이나 또 정부에서도 이야기했는데 지금 민주당에서 안을 내서 상정된 거는 상당 부분 시간이 됐기 때문에 이것을 할 의지가 있다면, 그러니까 오늘 적어도...... 우리의 개략적인 의견은 이 법안에 담겨 있습니다. 법사위원이었던 최원식 위원, 박범계 위원 그리고 서기호 위원님까지 모두가 법사위원들이 발의를 했기 때문에 여기에 대해서 찬반 또는 특히 정부도 이거에 대한 정확한 안, 그냥 반대하는 안이 아니라 대안이 뭐다 이렇게 이야기를 해 주시고 또 다른 새누리당 위원 분도...... "
n_id.472,o_id.368,소위원장 권성동,"오케이, 알겠습니다. "
n_id.473,o_id.369,전해철 위원,그런 게 있으면 이야기해 주시는 게 맞다 이렇게 생각합니다. 
n_id.474,o_id.370,소위원장 권성동,거기에 대해서 제가 위원장이 아니고 여당 입장을 짧게 얘기하고 마무리 짓는 것으로 하겠습니다. 
n_id.475,o_id.370,소위원장 권성동,지금까지는 특위가 있었기 때문에 특위의 논의 경과를 지켜보고 또 특위의 입장을 존중해서 그것을 법안에 반영하기 위해서 논의를 사실은 시작하지 못했는데 오늘 김도읍 위원께서 관련 법안을 제출했는지 모르지만 제출한다는 얘기를 들었습니다. 그래서 그 법이 나오면...... 그리고 특위가 제 기억으로는 6월 말까지...... 사개특위 6월 말까지 존속하는 거 아닙니까?
n_id.476,o_id.371,수석전문위원 임중호,9월 말입니다.
n_id.477,o_id.372,소위원장 권성동,9월이에요?
n_id.478,o_id.373,수석전문위원 임중호,예.
n_id.479,o_id.374,소위원장 권성동,그래서 어쨌든 간에 하여튼 그렇게 제출됐기 때문에 특위의 논의 경과를 지켜보면서 9월 말까지 특별한 안이 안 나오고 또 9월 중에도 진행 상황이 별로 없다 그런다면 하여튼 가급적 빠른 시간 내에 그 부분에 대해서 소위에서 논의하는 것으로 이렇게 저희들도 방침을 정했다는 말씀을 드리고 더 자세한 얘기는 다음에 하시고 오늘 시간이 많이 지났기 때문에 그렇게 하는 게 어떻겠습니까? 
n_id.480,o_id.375,전해철 위원,"아니, 정 뭐하면 의결이 아니고 위원장님이 가시더라도 조금 진행할게요, 그러면. 왜 그러냐 하면 정부 의견도 듣고 해야 되니까......"
n_id.481,o_id.376,소위원장 권성동,그러면......
n_id.482,o_id.377,전해철 위원,"아니, 그러면 오늘은 산회나 이런 거 다 맡기고 가는 것인가요?"
n_id.483,o_id.378,소위원장 권성동,예.
n_id.484,o_id.379,이춘석 위원,실제로 아무런 의결이 못 이루어지는데 성원이 안 돼서......
n_id.485,o_id.380,소위원장 권성동,"그거는 다음에 또 전체회의에서도 있고 하니까 얘기를 합시다, 그때."
n_id.486,o_id.381,전해철 위원,"일단 정부 의견만 할게요, 가시려면 알아서 하시고. "
n_id.487,o_id.381,전해철 위원,지금 정부 입장이 뭡니까? 그러니까 이 법안이 나온 거에 대한 안을 갖고 오셨어요? 
n_id.488,o_id.382,법무부차관 국민수,아직 구체적인 안은 못 갖고 왔습니다. 
n_id.489,o_id.383,전해철 위원,예?
n_id.490,o_id.384,법무부차관 국민수,구체적인 안은 못 갖고 왔습니다.
n_id.491,o_id.385,전해철 위원,왜 그러지요?
n_id.492,o_id.386,법무부차관 국민수,저희가 아직 계속 검토를 하고 있으면서 하기 때문에요. 특검법안은 특검수사의 효율성 확보라든지 특검과 수사관계자와의 이해충돌 시 해결방안...... 
n_id.493,o_id.387,전해철 위원,"아니, 그러면 지금 다른 법안심사하고 다른 거 아니에요. 이 법안에 대해서 심사를 하려고 하면 검토보고서든 정부안이 있어야 되는 것 아닙니까? 왜 유독 이 법에 대해서만 그러지요? 정확한 실체를 이야기를 해 보세요. 뭐예요, 그러면?"
n_id.494,o_id.388,법무부차관 국민수,저희도 기본적인 방침은 빠른 시일 내에 특검법안을 만드는 거에 동의를 하고 있고 그 안을 검토를 하고 있는데 다만 이게 여러 가지 고려할 사항이 많기 때문에 검토가 필요한 부분이고 저희 법무부 방침도 지금 여야 합의로 상설특검법안을 올해 중에 가급적 빨리 한다고 방침을 세웠고 또 국정과제에도 포함되어 있기 때문에 최대한 검토하고 있고 저희도 좋은 방안을 마련하려고 노력 중에 있습니다. 
n_id.495,o_id.389,전해철 위원,"정치적인 공세를 하는 게 아니라 실질로 해서 그렇게 이야기를 하면 법무부가 되겠어요? 아니, 이 법안이 상정돼서 오늘 제1소위에서 안 한다고 생각을 하니까 그렇게 말을 하는 거지......"
n_id.496,o_id.390,법무부차관 국민수,그렇지는 않습니다. 
n_id.497,o_id.391,전해철 위원,"이게 예를 들어서 더 나아가서 의결까지 할 수 있다고 생각을 하면 법무부가 그런 입장으로 그냥 와 갖고 되겠습니까? 말이 안 되잖아요, 일단 내용을 떠나 가지고. 그러니까 정치공방에 법무부가 들어올 필요는 없는데 예컨대...... "
n_id.498,o_id.392,법무부차관 국민수,지금 여야에서 논의 중에 있고 또 특위가...... 
n_id.499,o_id.393,전해철 위원,이렇게 하세요. 오늘 제가 비판과 문제 지적을 하는 것은 제가 계속 이야기해 봤자 같은 이야기이고 어찌 됐든 다음 회의 때는 법부부도 안을 가지고 나올 수 있도록 하세요. 
n_id.500,o_id.394,법무부차관 국민수,"예, 최대한 노력하겠습니다."
n_id.501,o_id.395,전해철 위원,이거 위원장님 들으셔야 되는데...... 법무부에 대한 이야기를 했고요.
n_id.502,o_id.396,소위원장 권성동,그러니까...... 
n_id.503,o_id.397,전해철 위원,"그다음에 아까 위원장님 이야기할 때 그 부분에 대해서 여전히 지금 계속 이야기하는데...... 오늘 사실 합의문도 다 있어요. 그러니까 사개특위에서 하는 것이 아니라 수차례 원내대표단에서 법사위, 상임위에서 한다는 것을 제가 오늘 오전도 확인했다니까요."
n_id.504,o_id.398,소위원장 권성동,"그거는 여러 번 논의를 했던 사항이고 주장이 다른 부분이니까 다 알고 있어요, 무슨 말씀하시는지. "
n_id.505,o_id.399,전해철 위원,"아니, 그런데 위원장님이 또 그렇게 이야기를 하면 내가 제1소위에 대해서 기대할 게 없잖아요. "
n_id.506,o_id.400,소위원장 권성동,"아니, 그런데 우리 입장은 그렇지만 특위 위원장이나 특위 간사는 자기들이 논의한다고 법사위는 일단 빠져 있으라고 우리 당 특위위원장이 그렇게 얘기를 하고 있어요. 그러니까 입장이 서로 다른 거예요."
n_id.507,o_id.401,전해철 위원,"그러면 이렇게 할게요. 내가 오늘 오전에도 확인을 했는데 위원장님이 새누리당 원내대표나 부대표하고 확인을 한번 해 보시라니까. 왜 아니라고 이야기하는데, 원내부대표나 대표는. "
n_id.508,o_id.402,소위원장 권성동,"그 사람도 똑같은 얘기해요, 나한테는. 당연히 특위에서 먼저 해야지 무슨 상임위에서 하냐고, 그러면 특위는 뭐 하러 만들었냐 이렇게 얘기해요, 나한테는. "
n_id.509,o_id.403,이춘석 위원,"이중플레이를 하는 거예요, 이중플레이. "
n_id.510,o_id.404,소위원장 권성동,나한테 그렇게 얘기한다니까요.
n_id.511,o_id.405,전해철 위원,그러면 이 법은 어떻게 하자는 겁니까?
n_id.512,o_id.406,소위원장 권성동,그래서 일단 특위가......
n_id.513,o_id.407,이춘석 위원,다음 소위에서 논의한다 이거 약속하면 되는 거지요? 
n_id.514,o_id.408,전해철 위원,그러면 이렇게 하시지요. 일단 다음 소위하면 이거 역시도 최우선으로 논의하는 거 이 정도로 합시다.
n_id.515,o_id.409,소위원장 권성동,최우선은 아니고...... 
n_id.516,o_id.410,이춘석 위원,같이 함께 논의한다.
n_id.517,o_id.411,소위원장 권성동,같이 논의하는데 소위가 언제 될지 모르겠네.
n_id.518,o_id.412,전해철 위원,"아니, 그거야 다른 문제고."
n_id.519,o_id.413,이춘석 위원,다음에 언제가 되든 간에 소위에서 우리가 의안을 상정해서 협의한다 이런 문구까지......
n_id.520,o_id.414,소위원장 권성동,"좋아, 오케이. "
n_id.521,o_id.415,전해철 위원,최우선 논의한다 이렇게......
n_id.522,o_id.416,소위원장 권성동,최우선 아니고 순서대로 논의한다.
n_id.523,o_id.417,서기호 위원,그러면 우선 논의한다 이거는 어때요?
n_id.524,o_id.418,소위원장 권성동,그러면 오늘 고생들 많이 하셨습니다. 
n_id.525,o_id.418,소위원장 권성동,"그리고 유의미한, 의미 있는 성과를 내주신 소위 위원님들께 감사를 드리고 날 더운데 고생하신 법무부 차관님, 법원행정처 차장님을 비롯한 관계인 여러분 감사드립니다."
n_id.526,o_id.418,소위원장 권성동,산회를 선포합니다.
