new_id,ori_id,speaker,utterance,note
n_id.1,o_id.1,소위원장 박준영,성원이 되었으므로 제346회 국회(정기회) 기획재정위원회 제2차 예산결산기금심사소위원회를 개의하겠습니다.,
n_id.2,o_id.1,소위원장 박준영,매우 어렵고 혼란스러운 시기입니다마는 바쁘신 중에도 참석해 주신 위원님들과 관계자 여러분들께 감사드립니다.,
n_id.3,o_id.1,소위원장 박준영,회의를 시작하기에 앞서서 오늘 진행에 대한 간단한 안내 말씀드리겠습니다.,
n_id.4,o_id.1,소위원장 박준영,"배부해 드린 유인물은 지난 회의 때 소위원회에서 계속 심사하기로 한 안건에 대한 심사결과를 정리한 자료입니다. 일부 이견이 있을 수가 있는데 한번 면밀히 보시기를 바라고, 우선 여기에 대해서 수석전문위원의 설명과 정부 측 답변을 듣고 위원님들의 의견을 정리한 다음 합의된 안건을 의결하는 순서로 진행하겠습니다.",
n_id.5,o_id.1,소위원장 박준영,다음 주 월요일 예정된 전체회의에서 우리 소위원회의 심사결과가 처리될 예정입니다. 효율적인 심사로 월요일 전체회의가 잘 이루어지도록 위원님 여러분들의 적극적인 협조를 부탁드립니다.,
n_id.6,o_id.2,소위원장 박준영,그러면 의사일정에 들어가겠습니다.,
n_id.7,o_id.2,소위원장 박준영,"의사일정 제1항 기획재정부 및 관세청 소관 2017년도 예산안, 의사일정 제2항 공공자금관리기금 등 6개 기금의 2017년도 기금운용계획안, 의사일정 제3항 및 4항, 2건의 국가보증동의안, 이상 4건을 일괄해서 계속 상정합니다.",
n_id.8,o_id.2,소위원장 박준영,준비된 자료에 따라서 수석전문위원께서 설명해 주시기 바랍니다.,
n_id.9,o_id.3,수석전문위원 김광묵,자료 설명은 우선 제일 위에 있는 '소위심사자료 ②'라고 쓰여 있는 걸 기준으로 그 순서대로 해 나갈 건데요.,
n_id.10,o_id.3,수석전문위원 김광묵,"그리고 하나만 더 참고해 주실 것이 밑에 보면 길쭉하게 지난번 소위 심사결과라고 해서 예산 증감 사항 그리고 정부하고 의견을 조율한 부대의견(안), 이렇게 되어 있습니다. 여기에 대해서 의견을 다시 주시면 다시 정리하도록 하겠습니다.",
n_id.11,o_id.3,수석전문위원 김광묵,"지금 ②번을 갖고 설명을 드릴 텐데요, 일단 세출부터 먼저 하도록 하겠습니다.",
n_id.12,o_id.3,수석전문위원 김광묵,"우선 6페이지, 예비비입니다.",
n_id.13,o_id.3,수석전문위원 김광묵,전체 다 한꺼번에 설명을 드리겠습니다.,
n_id.14,o_id.3,수석전문위원 김광묵,"우선 당구장, 참고 표시 되어 있는 논의사항에 보면 예비비 예산이 좀 과다 편성되어 있기 때문에 3500억 정도를 삭감하자는 의견도 있었고 전체 예산 대비 비중이 낮으므로 원안을 유지하자는 의견이 있었습니다.",
n_id.15,o_id.3,수석전문위원 김광묵,"다음, 7페이지입니다.",
n_id.16,o_id.3,수석전문위원 김광묵,국회 시정요구사항에 따른 예비비 제도 개선 등에 대해서 여러 말씀이 있었습니다.,
n_id.17,o_id.3,수석전문위원 김광묵,"기획재정위원회가 2015년도 결산을 의결하면서 박스 처리된 시정요구를 했었는데, 예비비 사용에 대한 승인 내역에 대해서 아직 알지를 못하기 때문에 준수 여부를 확인할 수 없다. ",
n_id.18,o_id.3,수석전문위원 김광묵,그래서 부대의견에 보면 지금 현재 예산집행지침에 몇 가지 요건이 있는데 기획재정부는 그것을 관련 부령이나 대통령령이나 시행령 이런 데에다가 옮겨서 넣는 것이 어떠냐 하는 거지요.,
n_id.19,o_id.3,수석전문위원 김광묵,"그리고 또 하나가 지난번에 엄용수 위원님께서도 말씀한 적이 있는데, 사후적으로...... 이것도 사실상 사후적이나 마찬가지인데요, '국무회의 심의를 거쳐 대통령의 승인을 얻은 예비비사용계획명세서를' 이렇게 되어 있는데, 이미 국무회의를 거치고 그랬으니까 그걸 분기별로 묶어서 국회에 제출하는 게 어떠냐 하는 부대의견을 붙였는데 그것은 아직 정부하고 합의된 사항이 아닙니다. 그래서 다시 말씀드리고요.",
n_id.20,o_id.3,수석전문위원 김광묵,그 위에 보면 역사교과서 관련 예비비가 들어오면 철저히 봐야 된다는 의견도 있었고요.,
n_id.21,o_id.3,수석전문위원 김광묵,그리고 박스 안에 당구장 표시되어 있는 것처럼 기재부가 이번에 예산총칙에 규제프리존법이 통과되는 경우에 그 예비비 예산을 반영하고 있는데 이것에 대해서 적절치 않다는 지적도 있었습니다.,
n_id.22,o_id.3,수석전문위원 김광묵,이상입니다.,
n_id.23,o_id.4,소위원장 박준영,그러면 그것에 대해서 정부 쪽 의견이 어떤지 말씀하십시오.,
n_id.24,o_id.5,기획재정부제1차관 최상목,지난번에도 한번 간략히 말씀을 드렸습니다마는 처음의 예비비 예산 과다 편성 부분에 대해서는 일단 일반 예비비의 경우에는 저희가...... ,
n_id.25,o_id.6,소위원장 박준영,가만있어 봐.,
n_id.26,o_id.6,소위원장 박준영,"최 차관님, 오늘 우리가 굉장히 속도 있게 효율적으로 해야 돼요. 그리고 오후에 최 차관도 못 나오시지만 위원님들이 대개 지역구를 가시기 때문에 다른 위원님들도 시간에 대단히 문제가 있어요. 그러니까 압축적으로 해 가지고 가능하면 오후에 안 하고 끝내야 되니까 간단간단하게 답변하세요. ",
n_id.27,o_id.7,기획재정부제1차관 최상목,알겠습니다. ,
n_id.28,o_id.7,기획재정부제1차관 최상목,"일단 예비비 수준 자체가, 과거의 일반 예비비 전체 비중이 14～16년 정부안과 동일한 수준이기 때문에 저희는 과도한 증액이라고 보기 좀 어려운 부분이 있고요. ",
n_id.29,o_id.7,기획재정부제1차관 최상목,그다음에 재해 예비비의 경우에는 항상 어떤 일이 발생할지 모르기 때문에 최대한 과거의 예를 봤을 때 어느 정도는 충분한 재해 예비비는 가지고 있다가 어떤 예상치 못한 재해에 대비할 필요가 있지 않겠느냐는 의견을 갖고 있습니다.  ,
n_id.30,o_id.7,기획재정부제1차관 최상목,그리고 이것과 관련된 법률적인 근거를 둔다든지 국회에 보고를 해 달라는 부대의견과 관련된 부분은 법령에 사용 요건을 마련하는 것은 헌법과 국가재정법의 취지에 맞지 않는다는 생각이고요. ,
n_id.31,o_id.7,기획재정부제1차관 최상목,그리고 지난번에 주신 요구사항에 대해서는 정부가 성실히 그 요구사항을 준수해서 국가재정법과 헌법이 정한 절차에 따라서 저희가 국회의 심의를 받겠다는 말씀을 드리고요.,
n_id.32,o_id.7,기획재정부제1차관 최상목,"그다음에 예비비 사용계획을 미리 내라는 것은, 사실은 예비비 사용계획이 나올 수 있다는 것은 예비비의 기본적인 취지하고 맞지 않는 측면이 있다는 말씀들을 드립니다. ",
n_id.33,o_id.8,소위원장 박준영,위원님들 생각은 어떠세요?,
n_id.34,o_id.8,소위원장 박준영,또 답할 것 있나요?,
n_id.35,o_id.9,기획재정부제1차관 최상목,일단은 그렇습니다. ,
n_id.36,o_id.10,김종민 위원,우리가 빨리 얘기를 드려야 되니까......,
n_id.37,o_id.10,김종민 위원,"예비비는 지난번에 제가 그때 회의에 없어서 말씀을 드리라고 요청을 드렸는데요. 지난번 결산 때 15년도 예비비 사용에 대해서 문제 제기가 상당히 많았어요. 그래서 거기에 대해서 법률적으로 어떤 보완을 하자, 여러 가지 논의가 많았는데 그게 진행되지 않고 있고요.",
n_id.38,o_id.10,김종민 위원,"사실은 어떤 정치적 성격을 띤 사업에 정책홍보비가 많이 사용되어서 정말 우리 예산집행의 원칙에 어긋난다 이런 취지였는데, 일단 이 예비비에 대한 어떤 경고나 경종 차원에서라도, 이번에는 페널티를 한번 주는 차원에서라도 삭감을 해야 되고. ",
n_id.39,o_id.10,김종민 위원,"예비비가 충분히 있어야 된다고 말씀을 하시는데, 제가 쭉 자료를 뽑아 봤더니 하여간 12년도 이후에는 11%, 25%, 35%, 47%가 불용액입니다. 기본적으로 최소한 10% 이상이 항상 불용액으로 남고 있는 상황이어서 지금 이 문제에 대해서 우리 예산 운용에 뭔가 문제가 생길 것 같다 이런 우려는 제가 보기에는 아주 비상상황이 아니면 그럴 리도 없고, 또 내년이 대통령선거가 있는 기간이라 국정원이라든가 아니면 기타 정치적 오해를 받을 수 있는 사용이 제일 걱정스러운 거예요, 제가 보기에는.",
n_id.40,o_id.10,김종민 위원,그래서 그런 것에 대한 기관과 정부에 대한 나름대로의 메시지 차원에서라도 이번 국회에서 예비비 삭감을 결정해 주시는 게 좋겠다......,
n_id.41,o_id.10,김종민 위원,"그다음에 두 번째로 규제프리존 문제는, 재정평가에 대한 보상도 결국은 입법 전에 세부사업으로 집어넣은 것 아닙니까? 그러니까 이게 예비비로 편성되는 것하고는 또 안 맞아요. 서로 형평이라고 그럴까, 하여간 일관성이 없고 그래서 규제프리존 관련 사업도 일반회계의 세부사업으로 하고 예비비에서 빼는 게 맞다고 봅니다.",
n_id.42,o_id.11,기획재정부제1차관 최상목,지금 말씀하신 것에 대해서 제가 간단하게 답변드리겠습니다. ,
n_id.43,o_id.11,기획재정부제1차관 최상목,말씀하신 대로 경종을 울리는 차원에서 삭감을 하자고 하시는데 위원님들께서 고려해 주실 것은 일반예비비는 집행률이 높습니다. 한 90%에서 80%까지 집행률이 되어 왔습니다. 그래서 일반예비비 수준은 과거하고 비슷한 수준으로 되었고요.,
n_id.44,o_id.11,기획재정부제1차관 최상목,"문제는 목적예비비인데, 목적예비비는 작년에 재해가 적어서 그나마 40% 정도 집행률이고 그렇습니다. 그런데 11년, 12년은 100% 집행이 됐었습니다. 그때는 재해가 많아 가지고요.",
n_id.45,o_id.11,기획재정부제1차관 최상목,그러니까 목적예비비를 깎아 놓으면 사실 또 부담이 있습니다. 만약에 내년도에......,
n_id.46,o_id.11,기획재정부제1차관 최상목,"위원님 말씀의 취지는 이해가 갑니다마는 일반예비비는 지금 예년 수준이고, 목적예비비를 깎을 경우에는...... 집행률이 떨어지는 게 일단은 목적예비비입니다. 그런데 그 부분은 재해가 내년도에 어떻게 될지 모르기 때문에 항상 재해가 가장 많이 났을 때 수준까지는 아니더라도 그 수준으로 해 가지고 저희가 어느 정도 편성을, 버퍼가 있는 부분이 있거든요.",
n_id.47,o_id.11,기획재정부제1차관 최상목,"그 부분은 위원님 취지는 저희가 충분히 이해합니다마는, 여기 소위에서 깎았을 경우에는 그런 리스크도 있다......",
n_id.48,o_id.12,김종민 위원,규제프리존 3500억은?,
n_id.49,o_id.13,기획재정부제1차관 최상목,규제프리존 같은 경우에는 규제프리존법이 제정되어서 지금 입법이 지연되고 있기 때문에 정부 예산안 편성 시점에서 예산 규모와 집행 시점을 특정할 수 없는 상황이기 때문에 저희가 그 부분을 집어넣은 부분이 있습니다. ,
n_id.50,o_id.14,김종민 위원,"재정사업 보상예산처럼 일반회계 세부사업으로 집어넣으면 되잖아요, 입법을 전제로 해서 집행하는 것으로. ",
n_id.51,o_id.15,소위원장 박준영,"그런데 정부에서는 분기별로 보고하라는 것을 왜 안 하지요, 대통령 지시사항으로서 토론회 때 결정이 된 사항으로 보고가 되었는데? 그 보고를 안 하니까 지금 위원님들께서 자꾸 지적하시는 거 아니에요?",
n_id.52,o_id.16,수석전문위원 김광묵,예비비사용계획명세서는 이미 국무회의 심의를 거치고 대통령의 승인을 받은 거니까 그 정도는 제출할 수 있지 않느냐 이 얘기지요.,
n_id.53,o_id.17,소위원장 박준영,국회에 제출하기로 되어 있는데......,
n_id.54,o_id.18,기획재정부제1차관 최상목,"사용계획을 제출, 그게 뭐지요?",
n_id.55,o_id.19,박명재 위원,사용계획이 아니라 결산......,
n_id.56,o_id.20,수석전문위원 김광묵,사용계획명세서요.,
n_id.57,o_id.21,기획재정부기획조정실장 고형권,"사용계획명세서는 지출하기로 정부가 이미 결정한 건데, 여기에서는 사용계획이라고 돼 있어 가지고......",
n_id.58,o_id.22,수석전문위원 김광묵,"다시 고쳤어요, 명세서.",
n_id.59,o_id.23,기획재정부제1차관 최상목,사용계획명세서가......,
n_id.60,o_id.23,기획재정부제1차관 최상목,설명을 좀 해 주세요.,
n_id.61,o_id.24,기획재정부사회예산심의관 안일환,그런데 헌법 규정상 예비비는 정부가 지출하고 차기 연도에 결산에서 통제를 받게 되어 있기 때문에 헌법의 취지에 맞춰서......,
n_id.62,o_id.25,기획재정부제1차관 최상목,"아니, 그게 아니고 국무회의 승인을 받는 사용계획명세서를 왜 국회에 제출하지 못하는지를 말씀......",
n_id.63,o_id.26,소위원장 박준영,"그럽시다. 김 위원님, 얘기를 이렇게 오래하면 안 되고......",
n_id.64,o_id.26,소위원장 박준영,"어차피 국가는 비상사태가 있을 수가 있고, 결국은 국민들의 생명과 재산에 관한 문제거든요. 그러니까 예비비를 얼마를 깎거나 그래서 통과를 시키되, 이것을 엄격히 적용을 하도록 분기별로 사용계획이라든가 결과를 꼭...... 왜 그러냐 하면 이것을 정치적으로 이용하는 것을 지금 경계하는 것 아닙니까? 보고를 꼭 이행을 하도록......",
n_id.65,o_id.27,김종민 위원,"그런데 그것은 지난번 결산 때도 그런 취지로 해 갖고 승인을 해 준 거예요. 그때 제가 이것은 불승인해야 된다고 강력하게 얘기를 했는데, 그때도 그런 문제들 때문에 우리가 얘기를 했는데, 이번 같은 경우에도 지금 규제프리존에 3500억을 담아온 것을 보면 사실은 그런 취지가 전달이 안 되고 있어요.",
n_id.66,o_id.28,기획재정부제1차관 최상목,"위원님 말씀 중에 죄송한데요, 규제프리존 같은 경우에는 규제프리존법이 통과될 때 법에서 거기에 어떤 전략산업이 어떻게 들어가는지 내용이 바뀔 수가 있습니다. 그러니까 미리 세부예산에 잡을 수가 없습니다. ",
n_id.67,o_id.29,김종민 위원,위원장님도 그렇게 말씀을 하시니까 만약 이게 지금 당장 삭감이 어렵다면 예결위에서라도 검토하도록 부대의견을 좀 달아 주시면 좋겠어요. ,
n_id.68,o_id.30,기획재정부제1차관 최상목,그렇게 하겠습니다. ,
n_id.69,o_id.31,박명재 위원,"예비비 전체 규모에 대해서는 예결위에서 다룹니다. 다루게 되고 백번 옳으신 말씀인데, 다만 예비비의 경우에는 집행률이 낮기 때문에 예비비를 적게 해야 된다, 그것은 나는 동의할 수 없거든요.",
n_id.70,o_id.32,엄용수 위원,예비비는 원래 남아야 됩니다.,
n_id.71,o_id.33,박명재 위원,"예비비 남아야 됩니다, 쓰면 안 됩니다.",
n_id.72,o_id.34,김종민 위원,당연하지요. ,
n_id.73,o_id.34,김종민 위원,그런데 지난번 집행 내용이...... 지금 이렇게 집행되는 것에 대한 규제를 우리가 못 하잖아요.,
n_id.74,o_id.35,박명재 위원,내용 보고 좀 하도록 하세요.,
n_id.75,o_id.36,김종민 위원,그러니까 규제를 못 하니 이 부분에 대해서 정부가 경각심을 갖게 하는 방법이 예산 삭감밖에 없어요. ,
n_id.76,o_id.37,박명재 위원,"그래요, 너무 과대 편성하지 말고......",
n_id.77,o_id.38,기획재정부제1차관 최상목,하여튼 알겠습니다.,
n_id.78,o_id.39,김종민 위원,"그래서 일단 부대의견으로 전문위원님께서 한번 정리를 해 주시고, 하여간 삭감이 필요한데 규모나 내용에 대해서 예결위에서 검토해 달라......",
n_id.79,o_id.40,박명재 위원,전체적인 금액에 대해서는 예결위......,
n_id.80,o_id.41,김종민 위원,규제프리존 관련 예산에 대해서도 문제점을 지적해서 한번 문안을 잘 좀 만들어서 해 주세요.,
n_id.81,o_id.42,소위원장 박준영,그런데 내가 경험한 바로는 2012년인가 태풍이 왔는데 그때는 또 부족하니까 막 깎아서 주는 거예요. 그러니까 못해.,
n_id.82,o_id.43,엄용수 위원,제 생각에는 '삭감이 필요한데'라는 전제를 붙이기 전에 '사용에 대한 엄격한 통제가 필요한데' 하고 이렇게 가야 되는 거지 삭감을 전제로 해서 갈 것은 아닌 것 같거든. 지금 대외환경도 굉장히 복잡하고 한데......,
n_id.83,o_id.44,소위원장 박준영,보고를 철저히 하도록...... ,
n_id.84,o_id.45,김종민 위원,그 부분은 예결위에서도 검토하시면 되니까......,
n_id.85,o_id.46,수석전문위원 김광묵,"아니, 그런데 우리 위원회에서 부대의견을 채택하면서 '예결위에서 검토하라'는 부대의견을 채택하는 것은 좀 소관위......",
n_id.86,o_id.47,박명재 위원,괜찮아. '예결위에서 검토해 볼 것' 하면 돼.,
n_id.87,o_id.48,김종민 위원,그냥 검토하시라고 그래.,
n_id.88,o_id.48,김종민 위원,그렇게라도 기록을 남겨놔야지. ,
n_id.89,o_id.49,박명재 위원,내가 예결위 가서 얘기할게.,
n_id.90,o_id.50,김종민 위원,"그렇게 해, 그냥.",
n_id.91,o_id.51,소위원장 박준영,낯 뜨거워도 그렇게 합시다.,
n_id.92,o_id.52,수석전문위원 김광묵,예.,
n_id.93,o_id.53,김종민 위원,그것을 삭감하려면 한 시간 토론해야 돼. ,
n_id.94,o_id.54,소위원장 박준영,"그리고 보고를 하는 것은 철저하게 해야 됩니다, 보고하는 것은.",
n_id.95,o_id.55,수석전문위원 김광묵,그러면 사용계획명세서 제출 여부는 어떻게 정리하실 겁니까?,
n_id.96,o_id.56,기획재정부사회예산심의관 안일환,제가 여러 번 말씀드린 것처럼 예비비는 집행을 하고 사후 결산으로 국회 통제를 받게 되어 있는 게 법의 취지이기 때문에 그것에 맞춰서......,
n_id.97,o_id.57,수석전문위원 김광묵," 아니, 한 말씀만 드리면, 예비비사용계획명세서가 국무회의 심의를 거쳐서 대통령의 승인을 받은 건데 그것을 굳이 공개 못할 이유가 뭐가 있어요, 국정원 예산도 아닌데? 예비비를 차후에 승인을 받으라는 것은 긴급하니까 먼저 쓰라는 그 취지지......",
n_id.98,o_id.58,기획재정부사회예산심의관 안일환,예비비 안에는 지금 말씀하신 그런 것도 있기 때문에 그것을 다 쓰고......,
n_id.99,o_id.59,소위원장 박준영,"오케이, 됐어요. 꼭 보고를 하도록 부대의견에 그렇게 명시를 하세요.",
n_id.100,o_id.60,수석전문위원 김광묵,"예, 알겠습니다.",
n_id.101,o_id.61,김종민 위원,"전문위원님, '예결위'라는 문구가 들어가는 게 좀 부적절하면 그 문구를 빼고 하여간 문구를 적절하게 검토를 해 주세요.",
n_id.102,o_id.62,수석전문위원 김광묵,알겠습니다.,
n_id.103,o_id.63,기획재정부사회예산심의관 안일환,예비비를 사전에 계획해서 하는 것은 예비비 취지에 맞지 않습니다.,
n_id.104,o_id.64,엄용수 위원,사전 보고는 아니고......,
n_id.105,o_id.65,기획재정부제1차관 최상목,"위원장님, 죄송합니다.",
n_id.106,o_id.65,기획재정부제1차관 최상목,"한 말씀만 드리면, 그 부분도 제 생각으로 한다면 국가재정법을 고쳐서 국회에 보고하도록 하는......",
n_id.107,o_id.66,기획재정부사회예산심의관 안일환,지금 국가재정법이 올라가서 논의 중에 있으시거든요. 그러니까 법 개정할 때 이 사안을 논의들을 하시는 게 맞는 거지 지금 이것을 부대의견으로 법 개정 사안을 하는 것은 맞지 않은 것 같습니다. ,
n_id.108,o_id.67,기획재정부제1차관 최상목,법 개정의 논의가 필요하다는 정도의 얘기를 하시는 게 좋을 것 같습니다. 이게 법 개정 사항이기 때문에 부대의견에 그런 취지로 '법 개정 때 그런 논의가 필요하다' 이렇게 하시는 게 어떨까 싶습니다. ,
n_id.109,o_id.68,수석전문위원 김광묵,"적절히 협의해서, 지금 어차피 국가재정법 개정안을 심사를 하니까 그 취지에 맞춰서 그런 방향으로 노력을 검토하라고...... ",
n_id.110,o_id.69,엄용수 위원,반영 노력을 하라고......,
n_id.111,o_id.70,수석전문위원 김광묵,그러니까 사용계획서를 제도적 기반을 마련해 보도록 노력하라는 취지로......,
n_id.112,o_id.71,기획재정부제1차관 최상목,"이게 부대의견으로 할 수 있는 성격이 아니고, 국가재정법 해석과 관련된 부분이 좀 있는 것 같습니다. ",
n_id.113,o_id.72,수석전문위원 김광묵,"부대의견 문안을 좀 조정을 해 보겠습니다, 제도적 기반을 마련하라는 식으로 해서.",
n_id.114,o_id.73,소위원장 박준영,그렇게 고민을 해서 정리를 하세요. ,
n_id.115,o_id.73,소위원장 박준영,그다음에요.,
n_id.116,o_id.74,수석전문위원 김광묵,8페이지입니다.,
n_id.117,o_id.74,수석전문위원 김광묵,경제정책조정활성화사업 예산에서는 순수 정책조정 기능을 제외한 예산에 대해서는 감액할 것이냐의 여부에 대해서 논의하시기로 하셨습니다.,
n_id.118,o_id.74,수석전문위원 김광묵,"그러니까 보면 8억 300만 원 중에서 경제정책조정예산이 3억 300만 원인데, 기타 서비스산업 선진화, 글로벌산업경제포럼, 경제정책 개발을 어떻게 할 것인가에 대해서 논의를 해 주시면 되겠습니다.",
n_id.119,o_id.75,박명재 위원,"그때 결론 안 내렸나요, 지난번에? 어떻게 하기로 했어요?",
n_id.120,o_id.76,수석전문위원 김광묵,"예, 못 내렸습니다.",
n_id.121,o_id.77,기획재정부제1차관 최상목,저희가 이해하기로는 그때 이 부분에 대해서는 위원님들께서 이해해 주셨고요.,
n_id.122,o_id.77,기획재정부제1차관 최상목,단지 정병국 위원님께서 산업경제 국제포럼에 해외인사 초청사항이나 회의결과의 대책 등의 반영 여부를 확인해 달라고 그래서 저희가 자료를 준비해서 정병국 의원실에 설명을 드렸고요.,
n_id.123,o_id.77,기획재정부제1차관 최상목,"지금 위원장님께 이것을 드리겠습니다마는 그때 그 자료를 해서...... 저희가 14년도, 15년도의 산업경제 국제포럼과 서비스 국제포럼을 지금 자료에서처럼 열었고, 16년도에는 이것을 합쳐 가지고 전체 규모를 축소해서 융복합 신산업 육성방안이라고 하는 것을 열 예정입니다. 그래서 이런 것들이 해외인사를 초청해 가지고......",
n_id.124,o_id.77,기획재정부제1차관 최상목,"또 해외 결과는 그 뒤의 페이지 보면, 포럼 결과가 대통령 주재 무역투자회의에 반영된 내역입니다. 이렇게 설명을 드렸다는 겁니다. 그렇기 때문에 이 부분은 양해를 해 주시는 것으로 저희는 이해를 하고 있습니다.",
n_id.125,o_id.78,소위원장 박준영,"그런데 이것을 제목을 이렇게 해 놓으니까 국내행사인지 국외행사인지를 모르잖아요. 국외행사라고 그러면 돈이 많이 들어갈 것으로 보이는데 경제정책을 조정하는데 뭔 돈을 쓰고 하느냐, 어차피 국가에서...... 이런 오해가 있어요.",
n_id.126,o_id.79,기획재정부제1차관 최상목,"위원장님, 이런 게 있습니다. 이름이 경제정책활성화사업인데 이 세부 내역 중에 글로벌산업경제포럼 예산이 있고......",
n_id.127,o_id.80,기획재정부성장전략정책관 양충모,경제정책 조정하고 서비스 실태조사하고 세 가지로 구분이 되어 있습니다.,
n_id.128,o_id.81,소위원장 박준영,어떠세요? 다른 위원님들 의견 있으세요?,
n_id.129,o_id.82,엄용수 위원,이것은 논란이 있었던 것은 아닌데......,
n_id.130,o_id.83,소위원장 박준영,제가 보기에는 얼마 되는 액수가 아니고 국제행사니까 이것을 감액해서 하라고 할 것인지 그냥 원안대로 갈 것인지...... ,
n_id.131,o_id.84,기획재정부제1차관 최상목,"원래 작년도의 2억 원은 14년도, 15년도 대비 감액을 이미 해 가지고 저희가 잡은 거였습니다, 행사 자체를요.",
