new_id,ori_id,speaker,utterance,note
n_id.288,o_id.198,병무청차장 김노운,지금 소양교육은 군사교육 마치고 나오면 한 5일간 정도 저희들이 교육을 시키고 있습니다. ,
n_id.289,o_id.199,안규백 위원,"아니, 복무 전 기간 동안에 몇 번의 교육을 받느냐고요? ",
n_id.290,o_id.200,병무청사회복무국장 최철준,소양교육 1회만 지금 현재는 하고 있습니다. ,
n_id.291,o_id.201,안규백 위원,그렇게 해서는 안 될 것 같은데? ,
n_id.292,o_id.201,안규백 위원,사회복무요원들이 근무태만이나......,
n_id.293,o_id.202,병무청사회복무국장 최철준,"그 부분은 보수교육이라고 별도로 있습니다. 일반적으로 전체를 대상으로 하는 교육은 군사교육 4주와 1주짜리의 소양교육 그렇게 있고요. 그다음에 복무부실자들, 정신질환이나 그다음에 수형자 종류에 따라서 보수특별교육을 시키고 있습니다. ",
n_id.294,o_id.203,안규백 위원,"내 말의 취지는 그게 아니고 4주 교육이 끝나고 나서 복무기간 동안에, 각 기관에서 근무하는 동안 따로 교육을 시킨다는 것 아닙니까, 지금? 그 교육이 얼마 단위로 한 번씩 받느냐고요? ",
n_id.295,o_id.204,병무청사회교육복무과장 정창근,교육복무과장이 말씀드리겠습니다. ,
n_id.296,o_id.204,병무청사회교육복무과장 정창근,교육복무과장입니다. ,
n_id.297,o_id.204,병무청사회교육복무과장 정창근,사회복무요원이 처음에 군사교육 4주를 받고 복무기관에 배치가 되면 3개월 이내에 기본교육이라 해서 소양교육을 전원 다 이수를 합니다. 그렇게 하고 복무 중에 어떤 복무부실이 발생하거나 하면 그때그때 바로 보수교육을 외부에다 위탁을 해서 교육을 시킵니다. 그 주기는 3개월이 될 수도 있고 바로바로 될 수도 있고......,
n_id.298,o_id.205,안규백 위원,그러니까 문제가 야기되는 그런 인원에 대해서만 한다는 얘기예요?,
n_id.299,o_id.206,병무청사회교육복무과장 정창근,"예, 그렇게 하고 복무기관에서 기관장 주관하에서 보통 1개월에 한 번씩......",
n_id.300,o_id.207,안규백 위원,"이 인원들이 상당히 사실상 정신적으로나 근무적으로나 여러 가지 일반제복을 입고 근무하는 요원들이 아니기 때문에 이런 재교육을 좀 체계적으로 할 필요가 있어요. 이 사람들은 자기가 어쨌든 간에 군인 신분인데, 이 인원들에 대해서는 정신무장이라는 것이, 사람이 그냥 망각의 기능이 있는 것이기 때문에 항상 재교육이 필요한 것이기 때문에 구체적으로 한번 계획을 교육원이 개원이 되면 주기적으로 전 인원에 대해서 풀가동하는 그 방법을 한번 강구를 해 보십시오.",
n_id.301,o_id.208,병무청사회교육복무과장 정창근,"예, 알겠습니다. ",
n_id.302,o_id.209,소위원장 김성찬,사회복무요원의 복무기간이 몇 년이지요? ,
n_id.303,o_id.210,병무청사회복무국장 최철준,24개월입니다.,
n_id.304,o_id.211,소위원장 김성찬,"2년이잖아요? 2년 안에 안 위원님 말씀대로 6개월이면 6개월에 한 번이든지 1년에 한 번 해서 전원 소집해서 상황에 맞도록, 다 올 필요 없겠지만 지역별로 해서 한번 해야 되는 것, 사고 나고 하는 것은 사후약방문이잖아요. 사고 나기 전에 중간에 여러 가지 프로그램을 만들어서 교육을 하는 게 맞는 것 같아요, 안 위원님 말씀대로. ",
n_id.305,o_id.211,소위원장 김성찬,제도개선 사항에 포함해서 같이 좀 하도록 하세요.,
n_id.306,o_id.212,병무청차장 김노운,"예, 그렇게 하도록 하겠습니다. ",
n_id.307,o_id.213,소위원장 김성찬,10번 설명하세요.,
n_id.308,o_id.214,전문위원 권기원,"11쪽, 사회복무요원 수형자·정신질환자 등 복무관리 강화 필요 부분입니다. 진성준 위원님 질문사항도 포함되어 있습니다. ",
n_id.309,o_id.214,전문위원 권기원,지적사항으로는 2010년부터 사회복무요원 소집순서 후순위제도가 폐지된 이후 수형자·정신질환자 및 현역복무 부적합자 복무인원이 지속적으로 증가하고 있습니다. ,
n_id.310,o_id.214,전문위원 권기원,"하단 부분 보시면 병무청은 복무지도관 수를 총 97명으로 확대하였으나 일반행정직이 대부분이고 복무지도관 1인당 평균 관리인원도 463명으로 수형자, 정신질환자 등에 대한 복무관리 역량은 아직 부족한 것으로 보입니다.",
n_id.311,o_id.214,전문위원 권기원,"시정요구사항은 사회복무요원 복무지도관 인력의 확충과 함께 수형자, 정신질환자 등의 복무를 지도할 수 있는 전문인력을 보강하고 복무관리 체계를 강화할 것으로 했습니다. ",
n_id.312,o_id.214,전문위원 권기원,시정요구 수준은 제도개선입니다. ,
n_id.313,o_id.214,전문위원 권기원,이상입니다. ,
n_id.314,o_id.215,소위원장 김성찬,병무청 답변하세요.,
n_id.315,o_id.216,병무청차장 김노운,사회복무요원 수형자·정신질환자 복무관리 강화 필요성에 저희들이 상당히 공감을 하고 있습니다. ,
n_id.316,o_id.216,병무청차장 김노운,그런데 저희들이 사회복무지도관의 인원을 좀 늘리려고 해도 정부의 인력억제방침에 따라서 어려움이 좀 있는 실정입니다.,
n_id.317,o_id.216,병무청차장 김노운,따라서 인력 증원은 앞으로 계속 추진하겠으며 그리고 복무지도관에 대해서 상담기법 교육 등을 강화시켜서 전문성을 향상시켜서 효율적인 복무관리가 되도록 그렇게 저희들이 노력을 하겠습니다. ,
n_id.318,o_id.216,병무청차장 김노운,금년에도 저희들이 사회복무지도관들의 워크숍을 한 차례 실시를 했습니다. 상당히 복무기법이나 상담교육이 지금 강화된 상태입니다. ,
n_id.319,o_id.217,안규백 위원,"저는 약간 이해가 안 되는 대목인데 복무지도관 인력 확충만 요구할 게 아니라 사람이 많은 인원도 소대 중대 대대 연대 사단 군단...... 많은 인원도 적게 관리하면 그것을 체계적으로, 과학적으로 할 수 있잖아요? 그래서 소대 중대 연대 계속 있는 것 아닙니까? ",
n_id.320,o_id.217,안규백 위원,"그 원리를 적용해서 해야지 계속 인력만 부족하다 이건 좀, 물론 많으면 좋지, 여건이 그렇지 않으면 그런 식으로 많은 인원을 적게, 체계적으로 분류해서 하는 이런 방법을 한번 강구해 보십시오.",
n_id.321,o_id.218,병무청차장 김노운,"지금 안규백 위원님께서 말씀하신 내용들에 대해서 저희들도 제일 중요한 것은 물론 인원도 중요하지만 현재 우리 복무지도관이 어떻게 하면 복무관리를 잘할 수 있는지 교육이 가장 중요하거든요. 교육이 첫째 중요하고, 그다음에 두 번째는 수형자라든가 정신질환자들을 밀착 관리할 수 있는 방안 이런 것들을 저희들이 지금 체계적으로 하고 있는데 아직까지 그 성과는 미흡합니다마는 방금 안규백 위원님 말씀하신 대로 체계적으로 관리할 수 있도록 그렇게 좀 더 신중과 신경을 쓰도록 하겠습니다. ",
n_id.322,o_id.219,안규백 위원,"요원들 눈동자 보면 거의 90%, 100% 아는 것 아닙니까? ",
n_id.323,o_id.220,병무청차장 김노운,그렇습니다. 정신질환자 같은 경우는 거의 얼굴만 보면 대충 알 수가 있습니다.,
n_id.324,o_id.221,안규백 위원,"그러니까 체계적으로 할 수 있다고 봐요, 저는.",
n_id.325,o_id.222,소위원장 김성찬,"그래서 이 부분은 인원 확충은 시정요구에 사실은 안 맞는 것 같고, 여기 있는 대로 97명을 확대했지만 일반행정직이라는 것 아닙니까? 그러다 보니까 복무지도가 잘 안 된다는 지적 아닙니까? ",
n_id.326,o_id.222,소위원장 김성찬,"그래서 인원 확충보다는 복무지도를 잘할 수 있는 사람들이 여기에 충원되어야 되는 부분 그것이 더 중요하고, 안 위원님 말씀대로 그것을 어떻게 내실화하느냐는 부분이 더 중요하지요.",
n_id.327,o_id.222,소위원장 김성찬,인원 확충은 사실 어렵잖아요. 자꾸 인원 확충이 안 되었기 때문에 안 된다 이렇게 결론이 유도되면 안 되기 때문에 인원 확충 부분은 시정요구 제도개선 사항에서 빼고 지금 현 상태에서 어떻게 잘할 것인가 그것을 연구하는 게 더 맞는 것 같아요. 그렇게 좀 하시는 게 어떻겠습니까?,
n_id.328,o_id.223,병무청차장 김노운,"예, 그렇게 하도록 하겠습니다.",
n_id.329,o_id.224,진성준 위원,"물론 복무지도관 한 사람이 관리해야 될 인원이 굉장히 많은 것도 사실이지만 복무지도관들 가운데 특별히 수형자나 정신질환자나 문제가 있을 수 있는 요원들은 특별히 관리할 수 있는 사람들을 따로 선발하고 그들에게 그런 특별한 임무들을 부여해서 집중관리를 해야만 하지 않겠는가 이런 점을 말씀드리는 겁니다, 물론 전문인력의 선발도 필요한 일이겠지만.",
n_id.330,o_id.225,병무청차장 김노운,"진성준 위원님 말씀하신 대로 저희들이 수형자라든가 정신질환자, 문제가 될 사람들에 대해서는 지금 중점관리를 하고 있습니다. 밀착관리를 하고 있고요. 또 복무지도관과 수시로 통화할 수 있는 그런 시스템을 만들어 놓고 잘 활용을 하고 있습니다. 그래서 지금은 그래도 사회복무요원들이 많이 안정된 상태다 저는 그렇게 보고 있습니다. ",
n_id.331,o_id.226,진성준 위원,예.,
n_id.332,o_id.227,소위원장 김성찬,다른 말씀 없으시면 제도개선으로 하겠습니다.,
n_id.333,o_id.227,소위원장 김성찬,11번 사항 설명해 주세요.,
n_id.334,o_id.228,전문위원 권기원,12쪽입니다.,
n_id.335,o_id.228,전문위원 권기원,"11번, 산업지원인력 편입률 저조 부분인데, 진성준 위원님 질의사항이 포함되어 있습니다.",
n_id.336,o_id.228,전문위원 권기원,"지적사항으로는 2014년도 산업지원인력 운용을 보면, 지정업체 수는 총 7812개로 전년보다 112개 업체를 추가 지정하였으나 편입인원은 총 9961명으로 배정인원 1만 1500명 대비 평균 86.6%에 불과하고, 특히 전문연구요원과 보충역 산업기능요원의 중소기업 편입률이 저조합니다. ",
n_id.337,o_id.228,전문위원 권기원,시정요구사항은 산업지원인력의 중소기업 편입률을 높이고 병역자원의 수급 상황에 따라 편입인원의 조정 및 취업조건 개선 등 산업지원인력 운용제도의 효율적인 운용방안을 마련할 것으로 하였습니다. ,
n_id.338,o_id.228,전문위원 권기원,시정요구 수준은 제도개선입니다.,
n_id.339,o_id.228,전문위원 권기원,이상입니다.,
n_id.340,o_id.229,소위원장 김성찬,병무청 답변하세요.,
n_id.341,o_id.230,병무청차장 김노운,"전문연구요원에 대해서는 저희들이 종전에는 대기업 배정을 많이 했습니다마는 2014년부터는 대기업 배정을 폐지해 버렸습니다. 그래서 중견기업, 중소기업에 편입할 수 있도록 해 줬거든요. 그러다 보니까 편입하고자 하는 사람들이 중소기업이나 중견기업에 가기 싫은 거예요. 저희들이 홍보도 많이 했는데도 그런 저조현상이 일어났고요.",
n_id.342,o_id.230,병무청차장 김노운,그다음에 산업기능요원 경우에는 작년 2013년도에는 배정인원이 3000명이었습니다. 그러나 2014년 4000명이었습니다. 실질적으로 보면 보충역 자원이 2013년보다 2014년도에 한 1000명 정도 더 많이 편입이 되었습니다.,
n_id.343,o_id.230,병무청차장 김노운,그러나 아직까지도 보충역 자원들을 기업체에서는 상당히 꺼립니다. 왜냐하면 재교육시키려면 비용도 많이 들고 이러니까. 그러나 저희들이 실태조사 할 때 많이 편입할 수 있도록 권고도 하고 홍보도 해서 실적을 고양할 수 있도록 노력을 하겠습니다. ,
n_id.344,o_id.231,진성준 위원,"아니, 권고만 갖고는 안 될 같아요. 이를테면 대기업이 불가능하게 되었으니까 그래도 선호하는 기업들이 생길 거잖아요, 중견기업 중심으로. 그러면 갈수록 중소기업 지원율은 떨어질 것이고 중소기업은 산업기능요원 제도가 중소기업을 위해서 만들어졌던 것인데 더 어려움을 겪지 않겠습니까? 이런 걸 추첨제 같은 걸로 무작위로 간다 이렇게는 할 수 없는 건가요, 어떻습니까? ",
n_id.345,o_id.232,병무청차장 김노운,기업체는 이윤추구가 주목적이지 않습니까? 그거하고 안 맞는 실정이거든요. 그런 어려움이 있습니다.,
n_id.346,o_id.232,병무청차장 김노운,현역병인 경우에는 자격증을 가지고 들어오니까 그래도 기업체에 적응이 쉬운 데 보충역인 경우는 자격증이 없거든요. 그러니까 재교육을 시켜야 되는 그런 문제가 있습니다. 그래서 기업체에서는 보충역을 선호하지 않는 그런 현상입니다.,
n_id.347,o_id.233,진성준 위원,그렇겠지요. 그걸 어떻게 할 건가 하는 문제가 있는 거지요.,
n_id.348,o_id.233,진성준 위원,그러면 보충역 자원에 대해서는 어떻게 해야 됩니까? 계속 이런 식으로 하면 나중에 보충역은 어디다 쓸 데가 없어지게 되는 거잖아요.,
n_id.349,o_id.234,병무청차장 김노운,그래서 앞으로 보충역 요원들을 많이 편입했을 경우에 현역병 배정할 때 인센티브를 준다든가 이런 유인책을 저희들이 고민을 하고 있습니다. ,
n_id.350,o_id.235,소위원장 김성찬,끝났어요?,
n_id.351,o_id.236,송영근 위원,"한 가지, 산업지원인력 편입률 여기에 소요되는 비용, 산업지원인력 예산이 3억 8500 아니에요?",
n_id.352,o_id.237,병무청차장 김노운,예.,
n_id.353,o_id.238,송영근 위원,이게 뭐에 쓰는 거예요? 그냥 배정해 주면 끝나는 건데......,
n_id.354,o_id.239,병무청차장 김노운,"이 예산은 저희들이 지정업체의 실태조사를 하기 위한 예산과 기업체나 의무자에게 보내 주는 산업기능요원, 전문연구요원 관리요령이라든가 길라잡이 체계라든가 이런 것 하는 예산들이 포함된 겁니다. ",
n_id.355,o_id.240,송영근 위원,관리하기 위해서 길라잡이 책자 만들어 나눠 주고......,
n_id.356,o_id.241,병무청차장 김노운,"예, 책자하고 여비하고 이런 게 포함되었습니다.",
n_id.357,o_id.242,송영근 위원,"한마디로 시장조사를 하는 거지요? 기업체, 업체 이런 것 조사하고 다니고 이러는 데 쓰는 비용이라고.",
n_id.358,o_id.243,병무청차장 김노운,"예, 그렇습니다.",
n_id.359,o_id.244,안규백 위원,"차장님, 산업지원인력 운용의 당초 취지가 뭡니까? ",
n_id.360,o_id.245,병무청차장 김노운,원래 산업기능요원 당초 취지는 소위 말해 정부의 3D업종에 인력이 부족해서 그 인력을 채워 주기 위해서 만든 겁니다.,
n_id.361,o_id.246,안규백 위원,"아니지, 전문직도 있는데 무슨...... ",
n_id.362,o_id.247,병무청차장 김노운,"아니, 산업기능요원을 얘기하는 겁니다.",
n_id.363,o_id.247,병무청차장 김노운,"그다음에 전문연구요원은 국가의 과학기술 분야에, 1973년도부터 시작되었는데 그 당시에 인재가 없어 가지고 이걸 키우기 위해서 한 겁니다.",
n_id.364,o_id.248,안규백 위원,"지금은 시대에 이게 안 맞을 것 같아요. 내 친구 아들도 전문요원으로 갔다가, 걔는 일을 하려고 갔는데 영어를 잘하니까 매번 외국으로 출장을 보내는 거예요. 그래서 자기가 이건 내 생각하고 안 맞다고 해서 다시 육군으로 간 겁니다. 그런 애들이 상당히 있더라고요. 서울대를 나왔는데 전문요원으로 갔다가 자기 일이 아니어 가지고, 정말로 산업기능요원으로 전문적으로 하려고 그러는데  출장만 보내고 외국만 보내니까 이걸 포기하고 육군으로 다시 갔다가 얼마 전에 제대를 했는데, 저는 이 제도를 폐지해야 된다고 봐요. 이 제도를 폐지하고 정신질환자나 체력기준에 미달되거나 이런 면제기준을 완화시켜 가지고 이런 애들은 아예 아웃시키고, 이런 전문연구요원들이나 괜찮은 애들을 군에 보내야지...... 이거 잉여자원이 있기 때문에 이런 것 아닙니까? 이 제도는 이 시대에 맞지가 않아요.",
n_id.365,o_id.249,병무청차장 김노운,안규백 위원님 말씀하신 대로 이 제도가 시대상황에 안 맞다고 보시는 분들도 제법 있습니다. ,
n_id.366,o_id.250,안규백 위원,제법 있는 게 아니라 여기 여의도에도 산업기능요원들이 몇 명 있어요. 가보면 멀쩡한 애들이야. 이 애들이 맞지가 않아. 가서 잔심부름하고 회사에 기여하고 그런 애들이 꽤 많다고.,
n_id.367,o_id.251,병무청차장 김노운,그래서 저희들이 실태조사 나갈 때 연구 분야에 복무하는지 여부를 확인하거든요.,
n_id.368,o_id.252,안규백 위원,"아니, 온다고 하면 다 준비하고 그러는데 그건 눈 가리고 아웅하는 식이고, 정말로 신체가 저하되거나 정신병력이 있거나 집안이 극도로 어려운 이런 애들은 한두 번 해서 아웃시키고 어레인지(arrange)시키고, 이런 요원들을 현역으로 복무시키는 방안을 한번 강구해 보십시오. 용역 의뢰와 함께 토론 한번 해 보시라고요.",
n_id.369,o_id.253,병무청사회복무국장 최철준,사회복무국장이 보충설명을 좀 올리겠습니다.,
n_id.370,o_id.253,병무청사회복무국장 최철준,"지금 말씀하신 대로 저희들도 똑같은 생각을 갖고 있습니다. 그래서 국방부에 건의 중에 있고 이미 보고는 돼 있는 상태인데, 산업기능요원을 비롯해서 대체복무 전체의 재정비 방안, 그래서 국제협력요원이나 산업기능요원, 예술체육요원 이런 것들을 폐지하는 방안을 병무청에서도 건의를 한 상태거든요.",
n_id.371,o_id.253,병무청사회복무국장 최철준,"그런데 이게 일시적인 입영 적체 현상하고 맞물려서 국방부에서 발표 시기를 조율하고 있는 상황입니다. 또 국방부에서는 전환복무를 하는 의경이나 이런 부분까지 다 포함해서 같이 이걸 발표하는 것이 좋겠다, 어차피 2022년 이후에는 병역자원이 부족하기 때문에. 특히 산업기능요원 같은 경우는 우수자원이 현역으로 가야 되는데 기업체로 빠지는 이런 것은 불합리하다 해서 여러 가지 이유 끝에 대체복무 전반에 관한 재정비 방안을 지금......",
n_id.372,o_id.254,안규백 위원,"하여튼 그 방향성은 옳은 것 같아요. 옳은 것 같으니까 한번...... 너무 크게, 그랜드 마스트플랜보다는 하나씩 하나씩 해야지, 전환복무하는 의경까지 전부...... ",
n_id.373,o_id.254,안규백 위원,의경까지 할 수 있습니까? 그건 실질적으로 불가능한 것 아니에요?,
n_id.374,o_id.255,병무청사회복무국장 최철준,"중요한 것은 지금 이 제도가 타당성이 떨어지고 한 40년 운영하다 보니까 폐지하는 게 맞다고 다 공감을 하는데, 결국은 기득권을 쥐고 있는 경제계 이쪽에서 굉장히 반발이 심하니까 이걸 어떻게 추진......",
n_id.375,o_id.256,안규백 위원,반발해도 3개월이면 잊어버려. 부모가 죽어도 3개월이면 잊어버리는 겁니다. 그건 의식하지 말고 신념을 가지고 하세요.,
n_id.376,o_id.257,병무청사회복무국장 최철준,그렇게 하다 보니까 대체복무를 포함해서 전체...... ,
n_id.377,o_id.258,소위원장 김성찬,정리를 이렇게 하시지요.,
n_id.378,o_id.258,소위원장 김성찬,산업기능요원 제도 존속 필요성 여부를 포함해서 여기 있는 대로 효율적인 운용방안을 검토한다니까 안규백 위원 지적대로 그 용도로 꼭 해야 되느냐 하는 부분을 별도로 이 방안에 포함해서 제도개선하시고 대체복무의 필요성 여부는 큰 틀에서 한다고 하시니까 그거 빨리 되시면 우리 국방위 전체에 보고를 한번 해 주시기 바랍니다. ,
n_id.379,o_id.259,병무청차장 김노운,알겠습니다.,
n_id.380,o_id.260,소위원장 김성찬,그렇게 제도개선을 하는 것으로 정리하겠습니다. ,
n_id.381,o_id.260,소위원장 김성찬,12번.,
n_id.382,o_id.261,전문위원 권기원,13쪽입니다.,
n_id.383,o_id.261,전문위원 권기원,12번 정보화사업 낙찰 차액 사용내역 기획재정부 미통보 사항입니다.,
n_id.384,o_id.261,전문위원 권기원,주호영 위원님 질의사항이 있었습니다.,
n_id.385,o_id.261,전문위원 권기원,"지적사항으로는 병무청은 병무행정정보화 사업 낙찰차액 6400만 원을 업무용 소프트웨어 구입, 주민전산자료 암호화 보안장비 구입 등에 집행하였습니다.",
n_id.386,o_id.261,전문위원 권기원,"14쪽을 보시면, 2014회계연도 예산 및 기금운용계획 집행지침에 따라 정보화사업의 낙찰차액은 원칙적으로 불용 처리해야 하며, 계속사업에 사용하고자 할 경우 기획재정부장관에게 통보하도록 되어 있으나 이를 지키지 아니하였다고 지적돼 있습니다.",
n_id.387,o_id.261,전문위원 권기원,시정요구사항은 병무청은 향후 정보화사업의 관리를 철저히 하고 운영에 있어 예산집행지침을 철저히 준수할 것으로 했습니다.,
n_id.388,o_id.261,전문위원 권기원,시정요구 수준은 주의입니다.,
n_id.389,o_id.261,전문위원 권기원,이상입니다.,
n_id.390,o_id.262,소위원장 김성찬,병무청 답변하세요.,
n_id.391,o_id.263,병무청차장 김노운,정보화사업 낙찰차액 사용내역 기재부 미통보 내용에 대해서는 이 제도가 작년에 바뀌었습니다. 그래서 우리가 미처 인지를 못한 부분이 있는데 앞으로는 그런 일이 없도록 하겠습니다. ,
n_id.392,o_id.264,안규백 위원,예.,
n_id.393,o_id.265,소위원장 김성찬,다른 말씀 없으면 주의 하는 것으로 정리하겠습니다.,
n_id.394,o_id.265,소위원장 김성찬,13번 설명해 주십시오. ,
n_id.395,o_id.266,전문위원 권기원,"15쪽, 국외여비 집행실적 부진 부분입니다.",
n_id.396,o_id.266,전문위원 권기원,안규백 위원님 질의사항 있습니다.,
n_id.397,o_id.266,전문위원 권기원,지적사항으로는 2014년 국외여비 예산액 2억 5900만 원 중 74.1%에 해당하는 1억 9200만 원을 집행하여 전년에 비해 집행률이 20.8%p 상승했으나 여전히 집행실적이 부진한 실정입니다.,
n_id.398,o_id.266,전문위원 권기원,미국 시애틀에서 개최한 병무행정 설명회 참석인원이 2015년도의 경우 23명으로 저조하여 사업성과가 부진하다는 말씀이 있었습니다. ,
n_id.399,o_id.266,전문위원 권기원,시정요구사항은 사업성과를 향상시킬 수 있도록 홍보를 강화하고 사업을 내실 있게 충실히 집행할 것으로 말씀하셨습니다.,
n_id.400,o_id.266,전문위원 권기원,시정요구 수준 의견은 시정입니다.,
n_id.401,o_id.266,전문위원 권기원,이상입니다.,
n_id.402,o_id.267,소위원장 김성찬,병무청 답변하세요.,
n_id.403,o_id.268,병무청차장 김노운,"국외여비 집행실적 부진에 대해서 저희들도 반성을 하고요, 앞으로 잘할 수 있도록 노력하겠습니다.",
n_id.404,o_id.269,안규백 위원,"예, 새로운 시도를 하다 보면 그럴 수도 있지요, 일하는 사람이 접시를 깨는 것이니까.",
n_id.405,o_id.269,안규백 위원,  (연필을 들어 보이며),
n_id.406,o_id.269,안규백 위원,이 연필도 기본적으로 연필에 지우개가 있는 것은 실수를 전제로 하고 있기 때문에 지우개가 있는 것 아니겠습니까? 의욕을 가지고 하다 보면 실수할 수도 있으니까 앞으로 잘해 주세요.,
n_id.407,o_id.270,병무청차장 김노운,"예, 잘하겠습니다. ",
n_id.408,o_id.271,송영근 위원,여비라는 게 뭐예요? 간부들 해외 출장가고 그러는 건가?,
n_id.409,o_id.272,안규백 위원,출장이 아니라 홍보.,
n_id.410,o_id.273,전문위원 권기원,"해외 방문해서 병무 형태에 대해서 설명회, 병역입영 대상자에 대해서 설명회 하는 그런 내용입니다.",
n_id.411,o_id.274,안규백 위원,그런데 왜 돈이 이렇게 많이 남았어요?,
n_id.412,o_id.275,송영근 위원,"그러니까 몇 푼 되지도 않은 것을 왜 남겨. 사업계획이 잘못된 것 아니야, 그렇지요?",
