new_id,ori_id,speaker,utterance,note
n_id.334,o_id.182,환경부차관 윤종수,"그러면서 5년마다 갱신할 때에는 가장 최신의 테크놀로지를 적용시켜 가지고 하고, 새로운 시설이 입지할 때는 가장 최신의, 그 테크놀로지가 리스트가 죽 있거든요. 그래서 제일 톱 10%에 해당되는 그 기술을 적용하게 해 가지고, 대신 지도단속은 중앙정부에서 직접 해 줘야 됩니다. ",
n_id.335,o_id.182,환경부차관 윤종수,그래서 그런 법이 수생태계법의 근간인데 그게 통과가 안 됐습니다만 그런 쪽으로 가지 않으면 그런 문제가 계속 상존할 것이라는 그런 생각이 들고요. 그래서 위원님 말씀하신 그런 부분에 대해서 저도 동의합니다. ,
n_id.336,o_id.182,환경부차관 윤종수,"두 번째, 50 대 50 가는 것은, 원래 징수권자가 다 그것에 대한 징수권자로 귀속되는 게 맞습니다. 그래서 지방자치단체의 세입으로 그렇게 하는 것에 대해서 사실 맞다고 생각합니다, 원칙적으로. ",
n_id.337,o_id.182,환경부차관 윤종수,다만 환특의 세수가 워낙에 없다 보니까 절충안이 시도가 됐는데요. 위원님께서 그렇게 지적을 하신다면 지방 세입으로 가는 것으로 그렇게 하는 것에 저희들은 이의가 없습니다. ,
n_id.338,o_id.183,수석전문위원 천병호,참고로 한 말씀 드리겠습니다. ,
n_id.339,o_id.183,수석전문위원 천병호,"한명숙 위원님의 이런 지적이 계셨는데 제가 파악하기로는 이런 경우에 이 내용들이 환경부에서 지금까지 적발한 건이 거의 없습니다, 한 5년 동안. 그런 문제가 첫 번째 하나고. ",
n_id.340,o_id.183,수석전문위원 천병호,"그다음에 두 번째로는 환경개선특별회계로 간다 안 간다 하는 문제에 앞서서 지금 현재는 가축분뇨 이용에 관한 법률이고 또는 수질·수생태계 관련 법이고 유해화학물질 관리법이고, 이 법에서는 권한을 지방자치단체장에게 줬는데 그러면 거기에다 맞춰서 이 환경범죄 단속법도 같이 맞춰 줘야 되거든요. ",
n_id.341,o_id.183,수석전문위원 천병호,그게 안 맞아서 이 법이 나온 것인데 그 문제하고는 별도로 개별법에서 규정한 내용과 이 환경단속법에서 나온 것을 일치시켜 주겠다고 하는 게 이 법의 취지입니다. ,
n_id.342,o_id.183,수석전문위원 천병호,"그렇기 때문에 차관께서 말씀하신 것처럼 한명숙 위원님 말씀에 동의한다고 하면서 지자체, 아까 환경특별회계 그것을 말씀하신 것은 아예 안 맞고, 또 한다고 그러면 이게 없어져 버리는 거니까, 옛날 법체계로 가 버리면. ",
n_id.343,o_id.184,심상정 위원,그런데 왜 5년 동안 적발된 게 없어요? 그 이유는 뭐지요? ,
n_id.344,o_id.185,환경부차관 윤종수,"일반 대기·수질법에 의해서 하는 것은 있지만 특별법에 의해 가지고, 지금 현재 한강법만 이 특별법 대상이 되고요. 특별법에 의해 가지고 이런 과징금이 부과되는 것은 수변구역, 예를 들면 수변구역에 대해서 그 지역에서 이런 범법행위가 일어났을 때에만 해당되는 거예요, 특별 범죄법이라는 게. 그래서 그것이 한강법만 되어 있었는데 이제 4대강 법 다 포함시키는 게 그 법의 내용이고요. ",
n_id.345,o_id.185,환경부차관 윤종수,"그러다 보니까 여지까지는 한강의 수변구역에서 범죄행위가 일어나는 경우에 적용이 되다 보니까 그런 적발건수가 없었고, 그다음에 지도단속 권한이 우리 지방청으로 이것의 경우에는 있지만 현실적으로 단속인력이나 이런 것이 부족해 가지고...... ",
n_id.346,o_id.186,심상정 위원,"그러니까 두 가지잖아요. 하나는 단속할 의지가 없는 거고 규제 완화를 하니까, 또 하나는 인력도 부족한 거고. ",
n_id.347,o_id.186,심상정 위원,"그중에서도 지금 제가 보기에도 환경부의 지방청이 너무 취약해요. 오히려 이런 과제는, 지금 그 얘기 다 제가 말씀 안 드리겠지만 대한민국의 환경실태가 심각합니다. 심각해요. 환경부가 자꾸만 환경규제 완화에 앞장서는 게 환경부여서는 안 되고, 규제를 대폭 강화하고...... ",
n_id.348,o_id.186,심상정 위원,"그런데 현재 환경부의 취약한 구조로 안 된다고 하면 환노위에서 환경부 기구를 확대해 준다든지 환경청을 신설하게 해 준다든지 그런 방향으로 가는 게 맞다, 저는 그렇게 생각하고요. ",
n_id.349,o_id.186,심상정 위원,그래서 이 문제는 한명숙 위원께서 지적하신 문제 인식에 동의하고 그 방향에서 환경부가 이런 환경범죄를 지도 관리감독하는 데 미흡한 여러 가지 불비한 조건이 있다면 그것을 적극적으로 개진해서 환경위원회에서 뒷받침을 해 드릴 수 있도록 이렇게 환경부가 고민을 해 보세요. ,
n_id.350,o_id.187,환경부차관 윤종수,"예, 제가 아까 말씀드린 것 우리 수석전문위원님께서 말씀하시니까 제가 좀 답변을 잘 못한 것 같습니다. ",
n_id.351,o_id.187,환경부차관 윤종수,첫 번째로 지방 이양에 대해서 재검토를 하는 것에 대해서 동의했는데 징수권자가 그렇게 하다 보니까 환경부장관이 되니까 징수권자가 세입을 가져가야 되거든요. 그러니까 이것은 지자체로 갈 수는 없게 되겠네요. 이것은 환특으로 들어가게 되겠습니다.,
n_id.352,o_id.188,심상정 위원,"그러니까 가져가세요. 환경부 가져가시고요, 그다음에 제가 이게 더더욱 동의가 안 되는 게 무슨 법이에요? 친수구역법인가요? ",
n_id.353,o_id.189,환경부차관 윤종수,그건 국토부고......,
n_id.354,o_id.190,심상정 위원,"아니, 국토부건 뭐건 그것 때문에 더 안 되겠어요, 원칙적으로도 안 맞고. 제가 보기에는 환경부가 강력한 환경 보호의 의지를 가지고 환경을 잘 살려 나가고 지키는 데 부족한...... 문제가 있으면 그걸 저희한테 청하세요.",
n_id.355,o_id.191,환경부차관 윤종수,알겠습니다.,
n_id.356,o_id.192,소위원장 김성태,지난번 남양주시청 사례만 보더라도 이것은 불법배출시설에 대해서 당해 지자체에다가 이 권한을 넘겨버리면 진짜 마음대로 해도 아무 문제없다는 건데......,
n_id.357,o_id.193,이종훈 위원,이것은 기각......,
n_id.358,o_id.194,은수미 위원,기각......,
n_id.359,o_id.195,수석전문위원 천병호,그러면 이 법안도 계속 심의하는 걸로......,
n_id.360,o_id.196,이종훈 위원,아니에요.,
n_id.361,o_id.197,소위원장 김성태,이건 심의할 것도 없는데......,
n_id.362,o_id.198,수석전문위원 천병호,왜 그러냐 하면 이 내용 중에서 저희들이 꼭 필요한 내용들이 있습니다. ,
n_id.363,o_id.199,은수미 위원,수변지역 하는 거요?,
n_id.364,o_id.200,수석전문위원 천병호,"예, 지금 현재는 환경보호지역에 한강법에 의한 수변지역만 포함하도록 되어 있거든요. 그런데 낙동강, 영산강, 금강의 수변지역도 포함하도록 할 필요가 있고요, 최소한 그건 포함해야 되는 거고요.",
n_id.365,o_id.201,소위원장 김성태,그러면 '보류'로 합시다.,
n_id.366,o_id.202,수석전문위원 천병호,"예, 그렇게 하시지요.",
n_id.367,o_id.203,소위원장 김성태,그러면 의사일정 제3항에 대해서는 보다 심도 있는 심사를 위하여 우리 소위원회에서 계속 심사하도록 하겠습니다.,
n_id.368,o_id.203,소위원장 김성태,이의 없습니까?,(｢예｣ 하는 위원 있음)
n_id.369,o_id.203,소위원장 김성태,"5항, 6항은 좀 간단한 건데......  ",
n_id.370,o_id.204,홍영표 위원,우선 5항도 다른 계류법안이 있습니다.,
n_id.371,o_id.205,소위원장 김성태,그러면 상정해 가지고 합시다.,
n_id.372,o_id.206,소위원장 김성태,"다음은 의사일정 제5항 및 제6항 박기춘 의원·이찬열 의원이 각각 대표발의한 수질 및 수생태계 보전에 관한 법률 일부개정법률안, 이상 2건을 일괄하여 상정합니다.",
n_id.373,o_id.207,홍영표 위원,그것은 계류법안이 있으므로 설명하지 않고 제가 말씀드리겠습니다.,
n_id.374,o_id.207,홍영표 위원,이 수질 및 수생태계 보전에 관한 법률 일부개정법률안도 현재 상임위에 동일한 법안이 계류 중이기 때문에 오늘 논의하지 마시고 다음에 병합해서 심사할 것을 제안드립니다.,
n_id.375,o_id.208,소위원장 김성태,위원님들 다른 의견 없으시지요?,(｢예｣ 하는 위원 있음)
n_id.376,o_id.208,소위원장 김성태,그러면 의사일정 제5항 및 제6항에 대해서는 보다 심도 있는 심사를 위하여 우리 소위원회에서 계속 심사하도록 하겠습니다. 이의 없습니까?,(｢예｣ 하는 위원 있음)
n_id.377,o_id.208,소위원장 김성태,그러면 10분간 정회를 선언합니다.,
n_id.378,o_id.208,소위원장 김성태,45분에 속개하겠습니다.,
n_id.379,o_id.209,소위원장 김성태,의석을 정돈하여 주시기 바랍니다.,
n_id.380,o_id.209,소위원장 김성태,성원이 되었으므로 회의를 속개하겠습니다.,
n_id.381,o_id.210,소위원장 김성태,다음은 의사일정 제7항 한정애 의원이 대표발의한 다중이용시설 등의 실내공기질관리법 일부개정법률안을 상정합니다.,
n_id.382,o_id.210,소위원장 김성태,수석전문위원 설명해 주시기 바랍니다.,
n_id.383,o_id.211,수석전문위원 천병호,99쪽을 봐 주시기 바랍니다.,
n_id.384,o_id.211,수석전문위원 천병호,"주요 내용은, 첫째 법의 적용범위에 대중교통차량까지 확대하는 것이 첫 번째이고, 두 번째로 대중교통차량의 실내 공기질 관리에 대한 관리지침을 정하여 고시할 수 있고, 관리지침에 맞게 대중교통차량 제작 또 운행하도록 권고만 하는 겁니다, 거기에 대해서 벌칙을 가하거나 그런 건 아니고.",
n_id.385,o_id.211,수석전문위원 천병호,그다음에 세 번째로 대중교통차량의 제작자 또는 운송사업자에게 보고의무를 부과하고 관계공무원이 검사할 수 있도록 하는 내용입니다.,
n_id.386,o_id.211,수석전문위원 천병호,101쪽을 봐 주시기 바랍니다.,
n_id.387,o_id.211,수석전문위원 천병호,"개정안 신설에서 대중교통차량이 뭔지에 대한 개념 정리를 하였습니다마는 대부분을 대통령령으로 위임하고 있어서 여기서는 ""'대중교통차량'이란 불특정인을 운송하는 데 이용되는 차량을 말한다."" 그렇게 하고요. 102쪽에 구체적으로 이 법의 적용대상을 첫째는 '도시철도법에 의한 도시철도차량', 두 번째는 짐차는 빼고 '철도산업발전기본법에 따른 여객을 운송하기 위한 철도차량', 다음에 세 번째는 '여객자동차 운수사업법 제2조제3호의 여객자동차운송사업에 사용되는 자동차' 이렇게 정의를 해 줬습니다. ",
n_id.388,o_id.211,수석전문위원 천병호,"다음에 104쪽, 105쪽 그리고 107쪽 이하에 대한 수정의견은 제작 차량에 대해서는 환경부장관이 검사하도록 하고 시·도지사는 운행 차량에 대해서 검사하도록 하는 내용과 관련해서 자구 수정하는 게 되겠습니다. ",
n_id.389,o_id.211,수석전문위원 천병호,이상입니다.,
n_id.390,o_id.212,소위원장 김성태,정부 측 의견 말씀해 주십시오. ,
n_id.391,o_id.213,환경부차관 윤종수,"사실 여기 마이너한 의견이 있는데요, 이 의견을 내는 이유는 102쪽의 3호에 '여객자동차운송사업에 사용되는 자동차' 하면 택시하고 일반 버스가 모두 포함이 됩니다. 버스 중에서도 지난번에 고속버스 같은 경우 일정 기간 동안 밀폐돼 있어 가지고 환기가 안 되고 하는 것 때문에 문제가 됐었는데요. ",
n_id.392,o_id.213,환경부차관 윤종수,"그러나 시내버스라든지 마을버스 등 이렇게 계속 수시로 열렸다 닫혔다 하는 것에 대해서는 적용하기가 상당히 어려운 측면이 있고, 택시도 그런 문제가 있어서 택시하고 일반 노선버스 이런 것들은 제외가 돼야 되기 때문에 그것에 맞춰서 문구가 조정돼야 될 것 같습니다.",
n_id.393,o_id.213,환경부차관 윤종수,"그래서 저희들 생각은 정의 부분에 '대중교통차량'이라 하지 않고 '대중교통수단이란 도시철도차량, 철도차량, 여객자동차, 그 밖에 다수의 사람을 운송하는 데 이용되는 교통수단을 말한다' 대통령령으로 해 가지고 그런 부분들을 정리할 수 있도록 그렇게 하고자 합니다. ",
n_id.394,o_id.214,수석전문위원 천병호,102쪽 제3호에 '여객자동차 운수사업법 제2조제3호의 여객자동차운송사업에 사용되는 자동차 중 대통령령으로 정하는 차량' 이렇게 하겠다 그런 말씀입니다.,
n_id.395,o_id.215,환경부차관 윤종수,예.,
n_id.396,o_id.216,수석전문위원 천병호,그 정도는 수용해도 상관없겠습니다. ,
n_id.397,o_id.217,소위원장 김성태,위원님들 의견 말씀해 주십시오. ,
n_id.398,o_id.217,소위원장 김성태,"의견이 없으시면 의사일정 제7항에 대해서는 수정한 부분은 수정한 대로, 그 밖의 부분은 원안대로 의결하고자 하는데 이의 없습니까? ",(｢없습니다｣ 하는 위원 있음)
n_id.399,o_id.217,소위원장 김성태,가결되었음을 선포합니다.,
n_id.400,o_id.218,소위원장 김성태,다음은 의사일정 제8항 심재철 의원이 대표발의한 소음·진동관리법 일부개정법률안을 상정합니다. ,
n_id.401,o_id.218,소위원장 김성태,의사일정 제8항에 대하여 수석전문위원 설명해 주시기 바랍니다. ,
n_id.402,o_id.219,수석전문위원 천병호,112쪽입니다.,
n_id.403,o_id.219,수석전문위원 천병호,"심재철 의원이 대표발의한 내용인데, 환경부장관으로 하여금 5년마다 소음·진동관리종합계획을 수립하게 하고 관계 중앙행정기관의 장 및 시·도지사로 하여금 종합계획에 따른 연차별 추진계획을 수립 시행하게 하는 내용입니다.",
n_id.404,o_id.219,수석전문위원 천병호,이 법은 지금 현재 이완영 의원이 대표발의한 소음·진동관리법 일부개정법률안이 제출돼 있기 때문에 같이 병합 심사하는 게 바람직할 것 같습니다. ,
n_id.405,o_id.220,홍영표 위원,동의합니다.,
n_id.406,o_id.221,소위원장 김성태,정부 의견.,
n_id.407,o_id.222,홍영표 위원,"아니, 병합 심리를 하는 게...... ",
n_id.408,o_id.223,소위원장 김성태,수석전문위원 의견으로 끝내자고? 그래도 정부 의견을 듣고 판단을 해야지요.,
n_id.409,o_id.224,환경부차관 윤종수,저희들은 수정의견 내용에 대해서는 이의가 없습니다. ,
n_id.410,o_id.225,소위원장 김성태,그러면 의사일정 제8항에 대해서는 보다 심도 있는 심사를 위해 우리 소위원회에서 계속 심사하도록 하겠습니다.,
n_id.411,o_id.225,소위원장 김성태,이의 없습니까? ,(｢없습니다｣ 하는 위원 있음)
n_id.412,o_id.225,소위원장 김성태,그러면 보류하도록 하겠습니다.,
n_id.413,o_id.226,소위원장 김성태,다음은 의사일정 제9항 우윤근 의원이 대표발의한 영산강·섬진강수계 물관리 및 주민지원 등에 관한 법률 일부개정법률안을 상정합니다. ,
n_id.414,o_id.226,소위원장 김성태,의사일정 제9항에 대해서 수석전문위원 설명해 주십시오. ,
n_id.415,o_id.227,수석전문위원 천병호,116쪽입니다.,
n_id.416,o_id.227,수석전문위원 천병호,"우윤근 의원께서 발의한 내용인데, 댐 및 취수장 건설로 인하여 강 하류에 피해가 발생하는 지역의 주민에 대한 지원방안 마련과 물이용 부담금 부과를 면제해 달라는 내용입니다.",
n_id.417,o_id.227,수석전문위원 천병호,이 사항과 관련해서는 원래 영산강 수계법이 기본적으로 강 상류의 피해를 보는 지역 주민들을 위하는 게 법률 제정의 취지이고 또 물이용 부담금 면제도 원래는 주암댐이나 섬진강댐의 건설로 인해서 하류 지역에 피해를 보는 사람이기 때문에 그것은 댐건설 및 주변지역지원에 관한 법률에서 지원하는 게 체계상 맞아서 이 점과 관련해서는 앞으로 논의가 계속 되어야 될 사항 같습니다. ,
n_id.418,o_id.227,수석전문위원 천병호,이상으로 보고를 마치겠습니다. ,
n_id.419,o_id.228,소위원장 김성태,정부 측 의견 개진하여 주시기 바랍니다.,
n_id.420,o_id.229,환경부차관 윤종수,이 법안에 대해서는 좀 문제가 있다고 저희들은 생각하고 있습니다. ,
n_id.421,o_id.229,환경부차관 윤종수,왜냐하면 수계관리기금이라고 하는 것이 상·하류 간에 공용 공존을 위해 가지고 규제를 받는 상류 지역에 있는 분들을 도와주기 위해 한 것인데 하류도 지원한다 그러면 이 법의 근본적인 취지를 벗어나는 것이기 때문에 상당히 어렵고요. 그래서 119쪽에 있는 부분이 삭제돼야 될 필요가 있다고 생각하고요. ,
n_id.422,o_id.229,환경부차관 윤종수,"그다음에 120쪽에도 마찬가지로 '상수원관리지역 등' 밑에 죽 나오는 1·2·3호의 경우에도 같은 이유로 해 가지고, 상수원 관리지역은 어디에나 있을 수 있습니다. 그 지역은 별도의 지원방안을 마련해야지 이 제도로 하는 것은 좀 문제가 있다고 생각합니다. ",
n_id.423,o_id.230,소위원장 김성태,위원님들 의견 개진하여 주시기 바랍니다.,
n_id.424,o_id.230,소위원장 김성태,이것은 특별히 의견 개진할 것도 없을 것 같아요.,
n_id.425,o_id.230,소위원장 김성태,"이 법은 사실상 상류 지역의 주민들을 원래 지원하기 위한 법인데, 그렇지요?",
n_id.426,o_id.231,은수미 위원,법의 취지에 반하는 것이잖아요.,
n_id.427,o_id.232,소위원장 김성태,"예, 맞지 않지요.",
n_id.428,o_id.232,소위원장 김성태,그러면 의사일정 제9항에 대해서는 보다 심도 있는 심사를 위하여 우리 소위원회에서...... ,
n_id.429,o_id.233,심상정 위원,기각하시지요.,
n_id.430,o_id.234,소위원장 김성태,"수석전문위원, 이것은 기각 처리해도 관계없겠지요?",
n_id.431,o_id.235,수석전문위원 천병호,"저는 계속 위원님들 사이에 논의가 있어야 된다, 오늘 처리는 좀 어려울 것 같다, 그런 의견입니다.",
n_id.432,o_id.236,심상정 위원,이게 어떤 논의가 더 필요합니까? ,
n_id.433,o_id.237,소위원장 김성태,이 법안 발의 의원 입장을 고려한 것이지요.,
n_id.434,o_id.238,홍영표 위원,보류해요.,
n_id.435,o_id.239,소위원장 김성태,그러면 의사일정 제9항에 대해서는 보다 심도 있는 심사를 위하여 우리 소위원회에서 계속 심사하도록 하겠습니다.,
n_id.436,o_id.239,소위원장 김성태,없으면 보류하도록 하겠습니다.,
n_id.437,o_id.240,소위원장 김성태,다음은 의사일정 제10항 김진태 의원이 대표발의한 한강수계 상수원수질개선 및 주민지원 등에 관한 법률 일부개정법률안을 상정합니다. ,
n_id.438,o_id.240,소위원장 김성태,의사일정 제10항에 대해서 수석전문위원 설명해 주시기 바랍니다. ,
n_id.439,o_id.241,수석전문위원 천병호,"김진태 의원께서 대표발의한 내용으로 주요 내용은,",
n_id.440,o_id.241,수석전문위원 천병호,"첫째, 주민지원사업의 대상에 청정지역의 주민을 추가하고, 청정지역은 한강수계 안에서 수질이 대통령령으로 정하는 환경기준에 해당하는 지역으로 정의하고자 합니다. 주로 강원도 지역이 되겠습니다. ",
n_id.441,o_id.241,수석전문위원 천병호,"두 번째로, 환경친화적 청정산업에 대한 지원 근거를 명확하게 하기 위해 우선 용어를 '환경친화적 청정사업'으로 변경해서 정의하고, 이를 지원하기 위한 계획을 한강수계관리위원회 심의를 거쳐 수립 시행하도록 하는 내용입니다. ",
n_id.442,o_id.241,수석전문위원 천병호,"이 내용과 관련해서도 앞으로 논의가 필요한 사항 같아서, 이것과 관련해서는 환경부에서 아마 용역을 생각하고 계시는데...... ",
n_id.443,o_id.242,심상정 위원,"제가 몰라서 여쭤 보는 건데, 이게 강원도 상류 쪽 지원방안이잖아요?",
n_id.444,o_id.243,수석전문위원 천병호,"예, 최상류 쪽.",
n_id.445,o_id.244,심상정 위원,거기는 일체의 지원이 없습니까? ,
n_id.446,o_id.245,이종훈 위원,"예, 강원도는 없습니다. ",
n_id.447,o_id.246,환경부차관 윤종수,청정산업으로 해 가지고 일부 지원되는 것은 있습니다. 그러나 상수원보호구역으로 지정돼 가지고 하는 것은......,
n_id.448,o_id.247,환경부물환경정책국장 이정섭,이 법에 의한 규제를 받지는 않고 있고요. 다른 법에 의해서 규제를 받고 있기 때문에 사실상 규제를 받는 법에서 지원을 해야 되는 게 맞고요. ,
n_id.449,o_id.248,심상정 위원,그 규제를 하는 법안에서 지원방안은 있어요?,
n_id.450,o_id.249,환경부물환경정책국장 이정섭,수도법이라든가 다른 자연환경 이런 법에서 규제를 하고 있기 때문에 그런 법에서 일부 지원할 수 있는 게 있습니다. ,
n_id.451,o_id.250,소위원장 김성태,"그런데 이 법은 그것을 강원도 지역 전체로 확대하자는 것이잖아요, 그렇지요?",
n_id.452,o_id.251,환경부물환경정책국장 이정섭,그렇습니다. 여기는 규제 대상이 0.1～0.2%밖에 없는데 강원도 전체를 다 지원하자고 하기 때문에......,
n_id.453,o_id.252,심상정 위원,"아니, 저는 이 법안에 대해서는 반대하고요. ",
n_id.454,o_id.252,심상정 위원,다만 실제 형평성이나 이런 것들을 고려해서 상류 쪽에서도 규제를 받으면 거기에 상응하는 보상이 있어야 되겠다 이런 생각은 들어요. 그런데 다른 법에서 처리를 하셔야지요.,
n_id.455,o_id.253,소위원장 김성태,서울시나 경기도는 이 법 취지에 동의가 어떻습니까? ,
n_id.456,o_id.254,환경부물환경정책국장 이정섭,반대합니다.,
n_id.457,o_id.255,환경부차관 윤종수,당연히 반대지요. 결국 군사보호구역으로 지정된다든지 그린벨트로 지정된 것을 다 지원을 해야 되는 문제도 있고요.,
n_id.458,o_id.256,소위원장 김성태,나는 이것 물어봐요. ,
n_id.459,o_id.257,환경부차관 윤종수,"그래서 이 부분에 대해서는 발의를 하신 김진태 의원님실의 입장도 있기 때문에, 앞으로 청정사업이라든지 이런 부분과 관련되는 저희 나름대로 용역사업을 해서 장기적으로 지원할 수 있는 방안이라든지 이런 것을 하겠습니다. ",
n_id.460,o_id.258,심상정 위원,"그러니까 공익에 복무하는, 공익을 위해서 손해를 보는 이런 분들에 대해서는 철저하게 보상을 해 주는 것이 맞다고 봐요. 그런 원칙들이 지켜질 필요가 있습니다. ",
n_id.461,o_id.259,수석전문위원 천병호,그런 차원에서 한번 용역을 해 볼 필요가 있을 것 같습니다.,
n_id.462,o_id.260,환경부차관 윤종수,사실 더 큰 틀에서 국가 전체를 봐야 되는데요. ,
n_id.463,o_id.261,소위원장 김성태,토론을 마치도록 하겠습니다.,
n_id.464,o_id.261,소위원장 김성태,그러면 의사일정 제10항에 대해서는 보다 심도 있는 심사를 위하여 우리 소위원회에서 계속 심사하도록 하겠습니다.,
n_id.465,o_id.261,소위원장 김성태,이의 없습니까? ,(｢없습니다｣ 하는 위원 있음)
n_id.466,o_id.262,소위원장 김성태,다음은 오늘 마지막 의사일정입니다. ,
n_id.467,o_id.262,소위원장 김성태,의사일정 제11항 주호영 의원이 대표발의한 건설폐기물의 재활용촉진에 관한 법률 일부개정법률안을 상정합니다. ,
n_id.468,o_id.262,소위원장 김성태,의사일정 제11항에 대하여 수석전문위원 설명하여 주시기 바랍니다. ,
n_id.469,o_id.263,수석전문위원 천병호,130쪽입니다.,
n_id.470,o_id.263,수석전문위원 천병호,주호영 의원은 분리·선별업을 신설하여서 분리배출이 곤란한 배출자가 위탁 처리할 수 있도록 제도를 보완하여 달라 하는 내용입니다. 주로 이 내용의 핵심은 도심지에 있는 건설폐기물 적치장에 대해서 분리·선별업이라고 하는 내용을 신설하는 내용이 되겠습니다. ,
n_id.471,o_id.263,수석전문위원 천병호,이것과 관련해서는 여러 이해 관계자들의 주장이 서로 상치하고 있는 그런 사항이 되겠습니다. ,
