new_id,ori_id,speaker,utterance,note
n_id.137,o_id.95,전문위원 권기원,지적사항으로는 사회적 관심 병역자원 집중관리시스템은 의원입법으로 병역법 일부개정법률안이 발의되자 이를 고려하여 14년도 예산을 편성하였고 2014년 병역법에 근거규정을 마련하지 못한 관계로 관련 예산 전액이 불용되었습니다. 현재 이 법안들은 법사위 심사 중에 있습니다. ,
n_id.138,o_id.95,전문위원 권기원,시정요구사항은 법률개정을 예견하여 예산을 편성하는 것은 비효율적인 재정운용의 원인이 되므로 이러한 사례가 재발되지 않도록 할 것으로 했습니다. ,
n_id.139,o_id.95,전문위원 권기원,시정요구 수준은 시정입니다.,
n_id.140,o_id.95,전문위원 권기원,이상입니다.,
n_id.141,o_id.96,소위원장 김성찬,정부 측 답변해 주세요. ,
n_id.142,o_id.97,병무청차장 김노운,앞으로 법률개정을 예견해서 예산편성하는 것은 저희들이 지양하도록 하겠습니다. ,
n_id.143,o_id.97,병무청차장 김노운,"두 번째, 사회적 관심 병역자원 집중관리시스템에 대해서 어제 법사위 제2법안소위에서 심사를 했습니다마는 다음에 한 번 더 회의하는 것으로 그렇게 결과가 나왔습니다. 다음에 할 때에 꼭 통과될 수 있도록 노력을 하겠습니다. ",
n_id.144,o_id.98,소위원장 김성찬,이것은 시정하는 것으로 넘어가겠습니다.,
n_id.145,o_id.99,진성준 위원,시정요구 유형에 시정은 너무 높아요. 주의 정도로 좀 낮춰 주실 필요가 있어요.,
n_id.146,o_id.100,소위원장 김성찬,"하기야 뭐 법이 통과 안 됐으니까. 그러면 주의로 한 단계 낮추어서, 다음에는 미리 예견해서 예산편성 안 하도록 주의 정도 하면 될 것 같습니다.",
n_id.147,o_id.101,진성준 위원,"위원장님, 죄송합니다. 일사부재의인데 제가 좀 간과한 게 있네요. 4페이지 병사용 진단서......",
n_id.148,o_id.102,소위원장 김성찬,5번이 아니고요? 5번은 그러면 주의로 넘어갑니다. ,
n_id.149,o_id.102,소위원장 김성찬,4번 사항 다시 한 번 봅시다.,
n_id.150,o_id.103,진성준 위원,"예, 죄송합니다. ",
n_id.151,o_id.103,진성준 위원,병사용 진단서의 단가가 좀 비싼 것 같은데 보건복지부와 협의해 가지고 병사용 진단서의 경우는 가격을 낮춰서 좀 싸게 할 수 있는 방안은 없나요?,
n_id.152,o_id.104,병무청차장 김노운,지금 일반 진단서와 병사용 진단서가 있는데 병사용 진단서에는 본인의 사진이 첨부됩니다. 그리고 일반 진단서에 나타나는 것보다 질병 상태의 내용이 더 구체적이고 체계적으로 합니다. 그리고 병역 및 비리 문제가 발생했을 경우에는 의사가 책임지는 문제가 생깁니다. 그래서 병원에서 이것을 좀 비싸게 받고 있습니다. ,
n_id.153,o_id.105,진성준 위원,"아니, 그렇다 하더라도 이게 국가적인 필요에 의해서 하는 일인데...... ",
n_id.154,o_id.106,병무청차장 김노운,"예, 그 부분은 저희들이 보건복지부하고 진성준 위원님 말씀대로 한번 협의를 해서 단가를 인하하는 방안들을 노력해 보겠습니다. ",
n_id.155,o_id.107,진성준 위원,"글쎄, 그렇게 좀 추진해 봤으면 좋겠는데요. 그래서 협의 결과를 국회에 한번 보고해 주셨으면 좋겠습니다. ",
n_id.156,o_id.108,병무청차장 김노운,"예, 알겠습니다. ",
n_id.157,o_id.109,백군기 위원,"단가를 인하한다는 게 어떻게 하겠다는 거야? 가능한 것을 답변해야지, 어떻게 하려고? ",
n_id.158,o_id.110,병무청차장 김노운,대한의사협회하고 이런 데 저희들이 방문해서 일반 진단서에 비해서는 단가가 너무 높으니까 조금......,
n_id.159,o_id.111,백군기 위원,발급비가 지금 일반 발급비보다 더 높나요?,
n_id.160,o_id.112,병무청차장 김노운,"예, 높습니다.",
n_id.161,o_id.113,백군기 위원,더 높은 것은 문제가 되겠지. ,
n_id.162,o_id.114,병무청차장 김노운,그래서 아까도 제가 말씀드렸던 것이 책임성 문제가 따르니까요.,
n_id.163,o_id.115,백군기 위원,진단서라는 게 다 책임성이 따르는 거지. ,
n_id.164,o_id.116,병무청차장 김노운,일반 진단서하고는 조금 차이가 있습니다. ,
n_id.165,o_id.117,진성준 위원,그러니까 병원마다 진단서 발부 가격을 매기는 거잖아요. 그런데 병사용 진단서의 경우는 그런 책임이 발생하는 것이지만 국가적인 필요에서 하는 것이니까 병원이 자기 책임을 분명하게 하면서도 발행 단가는 좀 낮출 수 있는 거지요. 보건복지부가 병원들을 그렇게 유도할 수도 있는 것이고요.,
n_id.166,o_id.118,백군기 위원,"일반인하고 똑같이 해야지. 일반인보다 높은 것도 안 되고 낮은 것도 안 되고, 내가 볼 때는 일반하고 똑같이 해야지. ",
n_id.167,o_id.119,소위원장 김성찬,일을 부실하게 진단하라는 게 아니고 철저하게 하되 공익성이 있으니까 그것을 감안하라 이런 말이에요. 그것을 좀 협의하셔 가지고......,
n_id.168,o_id.120,병무청차장 김노운,예.,
n_id.169,o_id.121,소위원장 김성찬,6번 설명하세요. ,
n_id.170,o_id.122,전문위원 권기원,"6번, 사회복무요원 건강보험료 불용액 과다 부분입니다.",
n_id.171,o_id.122,전문위원 권기원,지적사항으로는 사회복무요원 건강보험료 지원 사업은 국가가 건강보혐료를 지원해 주는 것으로 2014년부터 시행된 제도입니다. 2014년도 39억 7500만 원의 예산을 편성하여 29억 8400만 원을 집행하고 24.9%인 9억 9100만 원을 불용 처리하여 집행실적이 부진합니다. ,
n_id.172,o_id.122,전문위원 권기원,시정요구사항은 예산 집행실적 분석을 통해 보다 정확하게 예산을 편성할 것으로 했습니다. ,
n_id.173,o_id.122,전문위원 권기원,시정요구 수준은 시정입니다.,
n_id.174,o_id.122,전문위원 권기원,이상입니다.,
n_id.175,o_id.123,소위원장 김성찬,정부 측 답변해 주세요. ,
n_id.176,o_id.124,병무청차장 김노운,사회복무요원 건강보험료 문제는 2014년도 최초로 도입돼서 운용하다 보니까 예산 사용하는 데 조금 미비한 점이 있었습니다. 그러나 금년도에는 작년 대비 8억 5000만 원 정도 감액을 해서 편성했는데 5월 말 현재 31억 2500만 원의 예산 가운데 집행이 13억 1800만 원으로서 41.1%를 집행했습니다. 현재 추세로 본다면 올 연말까지 집행하는 데는 별문제가 없을 것으로 생각이 됩니다. ,
n_id.177,o_id.125,안규백 위원,너무 주먹구구식으로 된 것 같은데?,
n_id.178,o_id.126,송영근 위원,차치하고.,
n_id.179,o_id.126,송영근 위원,"그러면 다른 측면에서 현역뿐 아니라 사회복무요원도 의무복무요원 아니에요, 그렇지요? 사회복무요원이 분명히 의무복무요원이지요? ",
n_id.180,o_id.127,병무청차장 김노운,"예, 그렇습니다.",
n_id.181,o_id.128,송영근 위원,"그런데 이 의무복무요원들이 들어오기 전까지는, 물론 보험료를 내니까 그렇지만 건강보험 혜택을 받게 돼 있다, 그렇지요? 그런데 군에 입대하는 순간에 그 건강보험 혜택이 사라진다 이거지. 그렇지요? 그것은 의료보호법의 건강보험 제외대상에 '군 입대한 자' 이렇게 딱 붙어 있기 때문에 이렇게 됐는데 그 사람의 입장으로 보게 된다면 참 오기 싫은 군에 와 가지고 21개월 이렇게 해 가지고 저희들 나름대로는 어렵게 근무를 하고 있는데, 이게 또 대한민국 국민인데, 우리 젊은이들이고 국가를 위해서 희생·헌신·봉사하는데 이 사람들에 대한 보험을 군대에 들어왔다고 해서 지원 안 해 주는 것은 나는 적절치 않다고 생각이 된다...... ",
n_id.182,o_id.128,송영근 위원,"그래서 이것은 병무청에서도 다시 해 가지고 군 의무복무기간에도 보험은 국가가 부담을 한다, 연금공단에서 대주게 한다, 이렇게 제도를 바꾸는 게 더 적절치 않겠느냐 이런 생각을 하게 되는 거예요.",
n_id.183,o_id.129,진성준 위원,"옳은 말씀인데, 그러면 왜 지원규모가 한 30% 내외인 거지요? 그러니까 사회복무요원으로 복무하는 가운데 이를테면 그 작업장에서 건강보험료를 내주는 데도 있기 때문에 국가 지원은 30% 내외인 건가요?",
n_id.184,o_id.130,병무청차장 김노운,"예, 그렇습니다. ",
n_id.185,o_id.131,송영근 위원,"그래서 이것은 내가 보기에는 한번 같이 고민해 볼 필요가 있다, 그렇지요? 의무복무하는 인원들에 대해서는 건강보험료를 국가가 책임진다, 여기 보면 사회복무요원들 전체 해 봐야 뭐 29억 어쩌고 그러는데, 그래서 이런 쪽으로 제도가 가야 되지 않겠느냐, 그래서 그것도 고민을 한번 해 볼 필요가 있다...... ",
n_id.186,o_id.132,진성준 위원,"예, 일리가 있는 말씀입니다.",
n_id.187,o_id.132,진성준 위원,그러면 어느 데는 건강보험료를 지급해 주고 어느 데는 부담을 안 해 줍니까? 대충 유형이 어떻게 됩니까?,
n_id.188,o_id.133,병무청사회복무국장 최철준,사회복무국장입니다.,
n_id.189,o_id.133,병무청사회복무국장 최철준,"지역과 직장으로 나눠져 있고요. 현역은 들어가면 군에서 다 의료를 부담하니까 되는데 사회복무요원은 8시간 근무하고 이외에는 바깥에 나와서 사회활동을 해야 되니까 지역의료보험에 가입했던 사람 중에 그 부담률, 그다음에 직장에서는 부담을 해 주는 데도 있고 안 해 주는 데도 있는데 안 해 주는 부분, 이렇게 나눠서 본인한테 들어온 부담금을 국가에서 해 주는 이런......",
n_id.190,o_id.134,진성준 위원,"그러니까 무슨 말씀인지 아는데, 기존에 직업이 없어서 지역가입자로 있었던 사람이 사회복무요원이 되면 어떤 방식으로는 직장이 생기는 거잖아요? ",
n_id.191,o_id.135,병무청사회복무국장 최철준,그것은 직장은 아닙니다. ,
n_id.192,o_id.136,진성준 위원,가령 어떤 사회복무요원이 소속된 곳이 분명하지 않은 경우가 있어요?,
n_id.193,o_id.137,병무청사회복무국장 최철준,지역가입자는 부모와 같이...... ,
n_id.194,o_id.138,진성준 위원,그러니까 그렇게 돼 있다가 사회복무요원으로 복무를 할 때에는 소속이 생기는 거잖아요. ,
n_id.195,o_id.139,병무청사회복무국장 최철준,소속이 생기는데 그것은 일반 직장의 개념은 아닙니다. ,
n_id.196,o_id.140,진성준 위원,"그러니까 그 소속이 어떤 데가 지금 안 되는 거냐고요, 지원이. ",
n_id.197,o_id.141,병무청사회복무국장 최철준,"여기서는 지원이 되고 안 되는 것이 아니고, 의료보험을 본인이 부담하는 데가 있고 예를 들자면 내가 사회복무요원인데 아버지 직장에 올라가면 이 사람은 아버지 직장에 피부양자로 돼 있으면 부담을 안 내지요. 그런 사람들은 지원을 안 해 줍니다. ",
n_id.198,o_id.142,진성준 위원,"아니, 그러니까 그것은 알겠다니까요. ",
n_id.199,o_id.142,진성준 위원,누구 좀 더 자세히 아시는 분이 설명해 보세요.,
n_id.200,o_id.143,병무청교육복무과장 정창근,교육복무과장 정창근입니다.,
n_id.201,o_id.143,병무청교육복무과장 정창근,"지금 위원님 말씀하신 사회복무요원이 직장에서 근무하기 때문에 직장에서 주는 것 아니냐 이런 말씀이신데, 사회복무요원이 근무하는 것은 맞습니다. 예를 들어 구청에서 근무를 하는데 구청에서 근무할 때 직장의 급여를 받는 게 아니라 현역과 같은 11～17만 원 정도, 일병부터 병장, 그 돈만 받습니다. 그러니까 직장에서 받는 급여 수준의 개념이 아니라 의무복무에 따른 기본 봉급 약 11～17만 원 정도 주기 때문에 그것을 가지고 의료보험비를...... 그런 개념이 아닙니다. ",
n_id.202,o_id.144,진성준 위원,그러니까 산업기능요원이나 전문연구요원 같은 경우에는 직장 식으로 급여가 나가기 때문에 거기서 건강보험료가 지급되는데 오히려 구청이나 동사무소에서 일하는 공익근무요원―옛날 말로 치면―은 국가가 데려다 쓰면서도 월급을 제대로 안 주니까 이네들은 건강보험료가 안 나간다 이 말씀이지요?,
n_id.203,o_id.145,병무청교육복무과장 정창근,"예, 그런 개념입니다.",
n_id.204,o_id.146,진성준 위원,"예, 알겠습니다. 국가가 더 책임져야 되겠구만.",
n_id.205,o_id.147,소위원장 김성찬,"이것은 인원 편성을 잘 해서 예산 불용이 안 생기도록 하라는 지적이니까 편성하실 때 평균 복무인원을 잘 좀 산정하라, 그렇게......",
n_id.206,o_id.147,소위원장 김성찬,"이것은 시정보다 주의를 촉구하는 게 맞을 같은데, 그렇지요? 편성할 때 잘해야 되는 것 아닙니까? ",
n_id.207,o_id.148,진성준 위원,편성 잘해야지요. ,
n_id.208,o_id.148,진성준 위원,시정.,
n_id.209,o_id.149,소위원장 김성찬,시정으로 합시다. ,
n_id.210,o_id.149,소위원장 김성찬,7번.,
n_id.211,o_id.150,전문위원 권기원,"7쪽, 7번 병무부조리 신고 포상금 제도 운용상의 문제 부분입니다. ",
n_id.212,o_id.150,전문위원 권기원,지적사항으로는 중간부분을 보시면 포상금 지급은 총액의 80%를 현금으로 본인계좌에 입금하고 20%에 상당하는 금액을 온누리상품권으로 지급함에 따라 회계서류상에 본인의 상금 수령액 80%만 기록되는 문제가 있고 또 포상금 지급 총 68건 중 사회복무요원 및 산업기능요원 복무부실 사례가 59건으로 주로 사회복무요원 복무부실자 신고용도로 활용되는 문제가 있습니다. ,
n_id.213,o_id.150,전문위원 권기원,"시정요구사항은 병역 기피 및 면탈 등의 병역비리 척결과 공정한 병역처분에 기여할 수 있도록 운영하고, 포상금 지급에 대한 회계처리가 왜곡되지 아니하도록 투명하게 집행할 것으로 했습니다. ",
n_id.214,o_id.150,전문위원 권기원,시정요구 수준은 시정입니다.,
n_id.215,o_id.150,전문위원 권기원,이상입니다. ,
n_id.216,o_id.151,소위원장 김성찬,정부 측 설명하세요. ,
n_id.217,o_id.152,병무청차장 김노운,포상금 지급액에 대해서는 지금부터 현금으로 지급하도록 하겠습니다. 그래서 투명성을 제고하고요.,
n_id.218,o_id.152,병무청차장 김노운,"그다음에 사회복무요원 부실 문제인데요, 지금 위반 가운데 대체복무로 한 59건 정도 위반됐는데 앞으로는 대체복무 위반된다 하더라도 편입이 취소되거나 그다음에 형사처벌을 받을 경우에 한정해서 포상금을 지급하는 방안을 지금 마련하고 있습니다. ",
n_id.219,o_id.153,진성준 위원,저는 좀 견해가 달라요. 꼭 그런 경우에만 포상금을 지급할 게 아니고 사회복무요원들이 한마디로 그냥 완전 군대 면제받고 근무를 개판으로 한다는 이런 국민적 인식이 있기 때문에 복무실태가 엄격할 필요가 있어요.,
n_id.220,o_id.153,진성준 위원,그런데 제대로 복무를 않고 있다고 해서 신고를 하면 형사처벌될 경우에만 포상을 해 주고 그렇지 않은 경우에는 포상 안 해 준다 이것은 저는 말이 안 된다고 봐요. ,
n_id.221,o_id.153,진성준 위원,"저는 오히려 신고를 장려해야 된다, 그래서 사회복무요원이나 산업기능요원으로 근무를 한다 하더라도 잘 근무할 수 있도록 해야지요, 병역을 대체하는 것인만큼. 저는 오히려 더 장려해야 된다 이렇게 생각해요.",
n_id.222,o_id.154,송영근 위원,신고를 하는 사람이 형사처벌될 만한 것인지 아닌지를 어떻게 알고서 신고를 해요?,
n_id.223,o_id.155,병무청차장 김노운,그런 것은 있습니다. ,
n_id.224,o_id.156,송영근 위원,"그렇잖아요? 그것은 다른 문제니까, 지금 이 뜻은 장려하기 위해서 그런 것 아니에요, 포상 이런 것이니까? 그러니까 이건 어떤 제한을 두는 것은 적절치 않아 보인다. ",
n_id.225,o_id.157,병무청차장 김노운,그것은 좀 더 생각을 해서 위원님 뜻대로 진행될 수 있도록 하겠습니다. ,
n_id.226,o_id.158,전문위원 권기원,제가 조금 부연설명을 드리겠습니다. ,
n_id.227,o_id.158,전문위원 권기원,"이런 복무부실 사례, 사회복무요원이 복무 부실하다고 구청이나 다른 데에서 일을 하고 있다, 인터넷 보고 있다고 그것을 신고해서 포상금을 지급하는 것 이런 것은 좀 문제가 있어서 그런 것까지 하는 것은 좀 지나치다 그런 차원에서......",
n_id.228,o_id.159,진성준 위원,그런 경우에도 포상금을 지급한 경우가 있어요?,
n_id.229,o_id.160,병무청차장 김노운,"그 부분에 대해서 아까 제가 말한 대로 신고사항을 따져 봐서, 경중을 따져서 좀 가벼운 것은 제외하고요, 포상금에서 적정하다 생각되는 부분을 지급하도록 그렇게 지금 저희들 하려고 하고 있습니다. ",
n_id.230,o_id.161,진성준 위원,그러니까 형사처벌에 한해서만 포상금을 지급하겠다고 그러면 그것은 포상금을 아예 지급하지 않겠다는 얘기와 다를 바가 없고......,
n_id.231,o_id.162,송영근 위원,"아까 근무태만이나 근무부실 이것은 부조리라고 볼 수는 없는 것이에요, 그렇지요?",
n_id.232,o_id.163,병무청차장 김노운,그 사안을 저희가 잘......,
n_id.233,o_id.164,소위원장 김성찬,"그것은 운용 면에서 방금 진성준 위원님 말씀하신 대로 편입 취소됐는지, 법에 위반되지 않더라도 경중을 봐서 병무청에서 운용상으로 잘하셔야 될 것 같은 그런 생각이 드는데?",
n_id.234,o_id.165,안규백 위원,무단이탈 있잖아요?,
n_id.235,o_id.166,진성준 위원,가령 징계사유가 있는 정도라면 그것에 대해서는 포상할 수도 있어야지요. 그런 것 아닙니까?,
n_id.236,o_id.167,소위원장 김성찬,포상금이 얼마입니까? ,
n_id.237,o_id.168,안규백 위원,20만 원 되어 있는데요?,
n_id.238,o_id.169,소위원장 김성찬,20만 원......,
n_id.239,o_id.169,소위원장 김성찬,그렇게 좀 시정을 해 주시기 바랍니다. ,
n_id.240,o_id.170,송영근 위원,추가질문 하나 합시다. ,
n_id.241,o_id.170,송영근 위원,그런데 최초부터 현금을 주지 않고 20%에 상당하는 온누리상품권을 지급하도록 결정한 이유는 뭡니까? ,
n_id.242,o_id.171,병무청차장 김노운,이렇습니다. 정부에서 재래시장 운영이 잘 안 되지 않습니까? 그래서 재래시장 활성화 정책에서 사서 지급해 주는 것입니다. ,
n_id.243,o_id.172,송영근 위원,재래시장을 활성화하기 위해서 이렇게 해 줬다.,
n_id.244,o_id.173,소위원장 김성찬,그것은 하여튼 시정을 그렇게 해 주시기 바랍니다. ,
n_id.245,o_id.173,소위원장 김성찬,8번.,
n_id.246,o_id.174,전문위원 권기원,8쪽 보시겠습니다. ,
n_id.247,o_id.174,전문위원 권기원,"8번, 소속기관장 관사 임차료 형평성 확보 필요 부분입니다. ",
n_id.248,o_id.174,전문위원 권기원,지적사항 하단 부분을 보시면 지방병무청장 관사는 지역별 특성을 고려하더라도 다음 쪽 표에서 보시는 바와 같이 지방청별로 규모와 임차료가 크게 차이가 발생을 하고 있습니다. ,
n_id.249,o_id.174,전문위원 권기원,9쪽을 보시겠습니다. ,
n_id.250,o_id.174,전문위원 권기원,경남 창원지방병무청의 경우와 위에 있는 표의 부산·경북 지방병무청의 관사 임차료가 차이가 좀 큽니다. 이런 사항들을 지적한 사항입니다.,
n_id.251,o_id.174,전문위원 권기원,시정요구사항은 지방병무청장 관사의 합리적인 기준을 마련하여 형평성을 유지할 것으로 했습니다. ,
n_id.252,o_id.174,전문위원 권기원,시정요구 수준은 제도개선입니다.,
n_id.253,o_id.174,전문위원 권기원,이상입니다. ,
n_id.254,o_id.175,소위원장 김성찬,위원님들 의견 주십시오.,
n_id.255,o_id.176,진성준 위원,경남은 2억 6000만 원이나 갑니까? ,
n_id.256,o_id.177,병무청차장 김노운,그게 지역에 따라서 여기는 지금 전부 아파트이거든요. 아파트 가격이 좀 다릅니다. ,
n_id.257,o_id.177,병무청차장 김노운,"저희들 정부청사관리규정 규칙에 보면 공무원 2급이나 3급인 경우에는 99㎡를 하도록 되어 있고요, 4급은 66㎡로 하도록 지금 그렇게 규정이 되어 있습니다. ",
n_id.258,o_id.177,병무청차장 김노운,그래서 저희들이 지금 구입한 것은 정부청사관리규정 시행규칙에 위배되지는 않고 있습니다마는 아마 지방청별로 크게 좀 차이가 있으니까 이 부분들은 나중에 임차할 때 좀 합리적으로 조정하는 방안을 저희들이 강구를 하도록 하겠습니다. ,
n_id.259,o_id.178,진성준 위원,창원 아파트값이 이렇게 비싸요? 60㎡짜리에 2억 6000만 원씩 가나? ,
n_id.260,o_id.179,안규백 위원,위치에 따라 다르겠지. ,
n_id.261,o_id.180,진성준 위원,"아니, 그렇더라도 비싸도 너무 비싼데요? ",
n_id.262,o_id.181,소위원장 김성찬,2억 6000만 원이 뭐예요? 관리비입니까? ,
n_id.263,o_id.182,전문위원 권기원,아닙니다. 임차료입니다. ,
n_id.264,o_id.183,진성준 위원,최근에 해서 그런 것인가요? 다른 데는 다 옛날에 했던 것이어서 그렇고?,
n_id.265,o_id.184,병무청운영지원과 김종철,"예, 그렇습니다. 갱신한 지가 얼마 안 됐습니다. ",
n_id.266,o_id.184,병무청운영지원과 김종철,창원지역이 행정타운이 몰려 있기 때문에 좀 비싼 편입니다.,
n_id.267,o_id.185,진성준 위원,"샀어요, 아니면 전세......",
n_id.268,o_id.186,병무청운영지원과 김종철,임차입니다. 전세입니다.,
n_id.269,o_id.187,진성준 위원,전세금이 2억 6000이란 말이네? ,
n_id.270,o_id.188,병무청운영지원과 김종철,"예, 그렇습니다.",
n_id.271,o_id.189,진성준 위원,30평도 안 되는데 이렇게 비싸네?,
n_id.272,o_id.190,소위원장 김성찬,그 정도 해요. 거기 전세가 진해도 비싸고 창원도 비쌉니다. ,
n_id.273,o_id.191,송영근 위원,"그런데 만약에 전세값이 확 올라가면 어떻게 할 거예요, 1년에 30, 40%?",
n_id.274,o_id.192,병무청차장 김노운,"전세값이 오르면 또 다음연도 예산에 저희들이 반영을 해서, 아니면 평수를 좀 줄이든지 그렇게 하고 있습니다. ",
n_id.275,o_id.193,소위원장 김성찬,"이것은 특별히 제도개선을 할 것도 없는데, 8번 사항은 운영 잘하도록 하는 것으로......",
n_id.276,o_id.193,소위원장 김성찬,9번 설명해 주세요.,
n_id.277,o_id.194,전문위원 권기원,"10쪽, 9번 사회복무요원 복무부실자 교육 강화 필요 부분 보시겠습니다. ",
n_id.278,o_id.194,전문위원 권기원,진성준 위원님께서 질문하신 사항이기도 합니다. ,
n_id.279,o_id.194,전문위원 권기원,"지적사항으로는 중간부분에서 2014년도 집행실적을 보면 기본교육인 소양교육은 2만 4055명에 대하여 88억 7000만 원을 집행하였고, 보수교육은 1250명에 대하여 4억 1000만 원이 집행되었습니다. ",
n_id.280,o_id.194,전문위원 권기원,복무부실자에 대한 교육은 발생인원 대비 43.4%에 해당하는 1250명에 불과하는 등 보수교육이 상대적으로 소홀하였습니다. ,
n_id.281,o_id.194,전문위원 권기원,시정요구사항은 2016년 준공되는 사회복무교육원을 활용하여 사회복무요원 개인별 특성과 교육수용 능력에 따른 대상자별 특성화 교육을 강화하고 보수교육도 강화할 것으로 했습니다. ,
n_id.282,o_id.194,전문위원 권기원,시정요구 수준은 제도개선입니다.,
n_id.283,o_id.194,전문위원 권기원,이상입니다. ,
n_id.284,o_id.195,소위원장 김성찬,정부 측 설명하세요. ,
n_id.285,o_id.196,병무청차장 김노운,사회복무요원 복무부실자 교육 강화에 대해서 지난번 진성준 위원님도 말씀하셨는데 저희들 공감을 하고 있습니다. ,
n_id.286,o_id.196,병무청차장 김노운,지금까지는 교육기관의 수용능력이 부족해서 전원을 못 했습니다. 그래서 이번에 교육원이 개원이 되면 여기에 따라서 좀 더 체계적이고 특성화된 교육을 할 수 있도록 그렇게 하겠습니다. ,
n_id.287,o_id.197,안규백 위원,한번 복무 시작할 때부터 몇 개월 단위로 혹은 얼마 단위로 교육을 받습니까? ,
