new_id,ori_id,speaker,utterance,note
n_id.224,o_id.131,심상정 위원,"그다음에 기본적으로 먹는물 판매가 확대되는 것은 바람직하지 않다는 게 저의 견해예요. 지하수하고 지표수 고갈 문제도 있고 또 하나는 페트병 환경오염 문제가 굉장히 심각하잖아요. 그래서 이것은 근원적인, 기초 차이가 좀 있다 이렇게 생각이 됩니다. ",
n_id.225,o_id.131,심상정 위원,그런데 민주당에서 어떤 안을 지금 준비하시는지 모르겠는데 이 안 자체에 대해서 가장 핵심적인 것은 원위치를 시켰지만 기본적으로 물 판매 확대와 관련해서 저는 확대하는 방향으로의 어떤 개정은 반대한다는 말씀을 드립니다.,
n_id.226,o_id.132,소위원장 김성태,"정부, 이 법의 시급성은 어떤 정도입니까?",
n_id.227,o_id.133,환경부차관 윤종수,"이번 회기 안에 또 수정안이, 대안이 나온다고 하시니까 그러면...... 그 내용을 잘 모르지만 저희들이 보기에는 지금 여러 가지 지적을 해 주셔 가지고 그런 문제에 대해서 다 수정했다고 생각하고 있습니다마는 홍 의원님실에서 또 나오면 병합해서, 다만 이번 회기를 지나가면 이게 또 너무 문제가 되기 때문에......",
n_id.228,o_id.134,심상정 위원,"뭐가 문제가 돼요? 제가 보기에는 정부가 오히려 수돗물 공급의 신뢰를 강화시키는 데 신경을 써야지, 왜 생수시장 확대에 신경을 씁니까?",
n_id.229,o_id.135,환경부차관 윤종수,그래서 병합해서 같이 처리하도록 하겠습니다.,
n_id.230,o_id.136,심상정 위원,"제가 묻고 싶은 것이 그것이에요. 정부가 신경 써야 되는 것은 수돗물 공급의 신뢰를 어떻게 강화할 거냐를 신경 써야지, 왜 생수시장 확대에 신경을 쓰냐 이 말입니다.",
n_id.231,o_id.137,소위원장 김성태,"위원님들, 다른 의견 없습니까?",
n_id.232,o_id.137,소위원장 김성태,그러면 의사일정 제1항에 대해서도 보다 심도 있는 심사를 위해서 우리 소위원회에서 계속 심사하도록 하겠습니다. 이의 없습니까?,(｢예｣ 하는 위원 있음)
n_id.233,o_id.137,소위원장 김성태,이의 없으시면 소위원회에서 계속 심사하도록 하겠습니다.,
n_id.234,o_id.138,소위원장 김성태,다음은 의사일정 제2항 이낙연 의원이 대표발의한 물의 재이용 촉진 및 지원에 관한 법률 일부개정법률안을 상정합니다.,
n_id.235,o_id.138,소위원장 김성태,수석전문위원 설명해 주시기 바랍니다.,
n_id.236,o_id.139,수석전문위원 천병호,27쪽을 봐 주시기 바랍니다.,
n_id.237,o_id.139,수석전문위원 천병호,"법안의 주요내용은, ",
n_id.238,o_id.139,수석전문위원 천병호,"첫째, 물 재이용 대상에 발전소 온배수를 추가하는 거고, ",
n_id.239,o_id.139,수석전문위원 천병호,둘째로는 온배수 재이용사업을 하려는 자는 환경부장관의 인가를 받고 상하수도 설비공사업에 등록한 자에게 설계·시공을 받도록 하고 있습니다. ,
n_id.240,o_id.139,수석전문위원 천병호,"세 번째로는, 온배수 재이용사업자는 재처리수 수질검사를 하게 해서 환경부장관에 보고토록 하는 내용 등이고, ",
n_id.241,o_id.139,수석전문위원 천병호,"마지막 네 번째는, 온배수 재이용사업자의 사전 동의 없이 온배수 재처리수 관로로부터 이러한 온배수 재처리수를 이용하거나 시설을 변조, 파손하지 못하도록 하는 내용이 되겠습니다.",
n_id.242,o_id.139,수석전문위원 천병호,시간 관계상 수정안을 보고 설명하도록 하겠습니다.,
n_id.243,o_id.139,수석전문위원 천병호,29쪽을 봐 주시기 바랍니다.,
n_id.244,o_id.139,수석전문위원 천병호,제2조(정의) 규정입니다.,
n_id.245,o_id.139,수석전문위원 천병호,"과거에는 제1호를 보면 ""'물의 재이용'이란 빗물, 오수, 하수처리수 및 폐수처리수를"" 이렇게 했는데, 여기에 '발전소 온배수'가 추가되는 내용이 되겠습니다. 그리고 개정안에서는 1의2호를 신설해서 발전소 온배수가 뭐다 하는 정의 규정을 하고 있습니다. 그런데 현행법에 보면 제1호에 따라서 빗물, 오수, 하수처리수, 폐수처리수 순서대로 정의를 규정하고 있기 때문에, 개정안에서 1의2호를 만들었는데 수정의견에서는 순서에 따라서 6의2로 그것을 바꾼 내용이 되겠습니다.",
n_id.246,o_id.139,수석전문위원 천병호,30쪽입니다.,
n_id.247,o_id.139,수석전문위원 천병호,"그다음에 현행법 2호에서는 ""'물 재이용시설'이란"" 이렇게 이야기하고 있는데, 그 속에 온배수 재이용시설도 추가하는 내용입니다. 그런데 '온배수 재이용시설'이라고 했는데 수정안에서는 개념 정의가 원래 발전소 온배수기 때문에 '발전소 온배수'로 잡아 준 게 되겠습니다.",
n_id.248,o_id.139,수석전문위원 천병호,"그리고 7의2에서는 온배수 재이용시설을 이야기하면서 '발전소 온배수 재이용시설(이하 온배수 재이용시설이라 한다)' 이런 내용이 되겠고, 제9호에서 '온배수 재이용사업이란' 이것도 마찬가지로 발전소 온배수 재이용사업인데 앞으로는 온배수 재이용사업이라고 해 준 내용이 되겠습니다.",
n_id.249,o_id.139,수석전문위원 천병호,"그리고 31쪽에서 10호를 신설해서 '하·폐수처리수 재이용시설·온배수 재이용시설 설계·시공업'이 무엇인지에 대한 개념 정의를 하고, 원래 이낙연 의원께서는 이 업을 상하수도 처리업에게 맡겼는데 그 성격상 상하수 처리보다는 이것은 물의 재이용이기 때문에 하·폐수처리수 재이용시설업자에게 맡기는 것으로 수정의견을 냈습니다. 그리고 지경부에서도 그러한 의견이 들어왔습니다. 참고로 말씀드리겠습니다.",
n_id.250,o_id.139,수석전문위원 천병호,"다음, 33쪽입니다.",
n_id.251,o_id.139,수석전문위원 천병호,"참고로 지금 현재 발전소 온배수와 관련해서는 이 법이 통과되지 않은 상태입니다마는, 33쪽 오른쪽에 보시면 현재 인천 영흥화력발전소에서 온배수 재이용시설을 설치·운영 중에 있습니다. 참고로 하시기 바랍니다.",
n_id.252,o_id.139,수석전문위원 천병호,다음에 34쪽입니다.,
n_id.253,o_id.139,수석전문위원 천병호,"하·폐수처리수 재이용사업의 인가, 현행에서는 '하·폐수처리수 재이용사업을 하려는 자는' 했습니다마는, '하·폐수처리수 재이용사업을 하려는 자와 온배수 재이용사업을 하려는 자' 해서, 하·폐수처리수 재이용사업은 온배수 재이용사업을 하려는 자가 하는 것으로 이렇게 규정해 놨습니다.",
n_id.254,o_id.139,수석전문위원 천병호,"다음에 35쪽 밑에 보면 현행법에서 '설치할 때에는 하·폐수처리수 재이용시설 설계·시공업자에게 설계·시공하도록 하여야 한다' 하는 내용인데, '설치하거나 제11조에 따라 온배수 재이용사업의 인가를 받은 자가 온배수 재이용시설을 설치할 때에는 하·폐수처리수 재이용시설 등 설계·시공업자에게 설계·시공하도록 하여야 한다' 하는 내용을 추가해서 규정하였습니다.",
n_id.255,o_id.139,수석전문위원 천병호,"그래서 이러한 원칙하에서 36쪽, 37쪽, 38쪽, 39쪽, 40쪽 다 이렇게 바뀌어진 내용들이 되겠습니다.",
n_id.256,o_id.139,수석전문위원 천병호,"다만 43쪽을 봐 주시면, 이낙연 의원은 개정안에서 제20조의2부터 그 이하에서 온배수 재이용사업에 대한 규정을 죽 하고 있습니다. 그러나 앞에서 보셨던 것처럼 하·폐수처리수와 같이 온배수 이용사업을 추가해서 넣었기 때문에 20조의2, 20조의3 이하 전부 다 삭제하여도 법체계상 문제가 없도록 되어 있는 내용이 되겠습니다.",
n_id.257,o_id.139,수석전문위원 천병호,"다음에 50쪽, 51쪽도...... 51쪽에서 보시면 벌칙조항과 관련해서 개정안에서는 항을 신설해서 제20조의2 제1항에 따른 변경인가를 받지 아니하고 온배수 재이용사업을 하거나 거짓이나 부정한 방법으로 하는 경우에 처벌하도록 되어 있습니다마는, 제20조의2항을 삭제해 버렸기 때문에 여기서는 1호에 '하·폐수처리수 재이용사업 또는 온배수 재이용사업' 해서 하·폐수처리수를 부정으로 하는 경우에 같이 처벌하도록 함으로써 삭제한 내용이 되겠습니다.",
n_id.258,o_id.139,수석전문위원 천병호,"52쪽의 삭제도 마찬가지고, 53쪽, 54쪽의 삭제도 그렇게 해서 하·폐수처리수와 같이 벌칙조항을 주는 내용이 됩니다.",
n_id.259,o_id.139,수석전문위원 천병호,"다음, 55쪽을 봐 주시면 부칙조항을 신설해서, 수정안에서는 이미 사용한 영흥발전소 내용이 있기 때문에 부칙조항에 온배수 재이용사업의 인가에 관한 경과조치를 두어서 1년 동안에 인가 기준을 갖추도록 하고, 제3조에서도 온배수 재이용시설에 관한 경과조치를 넣고, 제4조에 하·폐수처리수 재이용시설 설계·시공업자에 관한 경과조치를 추가한 내용이 되겠습니다.",
n_id.260,o_id.139,수석전문위원 천병호,이상입니다.,
n_id.261,o_id.140,심상정 위원,발전소 정의에......,
n_id.262,o_id.141,소위원장 김성태,정부 측 의견 듣고......,
n_id.263,o_id.142,심상정 위원,예.,
n_id.264,o_id.143,환경부차관 윤종수,전체적인 체계를 입법조사관실에서 크게 정리를 다시 하셨습니다. 그래서 수정의견 내용에 대해서 다 동의합니다.,
n_id.265,o_id.144,소위원장 김성태,수석전문위원 수정안에 다 동의한다 이거지요?,
n_id.266,o_id.145,환경부차관 윤종수,예.,
n_id.267,o_id.146,소위원장 김성태,위원님들 의견 말씀해 주십시오.,
n_id.268,o_id.147,심상정 위원,발전소의 정의에 원자력발전소가 포함되는지......,
n_id.269,o_id.148,환경부차관 윤종수,"예, 포함되어 있습니다.",
n_id.270,o_id.149,심상정 위원,"그러면 저는...... 제가 이 법안 찬성하려고 그랬는데, 원자력발전소가 포함되면 보류했으면 좋겠습니다.",
n_id.271,o_id.150,수석전문위원 천병호,"제가 조금 보완 설명을 해 드리면요, 지금 현재 기본적으로 화력발전소하고 원자력발전소가 있습니다. 그래서 온배수 이용은 두 가지 발전소에 다 사용되는데, 다만 원자력발전소의 경우에는 구조상 터빈 내부에 열을 식히기 위해서 중수소가 들어가는 물이 있고, 또 발전소 외부를 도는 그런, 바닷물을 끌어와서 온도를 내리는 경우가 있는데, 여기서 말하는 건 주로 후자지만 방금 위원님께서 말씀하신 것처럼 기술적으로는 그러한 중수소가 흘러나오는 사고도 있을 수 있지 않느냐 그런 우려도 있는 것은 사실입니다.",
n_id.272,o_id.151,심상정 위원,"그래서 저는 원자력발전소를 제외하면 찬성이고요, 원자력발전소가 포함되면 이건 조금 곤란합니다. 예를 들어서 방사능 문제 논란이 정리가 되어야 되지요. 이거 일본에서도 다 드러난 일이고 언제 어떻게 사고가 날지 모르는데 그것을...... 그것도 특히 또 재활용이, 뭡니까? 다 농업용수 이런 것들로 사용되고, 공업용수도 마찬가지예요. 그 문제가 좀 걸리네요.",
n_id.273,o_id.152,이종훈 위원,저도 원자력 들어가면 반대입니다.,
n_id.274,o_id.153,소위원장 김성태,그러면 수정 의결하도록 할까요?,
n_id.275,o_id.154,심상정 위원,저는 원자력 빼면 동의할게요.,
n_id.276,o_id.155,소위원장 김성태,정부 측......,
n_id.277,o_id.156,환경부차관 윤종수,"저희는 위원님들의 논의에 대해서 결정하시는 대로 따르겠습니다마는, 일단은 이낙연 의원님이 발의하신 것은 영광원자력발전소가 있어 가지고 거기에서 나오는 폐수를 재활용하려고 하는 건데......",
n_id.278,o_id.157,소위원장 김성태,여기서 원자력 빼면 이 법 별......,
n_id.279,o_id.158,환경부차관 윤종수,"예, 법의 의미가 없어지는데, 실제로 팩트를 말씀드리면 이것이 원자력 전용 냉각수하고 터빈 냉각수는 완전히 분리되어 있다는 것입니다. 그래서 재활용하는 것은 터빈 냉각수만......",
n_id.280,o_id.159,이종훈 위원,그것은 아무 일 없을 때만......,
n_id.281,o_id.160,심상정 위원,아까 영흥화력발전소 이런 데도 있잖아요. 왜 의미가 없어요? 의미가 있지. 물론 이낙연 의원님께서 제시하시는 것은......,
n_id.282,o_id.161,환경부차관 윤종수,"그게 아니라 이쪽, 원자력 지금 걱정하시는 부분은......",
n_id.283,o_id.162,심상정 위원,"아니, 굉장히 위험해요. 이야기를 하자면 굉장히 복잡합니다.",
n_id.284,o_id.163,홍영표 위원,"제가 말씀드릴게요. 이 법안이 지금 저희 상임위에 2건이 계류 중이랍니다, 2건이. 같은 법안이.",
n_id.285,o_id.164,심상정 위원,물 재이용?,
n_id.286,o_id.165,홍영표 위원,"예, 그래서 오늘 토론하시고, 그 법안이 소위로 넘어오면 함께 병합 심사를 해야 됩니다. 안 그러면 그다음에 또 해야 되지 않습니까?",
n_id.287,o_id.166,은수미 위원,"오늘은 다 토론이 됐는데, 원자력 때문에 원자력을 포함시키면 안 된다는 것으로 지금 ......",
n_id.288,o_id.167,홍영표 위원,"아무튼 그것은 그렇게 결론을 내시고 하는 것은 좋습니다. 그렇게 하시고, 다음에 물의 재이용 촉진 및 지원에 관한 법률 일부개정법률안이 지금 현재 2건이 더 있으니까 이것을 다음번 논의하실 때 병합해서 최종적으로 의결하도록......",
n_id.289,o_id.168,심상정 위원,그럼 오늘 하지 말자는 얘기잖아요? 그럼 빨리빨리......,
n_id.290,o_id.169,홍영표 위원,"아니, 오늘 얘기하신 것은 원자력만 빼고......",
n_id.291,o_id.170,소위원장 김성태,좋습니다.,
n_id.292,o_id.170,소위원장 김성태,"위원님들, 다른 의견 없으시면......",
n_id.293,o_id.171,심상정 위원,"아니, 그런데 이낙연 의원님은 지금 원자력 때문에......",
n_id.294,o_id.172,홍영표 위원,그런데 사실 이낙연 의원님이 말씀하신 것은 원자력을 넣어 달라고 얘기한 거예요. 그러니까 아마 그거 빠지면 별 의미가 없을 겁니다. 그렇지요?,
n_id.295,o_id.173,소위원장 김성태,그러면 의사일정 제2항에 대해서는 보다 심도 있는 심사를 위하여 우리 소위원회에서 계속 심사하도록 하겠습니다. 이의 없습니까?,(｢예｣ 하는 위원 있음)
n_id.296,o_id.174,소위원장 김성태,다음은 의사일정 제3항 정부가 제출한 환경범죄 등의 단속 및 가중처벌에 관한 법률 일부개정법률안을 상정합니다.,
n_id.297,o_id.174,소위원장 김성태,의사일정 제3항에 대하여 수석전문위원 설명해 주시기 바랍니다.,
n_id.298,o_id.175,수석전문위원 천병호,58쪽을 봐 주시기 바랍니다.,
n_id.299,o_id.175,수석전문위원 천병호,"정부가 제출한 법안으로 주요 내용은, ",
n_id.300,o_id.175,수석전문위원 천병호,"첫째로, 환경보호지역에 낙동강수계법 또 금강수계법, 영산강수계법 등에서 지정·고시된 수변구역을 추가하겠다 하는 내용입니다. 지금 현재는 한강수계법에 의한 수변지역만 되어 있기 때문에 추가하는 내용이 되겠습니다.",
n_id.301,o_id.175,수석전문위원 천병호,"두 번째로는, 환경부장관의 과징금 부과·징수 권한 중 일부를 시·도지사, 시장·군수 등에게 이양하는 내용입니다.",
n_id.302,o_id.175,수석전문위원 천병호,"세 번째로는, 환경부장관의 행정처분 권한 중 일부를 시·도지사, 시장·군수·구청장에게 이양하는 내용이 되겠습니다.",
n_id.303,o_id.175,수석전문위원 천병호,이 법안도 수정의견을 보면서 설명드리도록 하겠습니다. ,
n_id.304,o_id.175,수석전문위원 천병호,63쪽을 봐 주시기 바랍니다. ,
n_id.305,o_id.175,수석전문위원 천병호,"참고로 그전에 60쪽을 보시면, 한명숙 위원께서 환경부장관의 과징금 부과·징수 권한 중 일부를 시·도지사 및 시장·군수·구청장에게 이양하는 것은 재검토가 필요하다, 왜 그러냐 하면 지자체가 적극적으로 관리감독을 하지 않을 가능성이 있다, 그런 지적의 말씀이 계셨습니다.",
n_id.306,o_id.175,수석전문위원 천병호,"다음, 63쪽 설명드리도록 하겠습니다. ",
n_id.307,o_id.175,수석전문위원 천병호,"과징금과 관련해서 현행에서는 환경부장관이 부과하도록 되어 있습니다마는 개정안에서는 환경부장관, 특별시장·광역시장·특별자치시장 등 여러분을 규정함으로 인해 가지고 이렇게 권한을 이양할 수 있는 근거를 마련하는 내용이 되겠습니다. ",
n_id.308,o_id.175,수석전문위원 천병호,64쪽입니다. ,
n_id.309,o_id.175,수석전문위원 천병호,"제1호 환경부장관은 이러한 것에 대해서 과징금을 부과한다는 내용이 되겠고, 2호에서는 시·도지사에게, 그리고 3호에서는 특별자치시장·시장·군수·구청장에게 규정한 내용이 되겠습니다. ",
n_id.310,o_id.175,수석전문위원 천병호,"다음에 7항에 보시면 현행법에서는 ""제1항에 따른 과징금은 환경정책기본법에 따른 환경개선특별회계의 세입으로 한다.""이렇게 되어 있습니다. 그런데 문제는 만일 이러한 과징금 부과권한이 시·도지사나 구청장에게 내려가면 그것을 징수한 시장·구청장이 환경개선특별회계 세입을 자기가 가져야지 그것을 걷어 가지고 다시 환경부장관이 사용할 수 있는 환경부로 들어가는 것은 좀 맞지가 않다. 그래서 여기에서는 100분의 50을 그렇게 했습니다마는 전체를 지방자치단체가 가지도록 하든지 그것은 정책적으로 판단할 일이라고 생각합니다. ",
n_id.311,o_id.175,수석전문위원 천병호,"다음, 66쪽입니다. ",
n_id.312,o_id.175,수석전문위원 천병호,항을 신설해서 제7항에도 불구하고 시·도지사 및 시장·군수·구청장이 부과·징수한 과징금 중 정화비용으로 징수한 금액 전액은 지방자치단체도 그것을 그 원상회복에만 사용하도록 그렇게 규정을 했습니다. ,
n_id.313,o_id.175,수석전문위원 천병호,"그리고 제8항에 보면 '제1항에 따라 시·도지사 또는 시장·군수·구청장이 과징금을 징수하거나 제19조에 따라 시·도지사'라고 되어 있는데 이제는 '제19조에 따라 시·도지사'로만 문구를 바꿔 줘야 되기 때문에, 19조에 '시·도지사'라고 되어 있습니다. 그래서 바꾼 내용이 되겠습니다. ",
n_id.314,o_id.175,수석전문위원 천병호,"다음, 68쪽입니다. ",
n_id.315,o_id.175,수석전문위원 천병호,오염물질 불법배출시설에 대한 행정처분 권한을 일부 지방에 이양하는 내용이 되겠습니다. ,
n_id.316,o_id.175,수석전문위원 천병호,72쪽입니다. ,
n_id.317,o_id.175,수석전문위원 천병호,"72쪽에 개정안에 대해서 여러 가지 수정의견이 나와 있는데 수정의견을 낸 이유는 환경부장관이 행정처분할 수 있는 내용이 있고, 시·도지사가 할 수 있는 내용이 있고, 구청장이 할 수 있는 내용이 있는데 개정안에서는 이것을 조금 헷갈리게 해서 내용이 들어와서 그것을 바로잡아 준 내용이 되겠습니다. ",
n_id.318,o_id.175,수석전문위원 천병호,그래서 73쪽에 보시면 개정안에서는 시·도지사의 여러 가지 권한 중에서 '법률에 따라 배출시설의 설치가 금지된 지역에 설치된 배출시설 또는 영업이 금지된 지역에서 영업' 이렇게 했습니다마는 수정안에서는 '배출시설(제2조제3호가목에 따른 시설로 한정한다) 또는 영업(제2조제4호마목 및 유해화학물질관리법 제20조제1항 각 호의 어느 하나에 해당하는 영업에 한정한다)' 함으로써 시·도지사가 할 수 있는 권한으로 제한해 준 내용이 되겠습니다. ,
n_id.319,o_id.175,수석전문위원 천병호,"다음, 75쪽입니다. ",
n_id.320,o_id.175,수석전문위원 천병호,75쪽에 보면 개정안에서는 관광진흥법을 넣고 있습니다마는 이 법에서 말하고 있는 관광진흥법은 골프영업과 관광숙박업이 해당이 됩니다. 그런데 이것은 등록업이 되기 때문에 폐쇄 내용은 해당이 되지 않기 때문에 관광진흥법을 제외했습니다. ,
n_id.321,o_id.175,수석전문위원 천병호,"다음, 신설한 마목도 마찬가지로 '배출시설' '영업' 이렇게 했습니다마는 모든 배출시설과 영업이 아니고 '제2조제3호라목 및 마목에 해당되는 배출시설', 또 영업은 '제2조제4호라목 및 바목부터 자목까지에 따른 영업에 한정'하기 때문에 내용을 확정해 주는 내용이 되겠습니다. ",
n_id.322,o_id.175,수석전문위원 천병호,이상입니다. ,
n_id.323,o_id.176,소위원장 김성태,정부 측 의견 말씀하세요. ,
n_id.324,o_id.177,환경부차관 윤종수,"수정의견에 대해서 동의합니다. 동의하는데, 아직 수정의견이 명확하지 않은 부분과 관련돼서, 첫 번째 한명숙 위원님께서 말씀하신 지방 이양에 대해서 재검토가 필요하다는 부분과 관련돼서 이 부분에 대해서도 위원님의 의견에 대해서 수용을 하고요. 100분의 50씩 나눠서 하는 것에 대해서 문제가 있다는 말씀에 대해서도 재검토하는 것에 대해서 동의합니다. ",
n_id.325,o_id.178,소위원장 김성태,위원님들 의견 말씀해 주십시오. ,
n_id.326,o_id.179,홍영표 위원,"차관님, 환경부에서 전국의 오염물질 배출시설을 관리하는 데 어려움이 있다고 생각이 들지만 요즘에 수도권에서 오염과 관련된 업체들이 지방으로 사실 많이 갑니다. ",
n_id.327,o_id.179,홍영표 위원,지방은 워낙 산업 이런 기반이 취약하다 보니까 유치하기 위해서 유치를 하다 보니까 수도권에서 밀려나는 그런 것만 하거든요. 제가 보면 지방의 지자체장들 입장으로 봐서는 이게 단속하기가 환경부하고는 입장이 달라요. 그렇지 않습니까? ,
n_id.328,o_id.180,환경부차관 윤종수,예.,
n_id.329,o_id.181,홍영표 위원,"그쪽은 유치하거든요. 솔직히 인천 같은 데 사실 주물단지라든지 이런 게 있는데 이게 보면 요즘 대개 다 시골로 가요, 시골. 왜냐하면 도시에서는 전에는 주거지역하고 떨어져 있는 데다 입지를 했다가 요즘에는 다 아파트를 지으니까 거기에서는 어렵거든요. 그러다 보니까 지방으로 가는데 그런 면에서 아마 한 위원님도 걱정을 하신 것 같아요. 그것에 대해서 제가 봤을 때는 환경부가 오히려 관리하는 체계를 확장을 해서라도 하시는 게 맞지 않나 하는 생각이 들고요. ",
n_id.330,o_id.181,홍영표 위원,그다음에 수용을 하셨지만 지방에서 그것을 단속해서 징수를 하면 지자체에서 써야 인건비도 쓰고 다 그런 거지 그것을 또 50 대 50으로 나누자는 것은 말이 안 됩니다. ,
n_id.331,o_id.182,환경부차관 윤종수,거기에 대해서 제가 한 말씀 올리겠습니다. ,
n_id.332,o_id.182,환경부차관 윤종수,"첫 번째 말씀하신, 진짜 그런 문제가 지금 굉장히 있습니다. 그것은 어느 나라나 그런 문제가 있습니다만 위임을 해 주면 위임법령 내에서 열심히 단속을 해야 되는데 지자체의 사정상 다 관내에 있는 기업들이 잘 되어야 또 세수도 들어오고 하기 때문에, 저희들이 이번에도 일제 검찰하고 지자체하고 단속한 것을 보면 우리 직접 한 것하고 한 10배 정도 차이가 나거든요. 그래서 이것은 상당히 문제가 있다. ",
n_id.333,o_id.182,환경부차관 윤종수,"그래서 환경부가 앞으로는 지방청을 통해 가지고 직접 하는 방식으로 해야 되는데 그게 우리 수생태법 지난번에 보류가 된 그 법이 그 법이거든요. 그래서 그것에 대해서 지자체의 인허가를 5년마다 갱신을 해야 됩니다, 지자체에 속해 있는 기업들의 배출권에 대해서. 미국도 그렇게 하거든요. ",
