new_id,ori_id,speaker,utterance,note
n_id.89,o_id.7,수석전문위원 박수철,다시 말씀드려서 재난안전제품 검증체계 구축을 위한 인증제도와 관련된 부분이 되겠는데 그 필요성은 인정된다고 보이지만 제19대 국회 우리 위원회에서 법안 심사 시에 국민안전처의 인증제 도입 능력에 대한 확인이 필요하다는 의견이 제시되었다는 점을 감안하셔 가지고 이에 관련된 국민안전처 의견을 들으신 후에 입법정책적으로 결정하실 사안이라고 보여집니다. 아울러서 위원님들께서 이 부분을 입법적으로 수용하실 경우 인증 유효기간의 경우 적어도 인증제도하고 관련돼서는 중요한 사항으로 보이므로 적절한 인증 유효기간을 설정할 필요성도 있다고 보입니다.,
n_id.90,o_id.7,수석전문위원 박수철,66쪽 보고를 올리겠습니다.,
n_id.91,o_id.7,수석전문위원 박수철,정부안에 있는 내용이 되겠습니다. 지역자율방재단 및 특수자율방재단의 구성·운영 및 지원 근거를 마련하고 전국자율방재단연합회의 설립 근거를 마련하는 내용을 개정안에서 신설하고 있습니다.,
n_id.92,o_id.7,수석전문위원 박수철,현행법 체계에 따르면 자율방재단 운영 등에 관한 사항은 자연재해대책법에 규정이 되어 있습니다. 따라서 자율방재단 활동 범위가 자연재해로 한정되는 부분이 있는데 이 법에서 규정할 경우에는 자연재해 이외에도 사회재난에 대해서 자율방재단과 전국자율방재단연합회 등이 활동할 수 있는 근거가 마련된다는 점이 있다고 보여집니다.,
n_id.93,o_id.7,수석전문위원 박수철,유인물 148쪽과 149쪽을 봐 주시면 현행법 체계로 보면 앞서 보고 올린대로 자연재해대책법에 지역자율방재단 구성과 149쪽의 전국자율방재단연합회에 관련된 사항들을 규정하고 있는데 이 부분을 삭제하면서 이 법에 규정하는 방식을 정부안에서 취하고 있다는 보고를 올립니다.,
n_id.94,o_id.7,수석전문위원 박수철,"이러한 내용과 관련돼서는 검토의견 세 번째 줄에서 보시는 바와 같이 시·도지사가 시장·군수·구청장의 의견을 들어 특수재난업무 등을 전담할 단원을 선발하여 특수자율방재단을 구성·운영을 할 수 있도록 한 소위 이철우 의원님 안이 있습니다. 이철우 의원님 안은 제정법 형태로 자율방재단과 전국자율방재단연합회에 관련된 내용을 담고 있는데, 94쪽을 봐 주시면 제정법 형태로 자율방재단의 설치 및 운영에 관한 법률안을 이철우 의원님께서 발의를 하시고 계십니다.",
n_id.95,o_id.7,수석전문위원 박수철,참고로 이철우 의원님 안을 보고를 올리면 이 안은 현행 시행령에 있는 내용과 함께 의용소방대 설치 및 운영에 관한 법률에서 규정하고 있는 내용들을 어떻게 보면 종합해 가지고 규정하는 방식을 취하고 있다 이렇게 보고를 올릴 수가 있습니다.,
n_id.96,o_id.7,수석전문위원 박수철,따라서 종합적으로 보고를 올리면 자율방재단과 관련돼서는 현행법 체계로는 자연재해대책법에서 규정하고 있고 재난 및 안전관리 기본법 정부 개정안에서는 자연재해대책법에 규정된 내용을 삭제하면서 이 법에 규정을 해서 사회재난의 경우에도 활동할 수 있도록 하며 이철우 의원님 안의 경우에는 별도로 제정법률안을 제정하는 방식을 취하고 있다 이렇게 요약해서 보고를 올릴 수 있습니다.,
n_id.97,o_id.7,수석전문위원 박수철,그리고 앞서 보고올린 대로 특수자율방재단의 구성·운영과 관련돼서는―유인물 99쪽 4항 부분입니다―'특별시장 등은 필요한 경우 자율방재단의 단원 중에서 특수재난업무 등을 전담할 단원을 선발해서 특수자율방재단을 구성·운영할 수 있다' 이 내용을 담고 있는데 규정 방식과 형태로서는 이 내용이 타당하다고 봐서 만일에 정부안을 입법정책적으로 수용하시는 경우에도 이 관련된 부분들을 참고하실 필요가 있다라고 생각이 됩니다.,
n_id.98,o_id.7,수석전문위원 박수철,69쪽 보고를 올리겠습니다.,
n_id.99,o_id.7,수석전문위원 박수철,정부안에서 담고 있는 내용으로 지시 위반 등에 따른 징계 요구 대상이 되는 재난 관리 업무의 범위에 재난 예방조치 및 재난 복구를 포함시키는 한편 지시 위반 등 사실 입증을 위한 조사 시에 전담기구를 편성하도록 하는 내용을 담고 있습니다. 징계 요구를 할 수 있는 사유가 확대됨에 따라서 재난 관리 업무에 보다 더 철저를 기할 수 있는 효과는 있다고 보여집니다.,
n_id.100,o_id.7,수석전문위원 박수철,다만 69쪽 검토의견에서 보시는 바와 같이 개정안과 같이 전담기구를 편성하도록 하는 경우에 현실적으로 기초지방자치단체에서 이 부분을 수용하기가 어려운 점도 있을 수 있으므로 '전담기구를 편성하는 등'으로 법문을 수정해서 탄력적으로 대처하게 할 필요성이 있다고 보아서 수정의견을 제시하였다는 보고를 올리겠습니다.,
n_id.101,o_id.7,수석전문위원 박수철,유인물 72쪽 이하 부분을 보고드리겠습니다.,
n_id.102,o_id.7,수석전문위원 박수철,먼저 72쪽 부분은 지난번에 위원님들께서 자연재난 정의 부분에 이명수 의원님께서 발의해 주신 폭염을 포함시키는 내용을 계속 심사하기로 한 바 있습니다. 그런데 이와 관련해서는 정병국 의원님하고 김두관 의원님 안에서 혹한·폭한 등을 추가시키고 있다라고 하는 보고를 올리겠습니다.,
n_id.103,o_id.7,수석전문위원 박수철,77쪽 부분도 지난번에 심사를 하신 내용이 되겠습니다.,
n_id.104,o_id.7,수석전문위원 박수철,사회재난의 정의에 북한의 각종 행위로 인한 접경지역에서의 피해를 포함시키도록 하는 내용이 되겠는데 이 부분과 관련돼서는 유인물 77쪽 소위 심사 경과에서 보시는 바와 같이 북한 측 행위에 대한 접경지역 피해 보상을 위한 입법적 대안 모색을 위해 민방위기본법 등에 의한 보상 가능성 검토 및 타 법령 개정 방안에 대해서 정부 측으로부터 보고를 받을 필요가 있다는 의견이 있으셨음을 보고올리겠습니다.,
n_id.105,o_id.7,수석전문위원 박수철,80쪽 되겠습니다.,
n_id.106,o_id.7,수석전문위원 박수철,"기동민 의원께서 발의해 주신 내용도 지난번에 심사를 하셨던 내용이 되겠습니다. 각종 재난 발생 시에 중앙대책본부장과 시장·군수·구청장의 동원명령 등의 요청 시에 대응기관이 의무적으로 이에 따르도록 하고 있는 내용인데요, 재난관리책임기관의 장이 불가피하게 요청에 따를 수 없는 경우도 감안해야 된다는 위원님들의 의견 제시가 있으셨다는 보고를 올리겠습니다.",
n_id.107,o_id.7,수석전문위원 박수철,"82쪽, 이우현 의원님께서 발의해 주신 내용으로 재난으로 인해 신체적·정신적 피해를 입은 국민들에게 양질의 의료서비스를 제공하기 위해서 재난 발생에 따른 특수 질환에 대한 치료법 연구 등을 전문적으로 수행하는 재난 대응 의료기관 설치에 대한 법적 근거를 마련하는 내용이 되겠습니다. 이와 관련돼서도 계속 심사가 필요하다는 의견을 모으셨습니다.",
n_id.108,o_id.7,수석전문위원 박수철,85쪽 이하 부분은 지난번에 위원님들께서 심사를 하시면서 대안으로 채택하는 경우에 반영하기로 한 내용이 되겠습니다.,
n_id.109,o_id.7,수석전문위원 박수철,85쪽에서 보시는 바와 같이 '시달'을 '통보'로 변경하는 내용과 함께 유인물 90쪽에서 안전취약계층의 안전 증진 및 안전 관리 강화를 하는 이종명 의원님께서 제시해 주신 그 내용은 대안에 반영할 수 있다라고 하는 의견으로 지난번에 소위 의견을 모으셨다는 보고를 드리겠습니다.,
n_id.110,o_id.7,수석전문위원 박수철,이상입니다.,
n_id.111,o_id.8,소위원장 박남춘,수석전문위원 수고하셨습니다.,
n_id.112,o_id.8,소위원장 박남춘,이것을 하나하나씩 정부 측 의견을 듣고 위원님들 의견을 들어서 결정을 하고 가지요. 그게 좋겠지요?,
n_id.113,o_id.8,소위원장 박남춘,그러면 지방자치단체 재난안전사업 투자 현황 수집·분석 근거 마련 이 조항에 대해서 정부 측 의견 말씀해 주시기 바랍니다.,
n_id.114,o_id.9,국민안전처차관 이성호,"전문위원께서 잘 검토해 주신 대로 그 의견에 동의를 하고, 지자체에서 실시하는 재난 안전 예산에 대해서도 정부에서 현황 자료를 제출받아서 차후에 재난을 분석하고 조치하고 정책을 하는 데 이바지하려고 생각을 하고 있습니다. 전문위원 의견에 동의를 합니다.",
n_id.115,o_id.10,소위원장 박남춘,"위원님들, 의견 있으시면 말씀해 주시기 바랍니다.",(｢의견 없습니다｣ 하는 위원 있음)
n_id.116,o_id.10,소위원장 박남춘,그러면 전문위원 검토의견대로 하도록 하겠습니다.,
n_id.117,o_id.10,소위원장 박남춘,다음은 특정관리 대상 시설 등 관련 조항을 삭제하는 건에 대해서 정부 측 의견 말씀해 주시기 바랍니다.,
n_id.118,o_id.11,국민안전처차관 이성호,"지금 이 안도 국토부하고 다 협조가 됐기 때문에 전문위원 검토의견에 동의를 하고, 다만 시행일을 국토부에서 요구한 대로 공포 후 1년이 경과한 날부터 시행하도록 하는 것이 좋을 것 같습니다.",
n_id.119,o_id.12,소위원장 박남춘,"위원님들, 의견 있으십니까?",(｢없습니다｣ 하는 위원 있음)
n_id.120,o_id.12,소위원장 박남춘,"이 문제가 말이지요, 시설뿐만 아니라 지역도 현행법상 포함되는 것 아닙니까?",
n_id.121,o_id.13,수석전문위원 박수철,'등'으로 되어 있기 때문에 그렇습니다.,
n_id.122,o_id.14,소위원장 박남춘,그러면 이것이 시설은 국토교통부 소관으로 이관이 되는데 지역에 대해서는 특정관리 대상으로 지정하고 관리할 근거가 사라지는 것이잖아요.,
n_id.123,o_id.15,국민안전처차관 이성호,"시설물하고 건축물도 다 함께 이관이 되는 사항인데, 크게 문제는 없을 것 같습니다.",
n_id.124,o_id.16,소위원장 박남춘,"아니, 그런데 지금 이 법상으로는 시설만 이관이 되는 것이잖아요. 지역에 대한 언급이 없지 않습니까, 이것 검토가 선행되어야 될 것 같은데요?",
n_id.125,o_id.16,소위원장 박남춘,"수석전문위원님, 어떻게 생각하세요? ",
n_id.126,o_id.17,수석전문위원 박수철,"저희도 지난번 검토의견에서, 검토보고서에서 그런 부분들을 제시한 적 있습니다. 지역 부분이...... ",
n_id.127,o_id.18,소위원장 박남춘,"글쎄요, 이것은 그래서 검토를 한번 선행해 보고 그게 지역이 빠져도 문제가 없는 건지에 대한...... ",
n_id.128,o_id.19,수석전문위원 박수철,실무적으로 답변하실 분 있으면 답변하시지요.,
n_id.129,o_id.20,국민안전처차관 이성호,지금 이 사항은 시설이라든가 건축물에 해당되는 사항이기 때문에 지역은 여기에 연결이 안 되어 있습니다. ,
n_id.130,o_id.21,국민안전처안전기획과장 김광용,안전기획과장 답변드리겠습니다. ,
n_id.131,o_id.22,소위원장 박남춘,"예, 말씀 한번 해 보세요. ",
n_id.132,o_id.23,국민안전처안전기획과장 김광용,현재까지 지역과 관련해서는 현재 법 조문에는 있었습니다마는 지정돼서 관리되고 있는 내용이 없기 때문에 시특법으로 넘어가도 문제가 없다고 판단을 하고 있습니다. ,
n_id.133,o_id.24,소위원장 박남춘,"아니, 사례가 없어서, 지금까지 그 선례가 없어서 그런 겁니까 아니면...... 가능성이 있는 거잖아요, 지역에 대한 지정도?",
n_id.134,o_id.24,소위원장 박남춘,"글쎄요, 지난번에도 이게 검토의견에 그런 게 있었는데...... ",
n_id.135,o_id.25,국민안전처안전기획과장 김광용,저희들이 제도는 있었지만 실질적으로......  ,
n_id.136,o_id.26,소위원장 박남춘,"아니, 그러니까 그렇게 적당히 답변하실 게 아니고 한번 이것은 점검을 해 보세요. 이것을 오늘 최종 결론 내기 전까지 검토를 한번 해서 의견을 주세요.",
n_id.137,o_id.26,소위원장 박남춘,수석전문위원님! ,
n_id.138,o_id.27,수석전문위원 박수철,예.,
n_id.139,o_id.28,윤재옥 위원,"차관님, 국토부하고 협의할 때 이런 이야기는 없었나요, 서로? ",
n_id.140,o_id.28,윤재옥 위원,지금 이 법안을 국토위하고 안행위하고 같이 겹쳐 있기 때문에 부처끼리도 협의되고 다 이야기된 것을 지금 이런 식으로 하면 안 되지요.,
n_id.141,o_id.29,수석전문위원 박수철,제가 좀 추가적으로...... ,
n_id.142,o_id.30,소위원장 박남춘,"예, 한번 말씀해 보세요. ",
n_id.143,o_id.31,수석전문위원 박수철,"일단은 시설물 자체는 결과적으로 국토교통부로 일원화되기 때문에 기본적인 방향은 이렇게 가야 된다고, 윤재옥 의원님께서 발의하신 이 내용대로 가야 된다고 봅니다. 그것은 분명하다고 보여지고요.",
n_id.144,o_id.31,수석전문위원 박수철,"다만 현행법 규정으로 봤을 때 '시설물 등'으로 되어 있어 가지고 '등'에는 지역이 포함되는 부분이 있습니다. 그래서 그 부분에 대해서 문제가 없느냐라고 저희가 정부 측에 몇 차례 확인 요청했습니다. 그런데 아까 보고하신 대로 지금 지정된 부분이 없기 때문에 지역이 빠지더라도 별 문제는 없습니다라고 저희 쪽에 그렇게 설명을 했고 오늘도 그렇게 답변을 하고 있는데, 그 부분에 대해서는 위원님 저희가 다시 한번 점검해 보고 문제가 없다고 하면...... ",
n_id.145,o_id.32,소위원장 박남춘,"그러니까 이게 2007년도 1월 달에 이 법을 개정할 때 그때는 시설만 되어 있었던 걸 지역으로 확대했던 거예요, 법 개정하면서. ",
n_id.146,o_id.32,소위원장 박남춘,그런데 이게 갑자기 또 이번에 그 법의 개정 취지나 선례를 다 검토가 충분히 되지 않고 또 시설로만 한정해서 국토교통부로 일원화하라 하는 게 내가 보기에는 맥락이 안 맞는다는 생각이 들어서 한번 점검이 필요하다는 것입니다. ,
n_id.147,o_id.33,수석전문위원 박수철,"예, 다시 한번 짚어 보겠습니다. ",
n_id.148,o_id.34,소위원장 박남춘,"예, 한번 해 보세요. ",
n_id.149,o_id.35,윤재옥 위원,그리고 그것은 오늘 심사 끝나기 전에 결론을 내려야 됩니다. ,
n_id.150,o_id.36,수석전문위원 박수철,물론입니다.,
n_id.151,o_id.37,소위원장 박남춘,다음. ,
n_id.152,o_id.38,국민안전처차관 이성호,"위원장님, 그것 관련되어 가지고 지금 이제 저희들이 전환하려는 것이 시설물의 안전관리에 관한 특별법이거든요. 그 법 자체에 지역은 빠져 있습니다. '시설물'로 되어 있기 때문에 '등'에도 지역이 포함이 안 되는 걸로 지금 국토부하고 얘기를 하고 있습니다. ",
n_id.153,o_id.39,수석전문위원 박수철,"그게 아니라 현행법에 지역이 있다는 것이지요, 현행법이.",
n_id.154,o_id.40,소위원장 박남춘,현행법 내에 지역이 포함되어 있어요. 그런데 그것은 놔두고...... ,
n_id.155,o_id.40,소위원장 박남춘,그러면 지역은 어떻게 할 겁니까? 그러니까 그것에 대한 검토를 해야 된다는 거예요. 그래서 그게 선례가 없어서 그렇다면 지역 자체도 아예 없애는 개정안을 담든지 그래야 되지 않겠어요? 그런 얘기입니다.,
n_id.156,o_id.41,황영철 위원,잠깐만요. 지금 현행법 27조에 보면 27조 1항에 '인정되는 시설 및 지역을 대통령령으로 정하는 바에 따라 특정 관리대상 시설 및 지역' 해 놓고 '이하 특정관리대상시설등'이라고 했단 말이에요. ,
n_id.157,o_id.42,소위원장 박남춘,글쎄요.,
n_id.158,o_id.43,황영철 위원,"그러면 '특정관리대상시설등'으로 하면 거기에 지역의 개념이 포함됐다고 볼 수 있는 거잖아요, 그렇지요?",
n_id.159,o_id.44,수석전문위원 박수철,"예, 그렇습니다. ",
n_id.160,o_id.45,황영철 위원,그러면 그렇게 해서 정리를 하면 되지요.,
n_id.161,o_id.46,수석전문위원 박수철,이게 삭제를 하면서 시특법으로 가는 겁니다. ,
n_id.162,o_id.47,황영철 위원,그러면 거기에다 이것을...... ,
n_id.163,o_id.48,수석전문위원 박수철,시특법이 시설물을......  ,
n_id.164,o_id.49,황영철 위원,특정관리대상시설의 개념에 시설 및 지역 이렇게 해서 거기에다 포함시키는 것으로 해서 조항에 넣어 주면 되지 않아요? ,
n_id.165,o_id.50,수석전문위원 박수철,그 법 자체는 시설물법이기 때문에...... ,
n_id.166,o_id.51,황영철 위원,"좀 어려움이 있긴 있네요, 진짜. ",
n_id.167,o_id.52,소위원장 박남춘,"글쎄, 그래서 그 관계를 한번 검토해 보세요. 그게 빠진 것 같아서...... ",
n_id.168,o_id.53,윤재옥 위원,끝나기 전에 정리해서 결론을 내려요. ,
n_id.169,o_id.54,소위원장 박남춘,끝나기 전에 결론을 내리자고요. ,
n_id.170,o_id.54,소위원장 박남춘,"자, 다음은 재난관리책임기관의 기능연속성계획 수립 근거 마련에 대한 정부 측 의견 말씀해 주세요. ",
n_id.171,o_id.55,국민안전처차관 이성호,동의합니다. ,
n_id.172,o_id.56,소위원장 박남춘,위원님들 의견 있으십니까? ,(｢없습니다｣ 하는 위원 있음)
n_id.173,o_id.56,소위원장 박남춘,의견 없습니까? ,(｢예｣ 하는 위원 있음)
n_id.174,o_id.56,소위원장 박남춘,넘어가지요. ,
n_id.175,o_id.56,소위원장 박남춘,다음 국가기반시설 보호계획 수립 등 근거 마련에 대한 정부 측 의견 말씀해 주시기 바랍니다. ,
n_id.176,o_id.57,국민안전처차관 이성호,보호 및 관리 실태를 점검하는 의무를 더 명확히 정리했기 때문에 전문위원 의견에 동의를 합니다. ,
n_id.177,o_id.58,소위원장 박남춘,위원님들 의견 있으십니까? ,(｢없습니다｣ 하는 위원 있음)
n_id.178,o_id.58,소위원장 박남춘,전문위원 의견에 동의하시는 거로요. ,
n_id.179,o_id.58,소위원장 박남춘,다음 국민안전처장관 등의 재난사태가 선포된 지역에 대한 휴업명령 및 휴원·휴교처분 요청에 대한 정부 측 의견 듣겠습니다. ,
n_id.180,o_id.59,국민안전처차관 이성호,"예, 동의합니다. ",
n_id.181,o_id.60,소위원장 박남춘,위원님들 다른 의견 없으십니까? ,(｢예｣ 하는 위원 있음)
n_id.182,o_id.60,소위원장 박남춘,다음 응급조치 관련 대통령령 위임 근거 규정 마련에 대한 정부 측 의견 듣겠습니다. ,
n_id.183,o_id.61,국민안전처차관 이성호,동의합니다. ,
n_id.184,o_id.62,소위원장 박남춘,위원님들 다른 의견 없으십니까? ,(｢예｣ 하는 위원 있음)
n_id.185,o_id.62,소위원장 박남춘,다음은 기상청장이 긴급재난문자 등을 발송할 수 있는 법적 근거 마련에 관한 정부 측 의견 듣겠습니다. ,
n_id.186,o_id.63,국민안전처차관 이성호,"현재 지진이라든가 이것에 대해서는 기상청에 11월 21일부로 전환을 해서 통지를 하고 있고, 다만 기상청장이 응급조치 할 수 있는 그것은 없기 때문에 전문위원이 검토한 대로 그 사항에 동의를 하고 있습니다. ",
n_id.187,o_id.64,소위원장 박남춘,위원님들 다른 의견 있으십니까? ,(｢없습니다｣ 하는 위원 있음)
n_id.188,o_id.65,표창원 위원,수정안이 좋을 것 같습니다. ,
n_id.189,o_id.66,소위원장 박남춘,그러면 전문위원 검토의견에 동의하시는 거지요?,(｢예｣ 하는 위원 있음)
n_id.190,o_id.66,소위원장 박남춘,다음 안건 심의하겠습니다. ,
n_id.191,o_id.66,소위원장 박남춘,긴급신고전화 통합·연계 체계 구축에 대한 정부 측 의견 듣도록 하겠습니다. ,
n_id.192,o_id.67,국민안전처차관 이성호,동의합니다. ,
n_id.193,o_id.68,표창원 위원,제가 한 말씀만 참고로 남겨 드리고 싶은 게 지금 3개로 통합됐지 않습니까? ,
n_id.194,o_id.69,국민안전처차관 이성호,예. ,
n_id.195,o_id.70,표창원 위원,그런데 여전히 112와 119 통합에 대한 논의는 현재 진행형이지요?,
n_id.196,o_id.71,국민안전처차관 이성호,다 통합이 됐습니다. ,
n_id.197,o_id.72,표창원 위원,112와 119요.,
n_id.198,o_id.73,국민안전처차관 이성호,예.,
n_id.199,o_id.74,표창원 위원,지금 3개로 나누어져 있지 않습니까? 112와 119는 분리되어 있는 거고요.,
n_id.200,o_id.75,국민안전처차관 이성호,"예, 그렇습니다. ",
n_id.201,o_id.76,표창원 위원,"그런데 대개 선진국은 미국도 911, 영국은 999, 대부분은 다 하나로 통합되어 있거든요. 왜냐하면 119를 찾아야 할지 112를 찾아야 할지 시민들이 잘 구분하지 못하는 사람들이 너무 많습니다. ",
n_id.202,o_id.76,표창원 위원,그런데 문제는 경찰과 소방 간에 서로 누구 쪽으로 통합되느냐의 주도권 때문에 통합이 안 되고 지금 수십 년째 논의가 진행 중이거든요. 알고 계시지요? ,
n_id.203,o_id.77,국민안전처차관 이성호,"누구 때문에, 주도권 때문에 통합이 안 된 것이 아니고 저희들이 하기 전에 전부 여론조사를 했는데 국민들께서 112나 119에 대한 인지도가 똑같습니다, 거의. 그래서 어느 번호든지 다 알고 계시다 하기 때문에 구태여 통합할 필요가 없지 않느냐 해 가지고...... ",
n_id.204,o_id.78,표창원 위원,"차관님, 그 부분은요 조금 알아보시기 권고해 드립니다. 그냥 즉흥적으로 답하실 게 아니고요.",
n_id.205,o_id.79,국민안전처차관 이성호,아닙니다. ,
n_id.206,o_id.80,표창원 위원,제가 조금만 더 말씀드릴게요.,
n_id.207,o_id.80,표창원 위원,"이 분야에 대해서만큼은, 차관님이야 군의 전문가이시지만 저는 민간, 재난안전에 대해서 연구하고 살아온 사람이거든요. 그리고 이 119와 112 통합에 대해서는 무수한 실무 협의를 해 왔습니다, 이제까지. ",
n_id.208,o_id.80,표창원 위원,그런데 그 이면에 사실 기관 간 알력이 있음은 부인할 수 없는 사실이고요. 왜 그러느냐 하면 국민의 인지도 문제가 아닙니다. 국민이 112를 많이 아느냐 119를 많이 아느냐 하는 문제가 아니란 말이에요. 무슨 말씀인지 아세요? ,
n_id.209,o_id.80,표창원 위원,119와 112가 나누어져서 가장 큰 문제가 뭔지 아십니까? ,
n_id.210,o_id.81,국민안전처차관 이성호,...... ,
n_id.211,o_id.82,표창원 위원,뭔지 아시냐고요.,
n_id.212,o_id.83,국민안전처차관 이성호,잘 모르겠습니다. ,
n_id.213,o_id.84,표창원 위원,그런데 뭘 국민의 인지도 때문에 분리하는 게 낫다고 말씀하십니까? ,
n_id.214,o_id.84,표창원 위원,"가장 큰 문제는 뭐냐 하면, 조금 전에 제가 말씀드렸잖아요. 국민이 어떤 번호로 부르든지 처음에 받는 사람이 누구냐에 따라서 어느 기관 서비스로 연결해 줘야 할지가 결정되어야 합니다, 그렇지요?",
n_id.215,o_id.85,국민안전처차관 이성호,예. ,
n_id.216,o_id.86,표창원 위원,"처음에 소방이 먼저 나가야 할지 경찰이 먼저 나가야 할지, 그렇지요? 때로는 같이 나가야 할 때도 많고요. ",
n_id.217,o_id.87,국민안전처차관 이성호,예.,
n_id.218,o_id.88,표창원 위원,"그런데 이게 두 번호가 분리되어 있다는 것은 119로 신고전화를 하면 119 측에서 '112에 다시 전화하세요'라고 하시든지―현장에서 실제 벌어지는 일이에요―반대로 112에 전화했는데 접수요원이 '119로 다시 전화하세요'라고 안내를 합니다. 그렇지 않다면 접수한 이후에 그 기관에서 통보를 해서 출동 요청을 하는 경우가 있습니다, 그렇지요? ",
