new_id,ori_id,speaker,utterance,note
n_id.413,o_id.276,안규백 위원,"아니, 병무청에서 짜게 했겠지. 예컨대 직원들 10명 나가야 되는데 5명 보낸다든가 그렇겠지.",
n_id.414,o_id.277,송영근 위원,이거 몇 푼 되지도 않은 거 왜 남겼냐 이거지.,
n_id.415,o_id.278,병무청자원관리과장 최성원,"여기에 있는 2억 정도의 예산액은 병무청 전체 국외여비 총액이고요, 저희들 금년도에 했던 것은 예산액 1500만 원입니다. 시애틀하고 샌프란시스코 그다음에 애틀랜타, 밴쿠버, 네 군데 다녀온 예산은 1500만 원이었습니다. ",
n_id.416,o_id.279,안규백 위원,국외 여비가 2억 5900뿐이 안 돼요?,
n_id.417,o_id.280,병무청자원관리과장 최성원,저희 병무청 사업 분야 말고 전체적인 국외 출장 여비가 2억 6000이라는 얘기입니다.,
n_id.418,o_id.281,안규백 위원,"병무청은 외국 출장도 안 나갑니까? 아니, 꼭 선진 문물만 가서 보고 오는 것이 아니에요. 후진국도 가서 많이 보고 배우고 오는 거예요. 우리보다 선진국이 몇 군데 안 되잖아요. 후진국도 많이 가서 보고 오고, 남은 예산으로 가보고 해야지, 그쪽 동네 세계가 어떻게 되는가 보고 해야지. 좀 더 직원들 많이 보내세요.",
n_id.419,o_id.282,병무청차장 김노운,"예, 앞으로 그렇게 하도록 하겠습니다.",
n_id.420,o_id.283,송영근 위원,"그래, 이것 돈 남길 필요 없어.",
n_id.421,o_id.284,소위원장 김성찬,시정을 그렇게 해 주시기 바랍니다. ,
n_id.422,o_id.285,전문위원 권기원,잠깐 말씀드리겠습니다.,
n_id.423,o_id.285,전문위원 권기원,이것은 국외여비 부분이기는 한데 사실 여러 가지 상황이 있어서 2012년도 결산에서도 지적이 있었습니다. 전체적으로 예산 집행......,
n_id.424,o_id.286,안규백 위원,"뭐라고요, 2012년 뭐라고? ",
n_id.425,o_id.287,전문위원 권기원,"2012년도 결산에서도, 그때 전년도 결산에서도...... 아, 2013년도입니다. 예산 집행 실적이 부진하다는 지적이 있었고, 금년도에는 전년도에 비해서 예산 집행 실적은 조금 더 상승되었습니다.",
n_id.426,o_id.287,전문위원 권기원,그리고 또 앞으로 병무청 전체적으로 국외여비 활동을 충실하게 하기 위해서 여기서 저희들이 지적하는 것은 조금 부담이 되는 사항이 있습니다. ,
n_id.427,o_id.288,안규백 위원,"아니, 부담이 아니라 이 일이라는 게, 꼭 이것만 하라고 연관된 일이 아니니까 각 실·국에서 우수 자원들, 열심히 일한 직원들 인센티브를 주기 위해서도 이런 제도를 활용하세요. ",
n_id.428,o_id.289,전문위원 권기원,"예, 알겠습니다. 그러면 위원장님 말씀대로 그렇게 하겠습니다.",
n_id.429,o_id.290,소위원장 김성찬,"집행 실적이 부족하다고 지적하는 게 아니고 충분한, 필요한 예산을 편성하여 선진 병무행정을 잘 보고 오라고 지금 지적하는 겁니다. 아시겠지요?",
n_id.430,o_id.291,병무청차장 김노운,예.,
n_id.431,o_id.292,소위원장 김성찬,"돈을 안 썼다고 지적하는 게 아니고 잘해라 하는 부분이니까 필요하면 예산을 많이 편성해서라도...... 그렇다고 불요불급한 데 하면 안 되지만, 병무청 아시겠지요?",
n_id.432,o_id.293,전문위원 권기원,그러면 시정요구 유형은 제도개선으로 됩니까? ,
n_id.433,o_id.294,소위원장 김성찬,이 정도면 주의 정도로 하시는 게 어떻겠습니까?,(｢예｣ 하는 위원 있음)
n_id.434,o_id.294,소위원장 김성찬,주의로 한 단계 낮춰서...... ,
n_id.435,o_id.295,전문위원 권기원,"예, 알겠습니다.",
n_id.436,o_id.296,소위원장 김성찬,14번 설명하세요. ,
n_id.437,o_id.297,전문위원 권기원,16쪽입니다.,
n_id.438,o_id.297,전문위원 권기원,"14번, 성과 목표치의 적극적 설정 미흡 부분입니다.",
n_id.439,o_id.297,전문위원 권기원,지적사항으로는 두 번째 단락에서 보충역 분야별 복무만족도를 보면 사회복무요원은 83%로 전년 대비 0.4%p 상승한 반면 산업지원인력 중 전문연구요원은 85.4%로 전년 대비 3.6%p 하락하였고 산업기능요원은 81.7%로 전년 대비 0.9%p 하락한 것으로 나타나고 있습니다. ,
n_id.440,o_id.297,전문위원 권기원,산업지원인력의 복무만족도가 전반적으로 하락하였음에도 불구하고 2014년 목표달성률이 100%를 초과하고 있는 것은 당초에 목표 설정이 최근 실적의 평균치를 반영한 것으로 병무청의 실적개선 노력과 상관없이 목표를 달성할 수 있을 정도로 지나치게 소극적으로 설정되어 있는 것으로 보입니다. 감사원 결산검사보고서에도 지적된 바 있습니다. ,
n_id.441,o_id.297,전문위원 권기원,시정요구사항은 사업성과를 적극적으로 개선하기 위한 의미 있는 목표치를 설정하여 성과관리업무를 철저히 할 것으로 했습니다. ,
n_id.442,o_id.297,전문위원 권기원,시정요구 유형 수준은 주의입니다.,
n_id.443,o_id.297,전문위원 권기원,이상입니다.,
n_id.444,o_id.298,송영근 위원,"아니, 이것은 내가 볼 때 성과분석을 어떤 기준으로 했는지 그것은 내가 잘, 그것은 기준이 있을 것 아니에요, 그렇지요? 어떤 기준으로 했는지는 잘 모르겠는데 내가 보기에는 오히려 병무청이 잘했다는 생각이 드는데?",
n_id.445,o_id.298,송영근 위원,"또 하나, 하다 보니까 떨어진 것은 떨어졌다고 그래야지, 만약에 이것을 계속 자랑스러워한다 그러면 계속 올라가기만 해요, 분석이 조작된다고. 그래서 나는 이런 분야는 수치가 얼마 떨어졌다 그래 가지고 이것이 잘못됐다고 평가되는 것은 바람직하지 않다, 그래서 수치에 얽매이지 않고 객관적으로 평가해서 하도록 해야지 이것을 주의 주고 그래 버리면 실무자들이 위축돼 가지고 허위 분석해, 내가 실무 경험할 때 보면. 그래서 이것은 주의 주고 그러면 오히려 위축될 텐데. 수치가 떨어졌다고 그래 가지고 이것을 따진다는 것은 난 아니라고 보는데?",
n_id.446,o_id.299,진성준 위원,"아니, 그런데 목표치를 의미 있게 높이 설정해야지 말이야, 미리부터 낮게 설정해 놓고 이 정도면 다 잘됐다 이러면 되겠습니까? 복무만족도를 한 85% 달성하겠다 이렇게 해서 덤벼야지요.",
n_id.447,o_id.300,병무청차장 김노운,"위원님, 저희들이 이것 설정할 때 고민스러웠던 것이, 아까 제가 얘기했지 않습니까? 전문연구요원 같은 경우 중소기업, 중견기업에 배정되겠지요? 산업기능요원은 보충역이 늘었지 않습니까? 그러니까 저희들이 생각했던 목표치에 달성하기가 참 쉬운 것은 아니었습니다. 그래서 궁여지책으로 저희들이 이렇게 만들어 놓은 것인데요. 조금 부족하다 하더라도 넓게 봐 주시면 고맙겠습니다. ",
n_id.448,o_id.301,진성준 위원,충분히 이해는 하는데......,
n_id.449,o_id.302,송영근 위원,"내 생각에는 이것은 주의까지는 그렇고 제도개선 정도로 해 가지고 이것을 관심 가지고, 그런데 이런 것을 갖다가 국회에서 '너 수치가 왜 떨어졌어?' 하고 자꾸 따지게 되고 그런다면 위축시켜요.",
n_id.450,o_id.303,소위원장 김성찬,그러면 정리를 이렇게 한번 해 보겠습니다.,
n_id.451,o_id.303,소위원장 김성찬,"그런데 진성준 위원이 말씀하신 대로 실제 산업지원인력 복무만족도가 떨어졌음에도 불구하고, 아까 안규백 위원님도 산업지원 그 부분에 문제가 많다 했음에도 불구하고 만족하였다라고 포괄적으로 나오니 이게 정확한 성과, 편성에 있어서 문제가 있지 않느냐 볼 수 있거든요.",
n_id.452,o_id.303,소위원장 김성찬,"그러니까 이것을 조금 세분화해서 어디가 성과가 미흡했는가 하는 부분은 살펴볼 필요는 있을 것 같아요. 그런 모습으로 제도개선을 병무청에서 운영하면서 하는 게 어떻겠느냐 이런 생각이 드는데, 그래서 제도개선으로 해 주시기 바랍니다.",
n_id.453,o_id.304,병무청차장 김노운,예.,
n_id.454,o_id.305,안규백 위원,"병무청, 기본적으로 정책을 집행하시는 분들이 다른 위원회보다 너무 점잖고 또 원리원칙 기준만 가지고 하시는 것 같아. 뭔가 좀 과감하고 포지티브하게 하셔 가지고 일을 할 수 있도록 여건 조성을 저희 위원회에서 많이 해 드려야 될 것 같아, 보니까. 사람들마다 좋으셔 가지고 말이야.",
n_id.455,o_id.306,진성준 위원,우리 위원회에서는 병무청 많이 봐주는 것 아닙니까?,
n_id.456,o_id.307,안규백 위원,"그렇지, 그래서 지금 1시간 10분에 끝낸 거지. 그렇지 않으면 13번 같은 경우도 할 말이 많지.",
n_id.457,o_id.308,진성준 위원,"과감하게 하세요, 병무청 응원하고 있으니까.",
n_id.458,o_id.309,송영근 위원,"그래, 좀 과감하게 해.",
n_id.459,o_id.310,소위원장 김성찬,많이 봐줍니다.,
n_id.460,o_id.310,소위원장 김성찬,이것으로 항목별 심사가 모두 끝났습니다. ,
n_id.461,o_id.310,소위원장 김성찬,전문위원께서는 논의된 사항을 정리해 주기 바랍니다. ,
n_id.462,o_id.310,소위원장 김성찬,정리한 내용을 보고드리겠습니다.,
n_id.463,o_id.310,소위원장 김성찬,"1번 사항은 시정으로 하고, 2번 징병검사 재료는 제도개선으로 하겠습니다. 3번, 정신과 위탁검사 인원 관련해서는 국정감사 전까지 개선방안을 수립해서 관련 위원들께 보고를 하시면서 제도개선으로 해 주시고요. 4번 사항, 병사용 진단서는 그것을 가격을 낮추는 방안도 보건복지부와 협조해서 보고를 하면서 전반적인 내용을 시정해 주시고요. 5번 사항은 주의고, 6번은 시정하겠습니다. 7번도 시정을 요구합니다. 8번은 그냥 시정 없는 것으로 하겠습니다. 9번 사항은 제도개선 해 주시고요. 10번 사항도 제도개선 해 주시고, 11번 사항 산업인력 편입률 저조는 산업지원인력 운용제도를 존속시켜야 하는 필요성도 같이 검토를 하면서 효율적 운용방안을 같이 마련해 주시는 제도개선을 해 주시고요. 12번 사항은 주의, 13번 사항도 주의, 14번 사항은 제도개선으로 정리하겠습니다.",
n_id.464,o_id.310,소위원장 김성찬,방금 내용에 대해서 질의하실 위원님 계십니까? ,
n_id.465,o_id.311,진성준 위원,"여기 실무진들이 작성한 것을 보면 12번, 정보화사업 낙찰차액과 관련해서 시정에 체크가 되어 있네요? 시정이 아니고 주의지요?",
n_id.466,o_id.312,소위원장 김성찬,"잠깐만, 다시 한 번 보겠습니다. ",
n_id.467,o_id.313,전문위원 권기원,12번 주의 맞습니다. ,
n_id.468,o_id.314,소위원장 김성찬,"주의입니다, 주의.",
n_id.469,o_id.315,진성준 위원,"그렇지요? 시정으로 되어 있었습니다, 이게. 주의입니다.",
n_id.470,o_id.316,전문위원 권기원,조금 착오가 있었습니다. ,
n_id.471,o_id.317,소위원장 김성찬,이것 표가 잘못됐네. 주의라고 제가 말씀드렸고요.,
n_id.472,o_id.317,소위원장 김성찬,더 질의하실 위원님이 안 계시면 토론을......,
n_id.473,o_id.318,송영근 위원,한 가지만......,
n_id.474,o_id.319,소위원장 김성찬,"예, 질문하십시오.",
n_id.475,o_id.320,송영근 위원,차장.,
n_id.476,o_id.321,병무청차장 김노운,예.,
n_id.477,o_id.322,송영근 위원,"오늘 차장님이 오셨기 때문에, 어제 얘기한 것에 미룬 게 있는데 이번에 병역자원이 2만 얼마가 남아 가지고, 옛날에는 학력을 중졸 이하만 안 들어오게 되던 것을 중졸·고퇴까지 2만여 명을 산업기능요원이나 본부 대체요원으로 하기로 어제인가 신문에 났던데, 그렇지요?",
n_id.478,o_id.323,병무청차장 김노운,"예, 그렇습니다. ",
n_id.479,o_id.324,송영근 위원,"그런데 내가 보기에는 그것은 좀 첫 번째, 위헌적 소지가 있다, 헌법에는 학력이나 이런 것으로 인해 가지고서는 차별을 받지 아니하도록 되어 있어요. 그 사람이 공부를 덜 했다 그래 가지고 병으로 들어올 때 차별을 받게 만들어 놨어요, 제도적으로.",
n_id.480,o_id.324,송영근 위원,"두 번째는 꼭 그러지 않아도 내가 여건이 나빠 가지고, 공부도 못 하고 이래 가지고서는 아쉬운 마음으로 있는데, 군대를 오겠다는데 그것을 왜 막으려고 그래. 그렇지요? 다른 말로 하면 인권의 문제가 있어요, 작은 것 같지만 인권의 문제. 내 집안이 그래 가지고 공부는 좀 못 했지만 내가 가서 국가를 위해서 일하겠다고 오겠다는 것을 강제로 못 오게 한다는 것은 인권의 문제가 있단 말이야. 이것 작은 것 아니에요, 위헌적 소지가 있고 인권 침해의 소지가 있는 이 제도.",
n_id.481,o_id.324,송영근 위원,"그다음에 이것을 돌이켜 보면 반면에 전방에는 작년도만 해도 병역자원이 부족하니까 A급 문제 사병 8000여 명 정도가 현역에 근무하는 문제가 발생하기 때문에 그것을 조정하려면 문제가 많은 사병들을 안 들어오게 하고 그쪽으로 보내야지, 그렇지요?",
n_id.482,o_id.325,병무청차장 김노운,예.,
n_id.483,o_id.326,송영근 위원,"이런 식으로, 산업지원기능요원으로 전환한다는 것은 신중하지 못했다...... 그래서 청장한테 하고 싶은 얘기인데 차장이 오셨으니까, 그것을 너무 쉽게 생각했다, 위헌적 요소, 인권 침해 요소, 그리고 효율성 문제에 있어서도 문제 사병을 그만큼 안 들어오게 하는 게 맞지.",
n_id.484,o_id.327,진성준 위원,백번 옳은 말씀입니다.,
n_id.485,o_id.328,송영근 위원,"그래서 그 문제는 병무청에서, 어제도 얘기했지만 '검토하겠습니다'이지요?",
n_id.486,o_id.329,병무청차장 김노운,고퇴·중졸을 보충역 처분하게 된 사항을 제가 간략하게 보고드리겠습니다.,
n_id.487,o_id.329,병무청차장 김노운,현재 우리가 병역자원이 1991년생부터 시작해서 95년생 사이에 연간 한 3만 명 정도가 더 증가됐습니다. 그리고 지금 군인 소요가 한 2만여 명이 줄었습니다. 그러다 보니까 현재 현역병 입영 적체 현상이 일어나고 있습니다. 그래서 이 부분들을 해소해 줌으로써 국민들에게 편익을 제공하고 민원 불편을 해소하자는 측면에서 저희들이 많은 고민과 고민을 했습니다. ,
n_id.488,o_id.329,병무청차장 김노운,그래서 그 결과 일단 우리가 지금 고퇴 이하 보충역을 처분해서 한 6000명 정도를 보충역으로 보내 주고요. 우리가 보통 징병검사 받으면 대학이라든가 1～3급 받은 사람과 비교를 해 보면 군 복무의 적응률은 오히려 고퇴·중졸 보충역들의 적응력이 굉장히 떨어집니다.,
n_id.489,o_id.330,송영근 위원,그것은 어디 통계예요? ,
n_id.490,o_id.331,병무청차장 김노운,저희들이 지금 현역 복무 부적합자......,
n_id.491,o_id.332,송영근 위원,그 통계 나한테 제출할 수 있어요? ,
n_id.492,o_id.333,병무청차장 김노운,"예, 있습니다.",
n_id.493,o_id.334,송영근 위원,"고졸 요원들이 현역 적응률이 떨어진다는 통계, 관련 근거와 데이터 나한테 줄 수 있어요?",
n_id.494,o_id.335,병무청차장 김노운,"예, 현재 병무청에 통보된 현역 복무 부적합자들을 학력별로 저희들이 분석해 보니까......",
n_id.495,o_id.336,송영근 위원,"그것을 나한테 명확한 데이터를 주시고, 이것은 아까 얘기한 대로 더 큰 차원에서 위헌적 요소를 내포하고 있다는 것하고 인권 침해 요소를 내포하고 있다는 것을 병무청에서 간과한 것 같다, 그 점을 우선 잘 따져 봐야 될 것이다......",
n_id.496,o_id.337,병무청차장 김노운,예.,
n_id.497,o_id.338,진성준 위원,"일반적 경향이 그럴 수는 있을지 모르겠는데 병역 판정 기준, 이를테면 현역 판정 기준을 일률적으로 학력으로만 하겠다고 하는 것은 과도하다는 거예요.",
n_id.498,o_id.339,병무청차장 김노운,그런데 지금 우리가 단편으로 나온 것은 학력이고요. 2차적으로는 저희들이 징병 신체검사 등 검사규칙을 재검토하고 있습니다. 그래서 군 복무 부적합되는 부분들을 어떻게 하면 좀 줄일 수 있는 방법이 없나......,
n_id.499,o_id.340,송영근 위원,"아니, 병역법이 상위법을 지금 침해하고 있는 제도가 나왔다는 거예요.",
n_id.500,o_id.341,병무청차장 김노운,위원님 말씀하신 뜻은 저희들이 이해를 합니다. 하는데......,
n_id.501,o_id.342,송영근 위원,"위헌적 요소와 인권 침해, 상위법을 지금 침해하는 이런 제도가 나왔다는 것을 간과하고 있다는 말이야.",
n_id.502,o_id.343,소위원장 김성찬,"백군기 위원님, 잠깐만 먼저 말씀하시고.",
n_id.503,o_id.344,진성준 위원,"의결해 주시고, 더 따로......",
n_id.504,o_id.345,소위원장 김성찬,의결하고 하시지요.,
n_id.505,o_id.345,소위원장 김성찬,아주 중요한 사항이기 때문에 이 내용을 전달하셔야 되고 전체회의 때 이 부분은 논의해야 될 필요가 있을 것 같습니다. ,
n_id.506,o_id.345,소위원장 김성찬,일단 오늘 소위 결산하고 또 말씀을 한번 듣겠습니다.,
n_id.507,o_id.345,소위원장 김성찬,2014회계연도 병무청 소관 결산에 대해서는 원안대로 의결을 하되 금일 위원님들께서 심사하신 대로 시정조치 요구사항을 첨부하여 의결하고자 하는데 이의 없습니까? ,(｢예｣ 하는 위원 있음)
n_id.508,o_id.345,소위원장 김성찬,가결되었음을 선포합니다.,
n_id.509,o_id.345,소위원장 김성찬,시정요구사항과 관련된 문구 조정은 관례대로 소위원장에게 위임해 주시기 바랍니다. ,
n_id.510,o_id.345,소위원장 김성찬,결산 의결과 관련해서 병무청차장 간단하게 인사해 주시기 바랍니다. ,
n_id.511,o_id.346,병무청차장 김노운,존경하는 김성찬 위원장님 그리고 여러 위원님!,
n_id.512,o_id.346,병무청차장 김노운,많은 관심과 애정을 가지시고 저희 병무청 2014회계연도 결산을 심도 있게 검토해 주신 데에 대하여 깊이 감사드립니다.,
n_id.513,o_id.346,병무청차장 김노운,오늘 심의과정에서 위원님들께서 지적해 주신 사항에 대해서는 항상 염두에 두고 효율적 예산 운영에 최선의 노력을 다하겠습니다.,
n_id.514,o_id.346,병무청차장 김노운,감사합니다. ,
n_id.515,o_id.347,백군기 위원,이것은 송영근 위원님 말씀하신 것에 아주 100% 공감하면서 그건 한번 깊이 있게 다시 연구할 필요가 있어요. 왜냐하면 지금 가용자원 중에서 93% 정도 지금 입소하잖아요?,
n_id.516,o_id.348,병무청차장 김노운,예.,
n_id.517,o_id.349,안규백 위원,90.2%...... ,
n_id.518,o_id.350,백군기 위원,하여튼 수치는 조금 다르겠지만 한 70%대에서 지금 90%대로 올라온 것 아니야? 그래서 그 부분을 특히 정신적으로 좀 허약한 사람들 이런 사람들에 대한 신체등급에 대한 것을 좀 조절해서 그것 가지고 이렇게 하는 것은 우리 국민들이 이해를 하는데 학력이나 이런 걸 가지고 하는 건 대단히 이해가 안 돼요.,
n_id.519,o_id.350,백군기 위원,그리고 내가 군대생활 하면서 보면 대졸자보다 고졸자 중에 훨씬 더 잘하는 애들도 있어. 많아. 그래서 그걸 학력으로 규정하는 것은 조금 문제가 있다라는 생각을 하니까 그 부분을 잘 검토해 주시기 바라고.,
n_id.520,o_id.350,백군기 위원,"그다음에 국방부에서 지금 병력 감축에 대한 부분을 2022년도에서 2030년까지 52만을 유지하는 걸로 이렇게 지금 했잖아요? 그 부분도 한번 좀...... 왜냐하면 지금 출산율이 저하돼서 2030년 정도 되면 가용자원이 20만 정도, 20만 6000 정도밖에 안 되는데 과연 52만을 유지하겠다고 하는 것이 이게 가능할 것이냐? 이것도 국방부하고 병무청이 잘 검토해서, 내가 이것은 국정감사 할 때 따져 보려고 그러는데 이것도 좀...... 지금 이미 발의가 됐잖아요, 국방부에서? 그래서 이 부분이 병무청하고 충분한 토의가 이루어졌는지 그것이 내가 지금 의심스러워요.",
n_id.521,o_id.350,백군기 위원,이상입니다.,
n_id.522,o_id.351,소위원장 김성찬,병무청 관계관 여러분 수고 많았습니다.,
n_id.523,o_id.351,소위원장 김성찬,이것으로 오늘 회의를 모두 마치겠습니다.,
n_id.524,o_id.351,소위원장 김성찬,내일 회의는 10시에 개의하면서 국방부 소관 결산 심사를 하도록 하겠습니다.,
n_id.525,o_id.351,소위원장 김성찬,산회를 선포합니다.,
